['closedAt'],['createdAt'],['title'],['url']
2021-6/2,2021-5/27,Ability to have hosts across Data Centers with minimum perf impact,https://github.com/vespa-engine/vespa/issues/18004
2021-6/2,2021-5/27,vespa-visit - queries ,https://github.com/vespa-engine/vespa/issues/18008
2021-6/9,2021-6/1,changing the location of the database,https://github.com/vespa-engine/vespa/issues/18061
2021-8/30,2021-6/1,Mutual TLS for internode communication ,https://github.com/vespa-engine/vespa/issues/18066
2021-6/7,2021-6/4,switch_primary_buffer: did not find a free buffer,https://github.com/vespa-engine/vespa/issues/18124
2021-8/23,2021-6/7,Improve allocation strategy for link arrays in HNSW index to reduce wasted address space,https://github.com/vespa-engine/vespa/issues/18153
2021-6/9,2021-6/8,vespa visit - java.lang.OutOfMemoryError: Java heap space,https://github.com/vespa-engine/vespa/issues/18165
2021-6/29,2021-6/10,Wanted to deploy highly available Vespa database,https://github.com/vespa-engine/vespa/issues/18194
,2021-7/7,Tool to check a cluster's status like Vespa Cloud's deploy output,https://github.com/vespa-engine/vespa/issues/18555
2021-7/9,2021-7/8,Cannot ReStart crashed Vespa,https://github.com/vespa-engine/vespa/issues/18576
2022-9/1,2021-7/12,Validate attribute references in grouping in the container,https://github.com/vespa-engine/vespa/issues/18590
2021-12/1,2021-7/12,Return query errors detected by proton in the response ,https://github.com/vespa-engine/vespa/issues/18591
2021-8/11,2021-7/15,download-mind.sh demo fails as downloaded resource no longer is available,https://github.com/vespa-engine/vespa/issues/18611
2021-8/11,2021-7/19,Range attributes of predicates still hitting in queries after being modified,https://github.com/vespa-engine/vespa/issues/18637
2021-9/17,2021-7/21,Vespa-config-status gives connection errors after configuring HTTP/2,https://github.com/vespa-engine/vespa/issues/18641
,2021-7/26,Consider adding http zstd compression ,https://github.com/vespa-engine/vespa/issues/18644
2022-5/18,2021-7/26,Better safeguarding for grouping requests over many unique values ,https://github.com/vespa-engine/vespa/issues/18645
2021-8/23,2021-7/27,Ability to load attribute data for re-ranking on-demand,https://github.com/vespa-engine/vespa/issues/18646
2021-12/7,2021-8/4,Bitwise hamming ranking feature for single order tensors with int8 cell type,https://github.com/vespa-engine/vespa/issues/18678
2022-2/17,2021-8/10,Open source Vespa Docker image no longer built by Docker Hub,https://github.com/vespa-engine/vespa/issues/18699
2021-8/25,2021-8/24,Vespa 8: Empty query handling,https://github.com/vespa-engine/vespa/issues/18838
2021-8/25,2021-8/25,how does vespa compress posting list?,https://github.com/vespa-engine/vespa/issues/18846
,2021-8/25,Add check for bundle name for components in services.xml to match artifactId during package step,https://github.com/vespa-engine/vespa/issues/18855
,2021-8/26,Support Create If Not Exists for Tensor Cells in Tensor Field Modifications,https://github.com/vespa-engine/vespa/issues/18869
2021-10/7,2021-8/27,SentencePiece Tokenizer,https://github.com/vespa-engine/vespa/issues/18881
2021-10/4,2021-8/27,Batching / Transformer-based Parallelization for Cross-Encoders,https://github.com/vespa-engine/vespa/issues/18882
2021-9/1,2021-8/30,Brute force nearest neighbor search operator scaling with num-threads-per-search and filter,https://github.com/vespa-engine/vespa/issues/18900
2021-9/3,2021-8/31,Empty dense tensor compact representation [] is expanded to 0-valued tensor,https://github.com/vespa-engine/vespa/issues/18909
,2021-8/31,Add document side equivalent of query-command,https://github.com/vespa-engine/vespa/issues/18910
2021-9/15,2021-9/10,Document erf(x),https://github.com/vespa-engine/vespa/issues/19077
2021-10/1,2021-9/12,Add stateless model evaluation parameters  ,https://github.com/vespa-engine/vespa/issues/19084
2021-9/22,2021-9/14,Searchnode health check fails,https://github.com/vespa-engine/vespa/issues/19121
,2021-9/21,Add a MultiRangeItem for efficient evaluation of multiple OR-ed range items on a common field (or two),https://github.com/vespa-engine/vespa/issues/19218
2021-10/6,2021-10/5,/opt/vespa/bin/vespa-status-filedistribution failed to run,https://github.com/vespa-engine/vespa/issues/19423
2022-1/24,2021-10/5,minikube quick start xhyve deprecated/removed,https://github.com/vespa-engine/vespa/issues/19426
2021-10/6,2021-10/6,"Config Model fails to configure storagenode and distributor: ""service that has not reserved any ports""",https://github.com/vespa-engine/vespa/issues/19429
2022-5/18,2021-10/6,Query time adaptive parallelization for retrieval and ranking with multiple threads per search,https://github.com/vespa-engine/vespa/issues/19432
2022-1/9,2021-10/6,Search taking long time,https://github.com/vespa-engine/vespa/issues/19441
2021-10/11,2021-10/9,Slow feed rate using the vespa-feed-client towards the tail end of the feed,https://github.com/vespa-engine/vespa/issues/19487
2021-11/30,2021-10/11,query timeout after new index warmed up and switched in,https://github.com/vespa-engine/vespa/issues/19495
2021-10/14,2021-10/13,Vespa metrics to provide a normalized CPU usage and CPU load,https://github.com/vespa-engine/vespa/issues/19527
2021-10/19,2021-10/19,JRE SIGSEGV from com.yahoo.io.NativeIO,https://github.com/vespa-engine/vespa/issues/19631
2021-11/16,2021-10/20,Evaluate possibility of avoiding ranking summary-features re-calculation during summary fill,https://github.com/vespa-engine/vespa/issues/19645
,2021-10/21,Add documentation/guide/tooling for query tracing - performance guiding,https://github.com/vespa-engine/vespa/issues/19670
2021-11/4,2021-10/30,Kubernetes StatefulSet apps/v1beta1 no longer available since K8S 1.16,https://github.com/vespa-engine/vespa/issues/19798
2022-8/11,2021-11/3,Use default content-type in vespa-fbench for post queries,https://github.com/vespa-engine/vespa/issues/19840
,2021-11/8,Add support multiple outputs in FunctionEvaluator ,https://github.com/vespa-engine/vespa/issues/19901
2021-11/24,2021-11/11,Unable to insert more than 500k data points,https://github.com/vespa-engine/vespa/issues/19970
2022-7/20,2021-11/17,Representing SPANN with Vespa ,https://github.com/vespa-engine/vespa/issues/20073
2021-11/30,2021-11/18,Explore ability to support global streaming search without user or group affinity ,https://github.com/vespa-engine/vespa/issues/20086
2022-1/7,2021-11/25,"Feed overloading the container, even when throttling is employed",https://github.com/vespa-engine/vespa/issues/20209
,2021-11/26,Add support for hex format for int8 query tensors ,https://github.com/vespa-engine/vespa/issues/20232
2022-1/10,2021-12/3,Ensure all documentation is in table of contents,https://github.com/vespa-engine/vespa/issues/20364
2022-1/19,2021-12/6,Synonym enrichment implementation using semantic rules language,https://github.com/vespa-engine/vespa/issues/20386
2022-1/10,2021-12/6,Stemmed terms option in vespa semantic rules language,https://github.com/vespa-engine/vespa/issues/20388
2022-1/8,2021-12/13,YQL parsing of large multi-valued query operators (weightedSet/dotProduct/wand/weakAnd) ,https://github.com/vespa-engine/vespa/issues/20481
,2021-12/13,Feature Request: Binomial Coefficient Entropy Coding for Inverted Index Postings,https://github.com/vespa-engine/vespa/issues/20489
2021-12/14,2021-12/14,`vespa` tutorial : ./src/python/user_search.py U33527 10 KeyError: 'children',https://github.com/vespa-engine/vespa/issues/20503
2021-12/20,2021-12/14,Validate running vespaengine/vespa on M1 arch64 using docker emulation,https://github.com/vespa-engine/vespa/issues/20516
2022-5/23,2021-12/16,Missing documentation on fast-rank for tensors ,https://github.com/vespa-engine/vespa/issues/20561
,2022-1/4,Feature Request: Access to sparse vectors (TF-IDF or BM25) as generated by Vespa indexing,https://github.com/vespa-engine/vespa/issues/20647
,2022-1/7,Add support for match diversity for nearestNeighbor queries,https://github.com/vespa-engine/vespa/issues/20692
,2022-1/7,Show block windows for *this week* in the console,https://github.com/vespa-engine/vespa/issues/20708
2022-1/13,2022-1/13,vespa-cli: vespa log fails with invalid period ,https://github.com/vespa-engine/vespa/issues/20786
2022-2/22,2022-1/13,vespa-cli: Always list curl equivalent for document and query operations,https://github.com/vespa-engine/vespa/issues/20787
2022-8/25,2022-1/13,Quick start docker requirements and default jvm min=max settings,https://github.com/vespa-engine/vespa/issues/20788
2022-3/1,2022-1/13,vespa-cli: Add a retry or two for http/network errors for vespa deploy,https://github.com/vespa-engine/vespa/issues/20789
,2022-1/13,querybuilder UI thinks 'query' is an unknown request parameter,https://github.com/vespa-engine/vespa/issues/20795
2022-8/10,2022-1/13,Add links from documentation to blog posts,https://github.com/vespa-engine/vespa/issues/20805
2022-3/17,2022-1/18,vespa document should print payload if operation fails with http != 200,https://github.com/vespa-engine/vespa/issues/20855
2022-1/24,2022-1/20,Bug when creating transformer pipeline in sample-apps/transformers,https://github.com/vespa-engine/vespa/issues/20893
,2022-1/24,Create a glossary in Vespa Documentation,https://github.com/vespa-engine/vespa/issues/20907
2022-2/2,2022-1/31,Deploying application with just schema change is taking aroung 3-4 mins,https://github.com/vespa-engine/vespa/issues/20989
2022-3/23,2022-2/3,ColBERT ONNX dimension error,https://github.com/vespa-engine/vespa/issues/21062
2022-2/14,2022-2/5,Query latency increasing with number of hits even if no ranking profile or order clause is used,https://github.com/vespa-engine/vespa/issues/21081
2022-2/18,2022-2/16,Unable to see cpu util in the /metrics/v2/values,https://github.com/vespa-engine/vespa/issues/21234
2022-4/22,2022-2/21,Support boolean fields in GC expressions,https://github.com/vespa-engine/vespa/issues/21286
2022-2/23,2022-2/22,Query requests are timing out in vespa ,https://github.com/vespa-engine/vespa/issues/21322
2022-2/23,2022-2/23,Bulk Query in Vespa,https://github.com/vespa-engine/vespa/issues/21330
