"['title']","['url']","['createdAt']","['closedAt']"
"java.lang.NoSuchFieldError: ALLOW_FINAL_FIELDS_AS_MUTATORS for put object  java example","https://github.com/awsdocs/aws-doc-sdk-examples/issues/12","2016-10/4","2016-10/17"
"Could not unzip uploaded file. ...","https://github.com/awsdocs/aws-doc-sdk-examples/issues/16","2016-11/27","2017-1/12"
"Put object example","https://github.com/awsdocs/aws-doc-sdk-examples/issues/69","2017-3/1","2017-3/24"
"If empty queue, example crashes","https://github.com/awsdocs/aws-doc-sdk-examples/issues/77","2017-6/2","2017-11/9"
"cpp build issue","https://github.com/awsdocs/aws-doc-sdk-examples/issues/78","2017-6/5","2017-6/22"
"Go examples imports and convention","https://github.com/awsdocs/aws-doc-sdk-examples/issues/80","2017-6/12","2017-11/9"
"Valgrind report memory leaks on C++ SDK examples","https://github.com/awsdocs/aws-doc-sdk-examples/issues/86","2017-8/4","2017-8/10"
"AWS SNS: Example client JavaScript","https://github.com/awsdocs/aws-doc-sdk-examples/issues/87","2017-8/8","2018-8/2"
"put_object.cpp sample returning error ( timeout )","https://github.com/awsdocs/aws-doc-sdk-examples/issues/89","2017-8/21","2017-8/29"
"Why Base64?","https://github.com/awsdocs/aws-doc-sdk-examples/issues/91","2017-9/1","2017-9/1"
"Scan example is empty!","https://github.com/awsdocs/aws-doc-sdk-examples/issues/94","2017-9/14","2017-11/9"
"Query VS Scan","https://github.com/awsdocs/aws-doc-sdk-examples/issues/95","2017-9/30","2017-11/22"
"S3 local ""the target server failed to respond""","https://github.com/awsdocs/aws-doc-sdk-examples/issues/96","2017-10/2","2017-10/2"
"how to know IAM user is admin or not in Java","https://github.com/awsdocs/aws-doc-sdk-examples/issues/99","2017-10/25","2018-11/7"
"Unicode support in cpp S3 example broken on Linux","https://github.com/awsdocs/aws-doc-sdk-examples/issues/100","2017-11/3","2018-8/27"
"Unused parameters in cpp example, won't build on Linux","https://github.com/awsdocs/aws-doc-sdk-examples/issues/101","2017-11/3","2019-3/5"
"Missing pagination","https://github.com/awsdocs/aws-doc-sdk-examples/issues/102","2017-11/9","2017-11/9"
"Example request: fetch a Cloudwatch log stream in Go","https://github.com/awsdocs/aws-doc-sdk-examples/issues/104","2017-11/13","2019-8/12"
"Confusing Java examples for S3","https://github.com/awsdocs/aws-doc-sdk-examples/issues/106","2017-11/29","2017-12/12"
"Sync objects to another bucket","https://github.com/awsdocs/aws-doc-sdk-examples/issues/107","2017-12/4","2018-7/5"
"NextToken example","https://github.com/awsdocs/aws-doc-sdk-examples/issues/108","2017-12/6","2018-7/5"
"[aws-sdk-cpp DynamoDB] BatchGetItem sample (Difference with GetItem)","https://github.com/awsdocs/aws-doc-sdk-examples/issues/109","2017-12/6","2018-7/9"
"scan sample code question","https://github.com/awsdocs/aws-doc-sdk-examples/issues/112","2017-12/30","2018-1/2"
"[C++ SDK] example code to access Redshift","https://github.com/awsdocs/aws-doc-sdk-examples/issues/113","2018-1/3","2018-8/28"
"Batch Write is written wrong to get the correct response","https://github.com/awsdocs/aws-doc-sdk-examples/issues/116","2018-1/7","2018-1/26"
"[aws-sdk-cpp sqs] Is there a purge queue example ?","https://github.com/awsdocs/aws-doc-sdk-examples/issues/117","2018-1/10","2018-8/27"
"[AWS SDK for Java 2.0]  Cloudfront  Example","https://github.com/awsdocs/aws-doc-sdk-examples/issues/121","2018-1/17","2019-7/22"
"Method used to get InstanceID in CreateInstance.java example is incorrect","https://github.com/awsdocs/aws-doc-sdk-examples/issues/122","2018-1/23","2019-1/15"
"list all versions objects from s3 in specific folder location","https://github.com/awsdocs/aws-doc-sdk-examples/issues/124","2018-2/9","2018-2/11"
"C++ S3 PutObjectRequest where source is a buffer rather than a file","https://github.com/awsdocs/aws-doc-sdk-examples/issues/125","2018-2/21","2018-8/27"
"S3 Transfer Manager bytesTransferred not being updated","https://github.com/awsdocs/aws-doc-sdk-examples/issues/129","2018-3/12","2018-3/12"
"How to create parameter store ?","https://github.com/awsdocs/aws-doc-sdk-examples/issues/131","2018-3/15","2018-3/15"
"How to config the credentials for DynamoDB using aws-sdk js?","https://github.com/awsdocs/aws-doc-sdk-examples/issues/132","2018-3/15","2018-3/15"
"Dynamo Get/Delete item doesn't match the rest of the tutorial so it doesn't work","https://github.com/awsdocs/aws-doc-sdk-examples/issues/134","2018-3/22","2018-3/23"
"AWS SES GoLang Credentials","https://github.com/awsdocs/aws-doc-sdk-examples/issues/142","2018-5/3","2018-5/3"
"Any way to configure the manager to download to HDFS in Java?","https://github.com/awsdocs/aws-doc-sdk-examples/issues/143","2018-5/10","2019-6/27"
"Ruby, how to send/receive xml documents","https://github.com/awsdocs/aws-doc-sdk-examples/issues/144","2018-5/15","2019-3/4"
"Where are you connected to aws ?","https://github.com/awsdocs/aws-doc-sdk-examples/issues/145","2018-5/15","2018-6/29"
"[javascript SQS receive/delete] VisibilityTimeout === 0 guarantees most delete attempts will fail?  ","https://github.com/awsdocs/aws-doc-sdk-examples/issues/165","2018-6/26","2018-8/2"
"Go Create Enable Alarms example doesn't compile","https://github.com/awsdocs/aws-doc-sdk-examples/issues/168","2018-6/28","2018-7/5"
"Question: on Go example for deleting s3 objects","https://github.com/awsdocs/aws-doc-sdk-examples/issues/180","2018-7/19","2018-7/23"
"Policy is broken","https://github.com/awsdocs/aws-doc-sdk-examples/issues/186","2018-8/2","2018-8/2"
"Add (mostly C++; one Python) SDK examples","https://github.com/awsdocs/aws-doc-sdk-examples/issues/187","2018-8/3","2018-10/5"
"Missing result from describeInstances call in JavaScript","https://github.com/awsdocs/aws-doc-sdk-examples/issues/201","2018-8/11","2018-8/13"
"Missing result from describeInstances call","https://github.com/awsdocs/aws-doc-sdk-examples/issues/202","2018-8/11","2018-8/11"
"JavaScript Template Example | TypeError: AWS.config.mediaconvert is not a function","https://github.com/awsdocs/aws-doc-sdk-examples/issues/225","2018-8/23","2018-8/27"
"Wrong variable used in JavaScript code. It should be only ACCOUNT_ID.","https://github.com/awsdocs/aws-doc-sdk-examples/issues/227","2018-8/26","2018-10/24"
"SNS examples are missing for Go","https://github.com/awsdocs/aws-doc-sdk-examples/issues/228","2018-8/30","2019-3/4"
"Help Wanted","https://github.com/awsdocs/aws-doc-sdk-examples/issues/229","2018-8/31","2019-2/25"
"Error in Go sample?: certificate signed by unknown authority","https://github.com/awsdocs/aws-doc-sdk-examples/issues/240","2018-9/5","2018-9/5"
"Options and response examples for CloudFront's JavaScript SDK","https://github.com/awsdocs/aws-doc-sdk-examples/issues/241","2018-9/5","2019-8/6"
"Java: S3 - Missing Method to receive Object Url","https://github.com/awsdocs/aws-doc-sdk-examples/issues/255","2018-9/25","2019-3/24"
"EC2, S3 example in Kotlin","https://github.com/awsdocs/aws-doc-sdk-examples/issues/258","2018-10/1","2019-3/24"
"Fix space indentation on examples code php ","https://github.com/awsdocs/aws-doc-sdk-examples/issues/260","2018-10/2","2018-10/3"
"Java S3 bach upload example","https://github.com/awsdocs/aws-doc-sdk-examples/issues/264","2018-10/3","2019-3/24"
"Fix space comment indentation on example S3 with PHP","https://github.com/awsdocs/aws-doc-sdk-examples/issues/269","2018-10/3","2018-10/22"
"Add STS example for Go","https://github.com/awsdocs/aws-doc-sdk-examples/issues/277","2018-10/6","2018-10/6"
"AWS S3 Example for Creating Pre-Signed URL in JavaScript","https://github.com/awsdocs/aws-doc-sdk-examples/issues/280","2018-10/8","2019-8/6"
"EC2 not able to AssumeRole in the same process space","https://github.com/awsdocs/aws-doc-sdk-examples/issues/286","2018-10/9","2018-10/10"
"Python Examples for EKS - List/Describe cluster","https://github.com/awsdocs/aws-doc-sdk-examples/issues/306","2018-10/22","2018-10/22"
"Python example for EKS list and describe cluster","https://github.com/awsdocs/aws-doc-sdk-examples/issues/307","2018-10/22","2018-11/17"
"Fix indentation code js","https://github.com/awsdocs/aws-doc-sdk-examples/issues/311","2018-10/22","2018-10/26"
"errors thrown in new changes to aws-go-sdk-lambda-example-create-function.go","https://github.com/awsdocs/aws-doc-sdk-examples/issues/313","2018-10/23","2019-1/11"
"ECS examples in python","https://github.com/awsdocs/aws-doc-sdk-examples/issues/318","2018-10/26","2018-11/17"
"Fix indentation js","https://github.com/awsdocs/aws-doc-sdk-examples/issues/325","2018-10/28","2019-1/17"
"java v2:SQS ClassNotFoundException for org.apache.http.client.methods.HttpUriRequest","https://github.com/awsdocs/aws-doc-sdk-examples/issues/327","2018-10/29","2018-11/29"
"AWS S3 C++ Example GeneratePreSignedUrl","https://github.com/awsdocs/aws-doc-sdk-examples/issues/331","2018-10/31","2018-11/2"
"DotNet: request for Amazon Translate examples","https://github.com/awsdocs/aws-doc-sdk-examples/issues/332","2018-10/31","2019-8/12"
"Java SDK: ""NAME"" is a reserved word in DynamoDB according to developer guide","https://github.com/awsdocs/aws-doc-sdk-examples/issues/333","2018-11/1","2019-1/15"
"InvalidAccessKey","https://github.com/awsdocs/aws-doc-sdk-examples/issues/334","2018-11/2","2018-11/2"
"JavaScript Polly example returns 403 error","https://github.com/awsdocs/aws-doc-sdk-examples/issues/335","2018-11/3","2019-2/15"
"Javascript example > browserstart > Polly.html AudioPlayer not able to get new audio source","https://github.com/awsdocs/aws-doc-sdk-examples/issues/336","2018-11/4","2019-2/15"
"Java EC2 DescribeInstances Example infinite loop if specifying maxResults","https://github.com/awsdocs/aws-doc-sdk-examples/issues/353","2018-12/2","2019-4/5"
"S3 java example fail to run cause of missing dependencies","https://github.com/awsdocs/aws-doc-sdk-examples/issues/354","2018-12/3","2019-3/22"
"Passing params to node aws-sdk","https://github.com/awsdocs/aws-doc-sdk-examples/issues/356","2018-12/5","2019-8/6"
"Polly-HTML examples uses the id ""result"" twice. ID should be unique on page","https://github.com/awsdocs/aws-doc-sdk-examples/issues/357","2018-12/7","2019-2/15"
"Message Attribute Number not Supported","https://github.com/awsdocs/aws-doc-sdk-examples/issues/360","2018-12/14","2018-12/14"
"How do you use the php examples from a browser","https://github.com/awsdocs/aws-doc-sdk-examples/issues/364","2018-12/27","2018-12/27"
"Update contained objects","https://github.com/awsdocs/aws-doc-sdk-examples/issues/365","2018-12/29","2018-12/30"
"¿How make a public file after to upload?","https://github.com/awsdocs/aws-doc-sdk-examples/issues/377","2019-1/7","2019-1/10"
"Redshift C++ sample code is not compiling on Cloud9","https://github.com/awsdocs/aws-doc-sdk-examples/issues/383","2019-1/9","2019-3/5"
"Could you please give me an example of javascript writing on s3 instead of node.js.I can't really write it","https://github.com/awsdocs/aws-doc-sdk-examples/issues/424","2019-1/23","2019-1/24"
"Java example doesn't specify objects to delete","https://github.com/awsdocs/aws-doc-sdk-examples/issues/430","2019-1/24","2019-5/7"
"S3 set_acl.cpp example is incomplete -- doesn't actually specify the permission","https://github.com/awsdocs/aws-doc-sdk-examples/issues/444","2019-1/25","2019-4/4"
"Dynamodb response is zero value on aws go sdk.","https://github.com/awsdocs/aws-doc-sdk-examples/issues/448","2019-1/26","2019-2/13"
"nodejs syntax error in slotpull.js of slotassets.zip","https://github.com/awsdocs/aws-doc-sdk-examples/issues/462","2019-1/30","2019-8/6"
"S3 example put_object.cpp uploads the file with name as Access Key instead of the actual name. ","https://github.com/awsdocs/aws-doc-sdk-examples/issues/470","2019-1/31","2019-1/31"
"AWS SDK cpp Lambda Unable to connect to endpoint","https://github.com/awsdocs/aws-doc-sdk-examples/issues/502","2019-2/10","2019-3/28"
"No retry mechanism in JavaScript ""Writing Items in Batch"" example","https://github.com/awsdocs/aws-doc-sdk-examples/issues/528","2019-2/21","2019-8/6"
"Sqs receiveMessage Parameter NotificationType cannot be empty","https://github.com/awsdocs/aws-doc-sdk-examples/issues/540","2019-2/28","2019-3/11"
"[Bug] S3Client GetObject works - S3EncryptionClient says NoSuchKey!","https://github.com/awsdocs/aws-doc-sdk-examples/issues/550","2019-3/1","2019-3/28"
" Add an example for range decrypt with S3 Encryption Client","https://github.com/awsdocs/aws-doc-sdk-examples/issues/553","2019-3/6","2019-7/11"
"Upsert best practice ","https://github.com/awsdocs/aws-doc-sdk-examples/issues/557","2019-3/11","2019-8/12"
"Need examples for cpp s3 async api's","https://github.com/awsdocs/aws-doc-sdk-examples/issues/597","2019-4/2","2019-4/19"
"Should i batchWrite almost 600 items in DynamoDb table using AWS SDK for JavaScript","https://github.com/awsdocs/aws-doc-sdk-examples/issues/605","2019-4/9","2019-4/24"
"Share Glacier upload multipart archive sample please","https://github.com/awsdocs/aws-doc-sdk-examples/issues/617","2019-4/11","2019-4/26"
" SES Example","https://github.com/awsdocs/aws-doc-sdk-examples/issues/621","2019-4/12","2019-4/19"
"Amazon SNS Message Delivery Status CloudWatch Log Java","https://github.com/awsdocs/aws-doc-sdk-examples/issues/622","2019-4/12","2019-4/18"
"winner.png file missing from zip","https://github.com/awsdocs/aws-doc-sdk-examples/issues/627","2019-4/14","2019-8/7"
"Incorrect Documentation for ec2_createsecuritygroup.js","https://github.com/awsdocs/aws-doc-sdk-examples/issues/631","2019-4/18","2019-8/6"
