"['title']","['url']","['createdAt']","['closedAt']"
"wrong routing","https://github.com/osmandapp/OsmAnd/issues/9650","2020-8/17","2020-8/21"
"Public transport routing fails with error message","https://github.com/osmandapp/OsmAnd/issues/9654","2020-8/17","2020-9/4"
"Tiny survey about energy aware software practices.","https://github.com/osmandapp/OsmAnd/issues/9655","2020-8/17","2020-8/30"
"Support also P8517 in Wikidata","https://github.com/osmandapp/OsmAnd/issues/9657","2020-8/18","2022-4/25"
"app crash when trying to change default speed","https://github.com/osmandapp/OsmAnd/issues/9658","2020-8/18","2020-9/2"
"make highway=elevator to a clickable feature","https://github.com/osmandapp/OsmAnd/issues/9662","2020-8/18","2020-9/4"
"Disable ""Edit favorite"" action for Parking point","https://github.com/osmandapp/OsmAnd/issues/9663","2020-8/19","null"
"Different distance in car and Public Transport navigation","https://github.com/osmandapp/OsmAnd/issues/9664","2020-8/19","2021-2/10"
"After selecting Brazilian Portuguese translation, some screens remain in English","https://github.com/osmandapp/OsmAnd/issues/9668","2020-8/20","2020-9/3"
"Compatibility issues","https://github.com/osmandapp/OsmAnd/issues/9669","2020-8/20","null"
"wikidata info shown too prominently","https://github.com/osmandapp/OsmAnd/issues/9671","2020-8/20","2021-5/2"
"OsmAnd ignores bus stops/platforms which do not have a corresponding stop_position node in the public transport relation","https://github.com/osmandapp/OsmAnd/issues/9672","2020-8/20","2020-9/1"
"[Feature request] 180 screen rotation","https://github.com/osmandapp/OsmAnd/issues/9673","2020-8/20","null"
"[Feature request] search for federal highways and motorways","https://github.com/osmandapp/OsmAnd/issues/9674","2020-8/21","null"
"[Feature request] help tips","https://github.com/osmandapp/OsmAnd/issues/9675","2020-8/21","2021-1/13"
"After import addresses are wrong assigned if maps are not installed","https://github.com/osmandapp/OsmAnd/issues/9676","2020-8/21","2020-9/12"
"Notes on ways only appear in high zoom","https://github.com/osmandapp/OsmAnd/issues/9680","2020-8/22","2021-4/3"
"[Feature request] Include map legends in apk for offline use","https://github.com/osmandapp/OsmAnd/issues/9681","2020-8/22","null"
"Map language Chinese (zh) does not use Traditional (zh-Hant) or Simplified (zh-Hans) as a fallback","https://github.com/osmandapp/OsmAnd/issues/9682","2020-8/22","null"
"Map language: provide option for Traditional or Simplified Chinese option instead of just Chinese","https://github.com/osmandapp/OsmAnd/issues/9683","2020-8/22","null"
"Measure distance tool not really saving long segments","https://github.com/osmandapp/OsmAnd/issues/9685","2020-8/22","2020-8/22"
"Edit POI screen UI layout issue","https://github.com/osmandapp/OsmAnd/issues/9686","2020-8/22","2020-9/14"
"Add shop=nuts to POI: POI information not showing up for shop","https://github.com/osmandapp/OsmAnd/issues/9690","2020-8/24","2020-9/16"
"excluding wrong points when recording a trip","https://github.com/osmandapp/OsmAnd/issues/9691","2020-8/24","2020-9/2"
"Cycle network node shield and font size","https://github.com/osmandapp/OsmAnd/issues/9692","2020-8/24","2020-9/8"
"local cycle routes lcn=yes not displayed","https://github.com/osmandapp/OsmAnd/issues/9693","2020-8/25","2020-11/13"
"feature request: quadkey online maps","https://github.com/osmandapp/OsmAnd/issues/9694","2020-8/25","null"
"[Feature Request] No Way To Discern From Two Places In Search","https://github.com/osmandapp/OsmAnd/issues/9695","2020-8/25","null"
"[Feature Request] Color Quick Action Tiles When On or Off","https://github.com/osmandapp/OsmAnd/issues/9696","2020-8/25","null"
"Increase the cache time for online tracking in the trip record plugin","https://github.com/osmandapp/OsmAnd/issues/9698","2020-8/26","2020-8/26"
"World overview map issue","https://github.com/osmandapp/OsmAnd/issues/9701","2020-8/26","2020-9/2"
"Address search: Passau neuburger strasse","https://github.com/osmandapp/OsmAnd/issues/9704","2020-8/26","2020-12/30"
"WGS84 to Pulkovo-42 converter","https://github.com/osmandapp/OsmAnd/issues/9706","2020-8/26","null"
"[Edit plugin] Failed to upload local edits (randomly reproduced)","https://github.com/osmandapp/OsmAnd/issues/9707","2020-8/26","null"
"Problem showing right wikipedia article due to letter case differences","https://github.com/osmandapp/OsmAnd/issues/9708","2020-8/27","2021-4/14"
"Core Building Installation ","https://github.com/osmandapp/OsmAnd/issues/9709","2020-8/27","2020-9/1"
"Flooded area in Sturgeon Bay, Wisconsin ","https://github.com/osmandapp/OsmAnd/issues/9713","2020-8/28","2020-10/22"
"Island names missing","https://github.com/osmandapp/OsmAnd/issues/9714","2020-8/28","2020-11/10"
"Crash off app and system after changing geolocation accuracy from ""high"" to ""only device"" [Android]","https://github.com/osmandapp/OsmAnd/issues/9715","2020-8/28","null"
"Feature request: Delete maps without the need to update them first.","https://github.com/osmandapp/OsmAnd/issues/9717","2020-8/29","2020-8/30"
"[offline maps] If an area is divided into sub-areas, make sure the union of all sub-areas resembles the whole area.","https://github.com/osmandapp/OsmAnd/issues/9718","2020-8/29","2020-9/14"
"[Feature request] Adjust OsmAnd/TTS audio output volume","https://github.com/osmandapp/OsmAnd/issues/9719","2020-8/30","2020-9/2"
"[Feature request] distinguish cycle paths","https://github.com/osmandapp/OsmAnd/issues/9720","2020-8/31","null"
"How to add images to a POI without Mapillary","https://github.com/osmandapp/OsmAnd/issues/9721","2020-8/31","null"
"Duplicate Hide setting for the Underlay map","https://github.com/osmandapp/OsmAnd/issues/9727","2020-9/2","null"
"[Feature request] more options for position icon while moving","https://github.com/osmandapp/OsmAnd/issues/9728","2020-9/2","null"
"[Regression] No more possible to change sort order in intermediate destinations","https://github.com/osmandapp/OsmAnd/issues/9730","2020-9/2","2020-9/8"
"OsmAnd Live slows rendering 2x-10x with month updates ","https://github.com/osmandapp/OsmAnd/issues/9733","2020-9/2","null"
"render ""boundary""=""national_park"" objects the same way as ""boundary=protected_area"" objects","https://github.com/osmandapp/OsmAnd/issues/9735","2020-9/3","2020-11/4"
"Cannot build Android version with NDK: 'expat.h' file not found","https://github.com/osmandapp/OsmAnd/issues/9736","2020-9/3","2020-9/7"
"Import/Export issues","https://github.com/osmandapp/OsmAnd/issues/9739","2020-9/3","2020-9/22"
"GPX track cannot be used with GPS enabled","https://github.com/osmandapp/OsmAnd/issues/9740","2020-9/3","2020-9/4"
"Avoided roads used in the route building","https://github.com/osmandapp/OsmAnd/issues/9741","2020-9/3","null"
"Issue with duplicated profile names.","https://github.com/osmandapp/OsmAnd/issues/9742","2020-9/3","null"
"Drawer: show navigation type for profiles","https://github.com/osmandapp/OsmAnd/issues/9743","2020-9/3","2020-9/17"
"Touring-Style: Different road width with custom profile","https://github.com/osmandapp/OsmAnd/issues/9744","2020-9/4","2020-9/7"
"Tap to wake in navigation when screen is off","https://github.com/osmandapp/OsmAnd/issues/9745","2020-9/4","null"
"Request: Replace saving dialog in Route Details > Save","https://github.com/osmandapp/OsmAnd/issues/9746","2020-9/4","2020-9/17"
"Add Kannada as Map language","https://github.com/osmandapp/OsmAnd/issues/9747","2020-9/4","2020-9/4"
"POI property ""instagram"" has a label while other social media entries don't","https://github.com/osmandapp/OsmAnd/issues/9752","2020-9/5","null"
"Skip Waypoint","https://github.com/osmandapp/OsmAnd/issues/9753","2020-9/5","2020-9/7"
"OsmAnd Live still uses removed street","https://github.com/osmandapp/OsmAnd/issues/9754","2020-9/6","2020-9/24"
"""Display Nearest POIs"" displays wikipedia entries in all languages (mainly Cebuano) instead of selected wikipedia languages","https://github.com/osmandapp/OsmAnd/issues/9755","2020-9/6","2020-9/23"
"Move the transparency seekbar to the right side of the screen","https://github.com/osmandapp/OsmAnd/issues/9757","2020-9/7","null"
"GB Postcodes not found","https://github.com/osmandapp/OsmAnd/issues/9758","2020-9/7","null"
"`area:highway=turning_circle` should be rendered.","https://github.com/osmandapp/OsmAnd/issues/9759","2020-9/7","null"
"Change text and add button in toats about lack of permission.","https://github.com/osmandapp/OsmAnd/issues/9761","2020-9/7","null"
"Plan route: tap on the line should insert point","https://github.com/osmandapp/OsmAnd/issues/9762","2020-9/7","null"
"Importing profiles: fix counting for duplicates","https://github.com/osmandapp/OsmAnd/issues/9764","2020-9/7","null"
"did not found the short way","https://github.com/osmandapp/OsmAnd/issues/9766","2020-9/8","null"
"Add favorite: set proper color","https://github.com/osmandapp/OsmAnd/issues/9767","2020-9/8","2020-9/16"
"Creation of a Wheelchair routing profile","https://github.com/osmandapp/OsmAnd/issues/9768","2020-9/8","2020-9/9"
"Track matching: Exception when trying to match GPX track to road","https://github.com/osmandapp/OsmAnd/issues/9772","2020-9/9","2020-9/11"
"Track matching: Generated track stops too early","https://github.com/osmandapp/OsmAnd/issues/9773","2020-9/9","2020-9/18"
"Track matching: Parts of the track are not matched to the road","https://github.com/osmandapp/OsmAnd/issues/9774","2020-9/9","2020-9/18"
"Follow Track matching: Don't overwrite original track","https://github.com/osmandapp/OsmAnd/issues/9775","2020-9/9","2020-9/11"
"Add support for Maps.me geo links","https://github.com/osmandapp/OsmAnd/issues/9777","2020-9/9","2020-9/11"
"Track stays visible after deleting it","https://github.com/osmandapp/OsmAnd/issues/9778","2020-9/10","2021-4/21"
"Track matching: Pre-select currently chosen profile as navigation profile","https://github.com/osmandapp/OsmAnd/issues/9779","2020-9/10","null"
"cycleway:<dir>:oneway=no ignored on cycle lanes","https://github.com/osmandapp/OsmAnd/issues/9782","2020-9/10","2020-10/30"
"Broken app theme icon","https://github.com/osmandapp/OsmAnd/issues/9783","2020-9/10","2020-10/21"
"Follow tracks: route doesn't calculated from track last point to added destination.","https://github.com/osmandapp/OsmAnd/issues/9787","2020-9/11","2020-9/12"
"E-road numbers used preferentially in UK, but they are not signposted.","https://github.com/osmandapp/OsmAnd/issues/9796","2020-9/12","2020-11/27"
"Search for surf board rentals and surfing schools","https://github.com/osmandapp/OsmAnd/issues/9797","2020-9/13","null"
"Render ways of barrier=bollard and =block as a dotted line","https://github.com/osmandapp/OsmAnd/issues/9799","2020-9/13","null"
"Make ways clickable and show their properties","https://github.com/osmandapp/OsmAnd/issues/9800","2020-9/13","2020-9/15"
"Carpooling functionality based on Online GPS Tracker","https://github.com/osmandapp/OsmAnd/issues/9801","2020-9/13","null"
"Improved handling of Irish Postcodes","https://github.com/osmandapp/OsmAnd/issues/9802","2020-9/13","null"
"Regression: PT route relations disappeared","https://github.com/osmandapp/OsmAnd/issues/9803","2020-9/14","2020-9/15"
"OsmAnd is not rendering driveways","https://github.com/osmandapp/OsmAnd/issues/9804","2020-9/14","2020-9/14"
"Transparency seekbar on the map and UI are not synchronized","https://github.com/osmandapp/OsmAnd/issues/9805","2020-9/14","2020-9/22"
"Wrong public transport stop is selected","https://github.com/osmandapp/OsmAnd/issues/9807","2020-9/14","2020-9/18"
"Regression: Continue to support sorting track folders A-Z","https://github.com/osmandapp/OsmAnd/issues/9808","2020-9/14","2020-9/28"
"NPE crash when accessing Favorites","https://github.com/osmandapp/OsmAnd/issues/9809","2020-9/14","2020-9/15"
"No search result for generator:source=*","https://github.com/osmandapp/OsmAnd/issues/9811","2020-9/15","null"
"Names of multipolygons not rendered in Osmand","https://github.com/osmandapp/OsmAnd/issues/9812","2020-9/15","null"
"No more default Track appearance per map style?","https://github.com/osmandapp/OsmAnd/issues/9818","2020-9/15","2020-9/16"
"Wikimedia Commons Attribution","https://github.com/osmandapp/OsmAnd/issues/9819","2020-9/16","2021-6/30"
"Some (rare) shapes are visibly distorted","https://github.com/osmandapp/OsmAnd/issues/9821","2020-9/16","null"
"Navigation with avoiding tolls buggy","https://github.com/osmandapp/OsmAnd/issues/9822","2020-9/16","2020-9/16"
