"createdAt","closedAt","title","url"
"2021-1/16","null","routing issue: пр. Энгельса-Выборгское ш.","https://github.com/osmandapp/OsmAnd/issues/10592"
"2021-1/16","2021-4/12","Category Wikimedia Commons Images does not load","https://github.com/osmandapp/OsmAnd/issues/10593"
"2021-1/16","null","Add wikipedia to Live updates","https://github.com/osmandapp/OsmAnd/issues/10594"
"2021-1/17","2021-1/18","Install nightly build over beta release fail ","https://github.com/osmandapp/OsmAnd/issues/10597"
"2021-1/17","null","[Feature request] Quick action : allow reorder of preset tags","https://github.com/osmandapp/OsmAnd/issues/10603"
"2021-1/17","2021-2/2","Piste type undefined","https://github.com/osmandapp/OsmAnd/issues/10604"
"2021-1/17","2021-2/4","Doles Ridge Road Limerick: Use addr:city tag for search index","https://github.com/osmandapp/OsmAnd/issues/10606"
"2021-1/18","2021-1/18","Slow app startup on Android 11","https://github.com/osmandapp/OsmAnd/issues/10609"
"2021-1/18","2021-5/3","Costructing a route using intermediates difficult","https://github.com/osmandapp/OsmAnd/issues/10612"
"2021-1/18","2021-1/19","Deprecated features in build are used","https://github.com/osmandapp/OsmAnd/issues/10616"
"2021-1/19","null","Pedestrian ares is not correctly rendered","https://github.com/osmandapp/OsmAnd/issues/10620"
"2021-1/19","2021-1/27","[regression] track name is changed to ""null.gpx""","https://github.com/osmandapp/OsmAnd/issues/10621"
"2021-1/20","2021-1/29","SF Alameda: Street Addresses Not Working","https://github.com/osmandapp/OsmAnd/issues/10624"
"2021-1/20","2021-1/20","OAuth not working for OSM notes, however works for POI editing","https://github.com/osmandapp/OsmAnd/issues/10625"
"2021-1/20","2021-1/21","Crash in Route preparation","https://github.com/osmandapp/OsmAnd/issues/10626"
"2021-1/20","2021-1/21","Task 'assembleFreedevLegacyFatDebug' not found in project ':OsmAnd'.","https://github.com/osmandapp/OsmAnd/issues/10629"
"2021-1/22","2021-1/22","Inconsistent appearance of track analysis screens","https://github.com/osmandapp/OsmAnd/issues/10636"
"2021-1/22","2021-4/7","3.9 GPS sensor not activated [Google Play Services are needed]","https://github.com/osmandapp/OsmAnd/issues/10637"
"2021-1/22","null","Tourist map view like mapy.cz","https://github.com/osmandapp/OsmAnd/issues/10641"
"2021-1/22","2021-2/4","Routing totally wrong in one direction","https://github.com/osmandapp/OsmAnd/issues/10642"
"2021-1/22","2021-1/25","Add action: remove a custom POI Overlay Category","https://github.com/osmandapp/OsmAnd/issues/10644"
"2021-1/23","2021-1/25","[regression] no more nightly.apk in https://download.osmand.net/latest-night-build/","https://github.com/osmandapp/OsmAnd/issues/10645"
"2021-1/23","2021-1/25","Doesn't upload all the tags while uploading a POI","https://github.com/osmandapp/OsmAnd/issues/10646"
"2021-1/24","null","Signature algorithm from SHA1withRSA to SHA512withRSA","https://github.com/osmandapp/OsmAnd/issues/10649"
"2021-1/24","null","Use transparent zlib library for compressed OsmAnd maps","https://github.com/osmandapp/OsmAnd/issues/10653"
"2021-1/24","null","How To Fix An Illegal Turn, Non-stop Tight U-Turns, and Improve Routing? Almost got me into an accident..","https://github.com/osmandapp/OsmAnd/issues/10654"
"2021-1/25","2021-1/25","Contour line labels are too rare","https://github.com/osmandapp/OsmAnd/issues/10656"
"2021-1/25","2021-2/3","Melbourne: Wrong city for address","https://github.com/osmandapp/OsmAnd/issues/10657"
"2021-1/25","2021-1/27","Crash on POI upload: ArrayIndexOutOfBoundsException at SendOsmNoteBottomSheetFragment.createMenuItems","https://github.com/osmandapp/OsmAnd/issues/10658"
"2021-1/25","null","Support osm.org and openstreetmap.org urls","https://github.com/osmandapp/OsmAnd/issues/10659"
"2021-1/25","null","Ability to Change Marker Color","https://github.com/osmandapp/OsmAnd/issues/10661"
"2021-1/25","null","Search within Favorites description","https://github.com/osmandapp/OsmAnd/issues/10662"
"2021-1/25","2021-1/27","Nonvisible snowmobile trails for night mode","https://github.com/osmandapp/OsmAnd/issues/10663"
"2021-1/25","2021-9/27","Untranslated map names in Local tab, like Hillshade, Slope, World basemap mini","https://github.com/osmandapp/OsmAnd/issues/10664"
"2021-1/25","2021-2/2","Slope and Hillshade maps separated in the OsmAnd storage overview","https://github.com/osmandapp/OsmAnd/issues/10665"
"2021-1/26","2021-1/26","Icon and shape don't saved, for waypoint in currently recording tracks","https://github.com/osmandapp/OsmAnd/issues/10669"
"2021-1/27","2021-2/3","Allée des Aigrettes: Street Addresses Not Working","https://github.com/osmandapp/OsmAnd/issues/10677"
"2021-1/27","null","Correct the graphics of Brazilian traffic signs","https://github.com/osmandapp/OsmAnd/issues/10678"
"2021-1/27","2021-2/7","Wolności 223 Zabrze: Street Addresses Not Working","https://github.com/osmandapp/OsmAnd/issues/10679"
"2021-1/27","null","Implementation of GTFS (ODbL) for timetables routing","https://github.com/osmandapp/OsmAnd/issues/10681"
"2021-1/27","2021-1/27","[regression] can't change display language, confirm button lost","https://github.com/osmandapp/OsmAnd/issues/10682"
"2021-1/27","2022-12/12","Hard to make small adjustments using transparency sliders in 'configure map'","https://github.com/osmandapp/OsmAnd/issues/10688"
"2021-1/28","2021-2/16","'Edit track' modifies unchanged files","https://github.com/osmandapp/OsmAnd/issues/10691"
"2021-1/28","2021-2/7","Support simple html for waypoints descriptions","https://github.com/osmandapp/OsmAnd/issues/10692"
"2021-1/28","2021-1/28","Simplify the insertion of geographic coordinates","https://github.com/osmandapp/OsmAnd/issues/10693"
"2021-1/28","2021-2/3","Potenza Picena Via Galileo Galilei: Street Addresses Not Working","https://github.com/osmandapp/OsmAnd/issues/10698"
"2021-1/28","2021-2/4","Beim Ruhacker 12, Ziegelerden 96317 Kronach, Germany: Bug with Address","https://github.com/osmandapp/OsmAnd/issues/10699"
"2021-1/29","2021-1/30","OsmAnd - Myrtle Beach South Carolina : Street Addresses not searchable in OsmAnd, present in OSM","https://github.com/osmandapp/OsmAnd/issues/10702"
"2021-1/29","2022-9/29","Redirect 'Configure map / Tracks'","https://github.com/osmandapp/OsmAnd/issues/10704"
"2021-1/29","2021-2/3"," Streets from Maisons-Alfort commune were moved to  Saint-Maurice","https://github.com/osmandapp/OsmAnd/issues/10708"
"2021-1/29","2021-2/3","Ski piste types","https://github.com/osmandapp/OsmAnd/issues/10710"
"2021-1/29","2023-1/11","Feature request: Sound beep for turn instructions","https://github.com/osmandapp/OsmAnd/issues/10711"
"2021-1/29","2021-1/29","Add marshruty.ru to tile sources","https://github.com/osmandapp/OsmAnd/issues/10712"
"2021-1/30","null","[FR]: improve accessibility of Search button","https://github.com/osmandapp/OsmAnd/issues/10714"
"2021-1/30","2021-1/30","[FR][Favorites]: assign colors to POIs, not just folders","https://github.com/osmandapp/OsmAnd/issues/10715"
"2021-1/30","2021-1/31","IOS - social media links not clickable","https://github.com/osmandapp/OsmAnd/issues/10716"
"2021-1/30","null","show zipcode when looking at street adress","https://github.com/osmandapp/OsmAnd/issues/10717"
"2021-1/30","2021-5/27","Voice Announcements for Autobahn Junctions/Exits contain the (correct) information too late or at wrong times","https://github.com/osmandapp/OsmAnd/issues/10718"
"2021-1/31","null","Display extent of locality MP when tapping on symbol","https://github.com/osmandapp/OsmAnd/issues/10719"
"2021-1/31","2021-2/10","Navigation broken for destinations further than ~60 kilometers","https://github.com/osmandapp/OsmAnd/issues/10722"
"2021-1/31","2021-2/5","All Travel guides points are red colored","https://github.com/osmandapp/OsmAnd/issues/10723"
"2021-2/1","null","brightness control","https://github.com/osmandapp/OsmAnd/issues/10724"
"2021-2/1","2021-3/7","Offline sqlite raster maps (RMaps) don't show up in the beginning","https://github.com/osmandapp/OsmAnd/issues/10729"
"2021-2/1","2021-2/4","Street from Lyon was moved to Villeurbanne","https://github.com/osmandapp/OsmAnd/issues/10730"
"2021-2/2","2021-2/23","OsmAnd routing takes unnecessary turns or longer path","https://github.com/osmandapp/OsmAnd/issues/10736"
"2021-2/2","null","Map auto delete","https://github.com/osmandapp/OsmAnd/issues/10740"
"2021-2/2","null","Bike fastest route option in Driving Style","https://github.com/osmandapp/OsmAnd/issues/10741"
"2021-2/2","2021-2/2",":OsmAnd-java:test","https://github.com/osmandapp/OsmAnd/issues/10742"
"2021-2/2","2021-2/3","Discoverability of the new ""Tracks /Overview"" card","https://github.com/osmandapp/OsmAnd/issues/10746"
"2021-2/2","2021-2/3","App Crash Initializer","https://github.com/osmandapp/OsmAnd/issues/10748"
"2021-2/2","2021-2/3","NPE handling track display","https://github.com/osmandapp/OsmAnd/issues/10749"
"2021-2/3","2021-2/15","[regression] gpx file with wpt, lost functionality","https://github.com/osmandapp/OsmAnd/issues/10759"
"2021-2/4","2021-2/10","Hillshade maps are now subtitled as 'Online maps'","https://github.com/osmandapp/OsmAnd/issues/10761"
"2021-2/4","2021-2/5","Translations of territories' names","https://github.com/osmandapp/OsmAnd/issues/10763"
"2021-2/4","2021-2/5","Improve skimap style","https://github.com/osmandapp/OsmAnd/issues/10766"
"2021-2/4","2021-2/12","Poi icons are densely displayed on the map","https://github.com/osmandapp/OsmAnd/issues/10768"
"2021-2/4","2021-2/5","OpenGL rendering + 2.5D on Android","https://github.com/osmandapp/OsmAnd/issues/10770"
"2021-2/4","2021-2/24","Weird contour lines on map (artifacts of stitching?)","https://github.com/osmandapp/OsmAnd/issues/10772"
"2021-2/5","2021-2/8","Waypoints to Map marker ","https://github.com/osmandapp/OsmAnd/issues/10774"
"2021-2/5","2021-2/9","Show polygons for Underlay map","https://github.com/osmandapp/OsmAnd/issues/10775"
"2021-2/5","2021-2/15","Track context menu: wrong statistic data","https://github.com/osmandapp/OsmAnd/issues/10777"
"2021-2/5","2021-2/6","Add summit:register","https://github.com/osmandapp/OsmAnd/issues/10778"
"2021-2/5","2021-2/6","Rare location update","https://github.com/osmandapp/OsmAnd/issues/10780"
"2021-2/5","2021-2/8","Permission ACCESS_BACKGROUND_LOCATION is missing","https://github.com/osmandapp/OsmAnd/issues/10782"
"2021-2/5","null","Confusing colors in nordic ski","https://github.com/osmandapp/OsmAnd/issues/10784"
"2021-2/6","2021-2/12","generator:source=biomass translation","https://github.com/osmandapp/OsmAnd/issues/10786"
"2021-2/6","2021-2/8","""Quick Action"" object is created at crosshair/center only on GPS follow","https://github.com/osmandapp/OsmAnd/issues/10788"
"2021-2/6","2021-2/12","Car routing is creating loops and turns","https://github.com/osmandapp/OsmAnd/issues/10789"
"2021-2/7","null","make zoo area visible","https://github.com/osmandapp/OsmAnd/issues/10790"
"2021-2/7","2021-2/10","Position suddenly jumps around during navigation (speed camera or tunnel problem?)","https://github.com/osmandapp/OsmAnd/issues/10794"
"2021-2/7","2021-2/8","Logging interval is suddenly 5 seconds (osmand+ 3.9.5)","https://github.com/osmandapp/OsmAnd/issues/10795"
"2021-2/7","2021-2/8","Wrong button caption on 'Track saved' dialog","https://github.com/osmandapp/OsmAnd/issues/10796"
"2021-2/7","2021-3/8","Ski tracks / routes - show on the road (limit text)","https://github.com/osmandapp/OsmAnd/issues/10797"
"2021-2/8","null","Add support for Israel public transportation ","https://github.com/osmandapp/OsmAnd/issues/10800"
"2021-2/8","2021-2/26","Dark mode issue","https://github.com/osmandapp/OsmAnd/issues/10804"
"2021-2/8","null","More accurate time in public transport navigation","https://github.com/osmandapp/OsmAnd/issues/10805"
"2021-2/8","null","Navigation setting: avoid border crossing.","https://github.com/osmandapp/OsmAnd/issues/10806"
"2021-2/8","null","Hiking symbols overlay - tweaking","https://github.com/osmandapp/OsmAnd/issues/10809"
"2021-2/9","2021-3/12","Cliff - tweaking","https://github.com/osmandapp/OsmAnd/issues/10811"
"2021-2/9","2021-2/9","Task 'wrapper' not found in project ':OsmAnd'","https://github.com/osmandapp/OsmAnd/issues/10816"
