createdAt,closedAt,title,url
2020-12/9,nan,Give feedback when checking proxy settings,https://github.com/sleuthkit/autopsy/issues/6539
2020-12/16,2020-12/17,apache-tika-917461463345740069.tmp detected as Emotet trojan downloader,https://github.com/sleuthkit/autopsy/issues/6554
2020-12/24,2020-12/30,Display warning output when running in docker,https://github.com/sleuthkit/autopsy/issues/6577
2020-12/31,nan,Name field Sort Order,https://github.com/sleuthkit/autopsy/issues/6588
2021-1/11,2022-12/1,Autopsy 4.17.0 crashes on Windows 10,https://github.com/sleuthkit/autopsy/issues/6616
2021-1/21,nan,"error for files on a .vhd image - (offset 0-16,384 could not be read)",https://github.com/sleuthkit/autopsy/issues/6659
2021-1/21,nan,data processing breaks with network connection issues,https://github.com/sleuthkit/autopsy/issues/6660
2021-2/6,nan,No option for EXIF parser in Ingest Module,https://github.com/sleuthkit/autopsy/issues/6708
2021-2/7,2023-1/31,ImageMagick setup,https://github.com/sleuthkit/autopsy/issues/6709
2021-2/7,nan,Linux Mint 20 install issues,https://github.com/sleuthkit/autopsy/issues/6710
2021-2/9,nan,"CSV Export missing fields, header names",https://github.com/sleuthkit/autopsy/issues/6717
2021-2/11,2021-2/20,MacOS Installation Brew Cask Update,https://github.com/sleuthkit/autopsy/issues/6723
2021-2/16,nan,PST Review,https://github.com/sleuthkit/autopsy/issues/6730
2021-3/4,2021-3/23,CI and packaging is failing due to outdated netbeans link,https://github.com/sleuthkit/autopsy/issues/6773
2021-3/8,nan,Autospy problem with a image in linux,https://github.com/sleuthkit/autopsy/issues/6778
2021-3/19,nan,Third-party software shouldn't be tracked as binaries on Git,https://github.com/sleuthkit/autopsy/issues/6806
2021-4/4,nan,Autopsy Report generates wrong image with duplicate filenames,https://github.com/sleuthkit/autopsy/issues/6871
2021-4/7,nan,error: package com.sun.javafx does not exist ,https://github.com/sleuthkit/autopsy/issues/6884
2021-4/9,nan,Autopsy 4.18 com problemas,https://github.com/sleuthkit/autopsy/issues/6895
2021-4/10,2021-9/21,autopsy 4.18 unsupported java version while building Debian package,https://github.com/sleuthkit/autopsy/issues/6899
2021-4/13,nan,Initial warning prompt hidden behind splash screen,https://github.com/sleuthkit/autopsy/issues/6908
2021-4/15,nan,.TAR files not extracted with ingest module,https://github.com/sleuthkit/autopsy/issues/6924
2021-5/4,2023-1/26,[iLeapp] permission denied during ingest,https://github.com/sleuthkit/autopsy/issues/6950
2021-5/4,nan,Unable to start Autopsy 4 on Ubuntu 18.04,https://github.com/sleuthkit/autopsy/issues/6951
2021-5/6,nan,Problem ingesting zip files in linux with hebrew  (version release 4.17.0),https://github.com/sleuthkit/autopsy/issues/6953
2021-5/7,nan,i keep getting error while running msi file,https://github.com/sleuthkit/autopsy/issues/6959
2021-5/10,2022-12/1,Won't work,https://github.com/sleuthkit/autopsy/issues/6964
2021-5/18,nan,Autopsy Starts and hangs while starting modules ,https://github.com/sleuthkit/autopsy/issues/6980
2021-5/21,nan,FreeBSD VHD Image Read Problems,https://github.com/sleuthkit/autopsy/issues/6985
2021-5/26,nan,.msg email files not being parsed as email,https://github.com/sleuthkit/autopsy/issues/6998
2021-6/4,nan,Linux: Is systemd part of the Dependency tree?,https://github.com/sleuthkit/autopsy/issues/7016
2021-6/5,nan,Autopsy install in kali-linux-2021.2 error,https://github.com/sleuthkit/autopsy/issues/7020
2021-6/10,nan,Ext4 filesystem parsing issue in Autopsy 4.18.0-TSK 4.10.2-RELEASE (results are consistent in sleuthkit command line v 4.6.7),https://github.com/sleuthkit/autopsy/issues/7033
2021-6/20,nan,Autopsy 4.18.0 activation module failed libtsk_jni_user.so: undefined symbol,https://github.com/sleuthkit/autopsy/issues/7059
2021-6/28,nan,IDLE Ingest on Linux with 4.18,https://github.com/sleuthkit/autopsy/issues/7075
2021-7/1,nan,Autopsy - Cannot find Java,https://github.com/sleuthkit/autopsy/issues/7090
2021-7/2,2021-7/7,Keyword Search - IP Addresses ,https://github.com/sleuthkit/autopsy/issues/7104
2021-8/3,2021-8/17,Searching for BTC-addresses with a regular expression,https://github.com/sleuthkit/autopsy/issues/7179
2021-8/9,2022-12/1,IP Addresses regex problem ,https://github.com/sleuthkit/autopsy/issues/7191
2021-8/22,nan,Autopsy 4.18 Disclosure | ICEpdf Decompression Memory Exhaustion DoS,https://github.com/sleuthkit/autopsy/issues/7207
2021-8/22,nan,Autopsy 4.18 Disclosure | Business Logic Issue in python modules,https://github.com/sleuthkit/autopsy/issues/7208
2021-9/2,nan,org.netbeans.InvalidException: StandardModule:org.sleuthkit.autopsy.core ,https://github.com/sleuthkit/autopsy/issues/7233
2021-9/11,nan,Build failed when building autopsy from source,https://github.com/sleuthkit/autopsy/issues/7259
2021-9/14,2022-12/1,I cloned the source code in Linux ,https://github.com/sleuthkit/autopsy/issues/7261
2021-9/16,2021-9/17,AFF image support,https://github.com/sleuthkit/autopsy/issues/7270
2021-10/13,nan,Feature request: Support dragging a file/folder as a shortcut to use as a data source,https://github.com/sleuthkit/autopsy/issues/7344
2021-10/14,nan,Enhancement: File Search Results should also display search query,https://github.com/sleuthkit/autopsy/issues/7345
2021-10/14,nan,Enhancement: Use consistent phrasing in menu and display,https://github.com/sleuthkit/autopsy/issues/7346
2021-10/14,nan,"Enhancement: ""Add Data Source"" for ""Local files and folders"" should support removing an individual entry",https://github.com/sleuthkit/autopsy/issues/7347
2021-10/17,nan,Mail display should include name and destination email,https://github.com/sleuthkit/autopsy/issues/7357
2021-10/17,nan,Mail display should include a column to indicate whether an email has attachments,https://github.com/sleuthkit/autopsy/issues/7358
2021-10/17,nan,Support removing a data source from a case,https://github.com/sleuthkit/autopsy/issues/7359
2021-10/29,nan,Still Using OpenCV 2.4.8,https://github.com/sleuthkit/autopsy/issues/7390
2021-11/3,nan,Autopsy/TSK wrong handling of timezone for European Daylight Saving Time,https://github.com/sleuthkit/autopsy/issues/7400
2021-11/17,nan,temporarily .hwpx suppoting needed,https://github.com/sleuthkit/autopsy/issues/7422
2021-11/27,2021-12/22,Library not found in jar (libtsk_jni),https://github.com/sleuthkit/autopsy/issues/7435
2021-12/1,2021-12/1,tsk_fs_file_walk of file with multiple $Data Streams,https://github.com/sleuthkit/autopsy/issues/7444
2021-12/13,2023-1/26,Vulnerable version of log4j used by Apache ActiveMQ in Multi user setup,https://github.com/sleuthkit/autopsy/issues/7464
2021-12/22,2023-1/26,autopsy-4.19.2 ships with vulnerable log4j,https://github.com/sleuthkit/autopsy/issues/7490
2022-2/4,nan,Autopsy distributed prebuilt binaries should preserve permissions,https://github.com/sleuthkit/autopsy/issues/7547
2022-2/4,nan,tmpfs files conflict and are not cleaned up correctly,https://github.com/sleuthkit/autopsy/issues/7548
2022-2/7,2023-1/26,Autopsy adds numbers to filenames when extracting files,https://github.com/sleuthkit/autopsy/issues/7549
2022-3/4,nan,Configurable tile servers in map config,https://github.com/sleuthkit/autopsy/issues/7567
2022-3/15,2023-1/26,Portable Case report string index out of range -1,https://github.com/sleuthkit/autopsy/issues/7577
2022-3/17,nan,Unable to run Plaso ingest module,https://github.com/sleuthkit/autopsy/issues/7580
2022-3/18,2022-3/18,Unable to make sleuthkit on M1 mac,https://github.com/sleuthkit/autopsy/issues/7581
2022-3/19,nan,Failed to make sleuthkit,https://github.com/sleuthkit/autopsy/issues/7582
2022-3/23,nan,Autopsy on M1 Mac (FYI),https://github.com/sleuthkit/autopsy/issues/7584
2022-3/31,nan,Autopsy does not run on M1 mac,https://github.com/sleuthkit/autopsy/issues/7588
2022-4/7,2022-4/7,Deleted,https://github.com/sleuthkit/autopsy/issues/7593
2022-4/8,nan,Failure importing image file,https://github.com/sleuthkit/autopsy/issues/7595
2022-4/9,nan,Error when using TSK_KEYWORD_HIT artifact type,https://github.com/sleuthkit/autopsy/issues/7598
2022-4/29,nan,held broken packages,https://github.com/sleuthkit/autopsy/issues/7614
2022-7/10,2022-7/12,python example modules,https://github.com/sleuthkit/autopsy/issues/7641
2022-8/11,nan,Cancelling Adding Data Source and Then Adding the Data Source Causes Files and Folders to Go Missing,https://github.com/sleuthkit/autopsy/issues/7652
2022-8/18,nan,Error: Unable to add data to text index. All future text indexing for the current case will be skipped. ,https://github.com/sleuthkit/autopsy/issues/7656
2022-9/14,nan,Possible bug in auto ingest,https://github.com/sleuthkit/autopsy/issues/7669
2022-9/23,2022-9/27,Can't build autopsy from Source,https://github.com/sleuthkit/autopsy/issues/7676
2022-9/23,nan,Getting error when doing the sh unix_setup.sh,https://github.com/sleuthkit/autopsy/issues/7677
2022-10/21,nan,Autopsy won't start,https://github.com/sleuthkit/autopsy/issues/7698
2022-10/24,nan,Only run Yara module on unknown files,https://github.com/sleuthkit/autopsy/issues/7699
2022-11/16,nan, Error getting interesting files sets from settings file. ,https://github.com/sleuthkit/autopsy/issues/7707
2022-11/30,2022-11/30,File not found ,https://github.com/sleuthkit/autopsy/issues/7714
2023-1/3,2023-1/4,Digital signature missing,https://github.com/sleuthkit/autopsy/issues/7719
2023-1/5,2023-1/26,Please Help! Autopsy opens and closes immediately ,https://github.com/sleuthkit/autopsy/issues/7720
2023-1/26,nan,CI is broken since 4.15,https://github.com/sleuthkit/autopsy/issues/7726
2023-1/27,nan,"4.20.0 - M1 mac using current instructions, results in PhotoRec not found",https://github.com/sleuthkit/autopsy/issues/7727
2023-2/5,nan,"Sleuthkit  Error to uncompress file  ""tar xvfz sleuthkit-4.12.0.tar.gz """,https://github.com/sleuthkit/autopsy/issues/7732
2023-2/15,nan,Use profiles for auto ingest ,https://github.com/sleuthkit/autopsy/issues/7734
2023-2/15,2023-2/16,Autopsy shuts down while creating a case,https://github.com/sleuthkit/autopsy/issues/7735
2023-2/19,nan,Hash Set,https://github.com/sleuthkit/autopsy/issues/7736
2023-3/4,nan,Whitespaces in Java Home path not supported,https://github.com/sleuthkit/autopsy/issues/7742
2023-3/29,nan,Not support Java Adoptium,https://github.com/sleuthkit/autopsy/issues/7747
2023-4/7,nan,Central repository data,https://github.com/sleuthkit/autopsy/issues/7748
2023-4/7,nan,Cannot find java. Please use the --jdkhome switch,https://github.com/sleuthkit/autopsy/issues/7749
2023-4/20,nan,Automated Ingest,https://github.com/sleuthkit/autopsy/issues/7750
2023-5/15,nan,Upgrade Apache Commons Text to 1.10.0 CVE-2022-42889,https://github.com/sleuthkit/autopsy/issues/7762
