"['title']","['url']","['createdAt']","['closedAt']"
"Blob storage hangs for files > about 3500 kb","https://github.com/Azure/azure-sdk-for-java/issues/1","2011-12/27","2012-2/16"
"Include CHANGELOG","https://github.com/Azure/azure-sdk-for-java/issues/2","2012-1/31","2012-5/2"
"Readme is inaccurate","https://github.com/Azure/azure-sdk-for-java/issues/4","2012-2/11","2012-5/2"
"Not able to set properties on CloudBlob","https://github.com/Azure/azure-sdk-for-java/issues/8","2012-2/15","2012-2/16"
"md5 checksum not checked on server?","https://github.com/Azure/azure-sdk-for-java/issues/9","2012-2/16","2012-3/2"
"Base64 internal use only","https://github.com/Azure/azure-sdk-for-java/issues/10","2012-2/16","2012-2/20"
"README.md is not actually Markdown","https://github.com/Azure/azure-sdk-for-java/issues/13","2012-2/22","2012-3/19"
"Add note about clear messages for more that 500 entries","https://github.com/Azure/azure-sdk-for-java/issues/22","2012-3/5","2013-1/22"
"Missing computeRangeMD5 configuration for getBlob wrapper","https://github.com/Azure/azure-sdk-for-java/issues/24","2012-3/16","2014-6/24"
"Blob and Queue : ServiceProperties.Logging: backing fields should be ""boolean"" ","https://github.com/Azure/azure-sdk-for-java/issues/26","2012-3/20","2014-6/24"
"Enable the configuration of storage account and key in unit test","https://github.com/Azure/azure-sdk-for-java/issues/35","2012-4/4","2013-1/29"
"Blob unit test failures in the dev-bookmark branch","https://github.com/Azure/azure-sdk-for-java/issues/37","2012-4/5","2012-4/6"
"support top for table query","https://github.com/Azure/azure-sdk-for-java/issues/43","2012-4/9","2014-6/24"
"investigate whether from and other properties of table entity query services are supported. Maybe remove non-supported ones. ","https://github.com/Azure/azure-sdk-for-java/issues/47","2012-4/9","2013-2/21"
"Page blobs > 2GB cannot be created with Blob service layer library","https://github.com/Azure/azure-sdk-for-java/issues/50","2012-4/13","2013-2/21"
"[IaaS] Move APIs from CloudTableClient to CloudTable ","https://github.com/Azure/azure-sdk-for-java/issues/51","2012-4/16","2012-4/17"
"[IaaS] Add sas support in Table.","https://github.com/Azure/azure-sdk-for-java/issues/52","2012-4/16","2012-4/17"
"Support Select in Table service layer","https://github.com/Azure/azure-sdk-for-java/issues/53","2012-4/16","2014-6/24"
"Remove table service-layer QueryEntitiesOptions OrderByFields property","https://github.com/Azure/azure-sdk-for-java/issues/54","2012-4/16","2013-2/21"
"Table: Unify the creation of Batch and single op requests","https://github.com/Azure/azure-sdk-for-java/issues/56","2012-4/24","2013-2/21"
"Add URL Encoding for Keys in Table Batch Operations","https://github.com/Azure/azure-sdk-for-java/issues/58","2012-4/30","2012-5/2"
"SDK does not allow empty string PartitionKey or RowKey values","https://github.com/Azure/azure-sdk-for-java/issues/62","2012-5/1","2014-6/24"
"QueueRestProxy.createMessage throws for null options","https://github.com/Azure/azure-sdk-for-java/issues/68","2012-5/2","2014-6/24"
"International support for ServiceBus in Java SDK","https://github.com/Azure/azure-sdk-for-java/issues/70","2012-5/4","2012-8/7"
"CloudQueue.retrieveMessage ignores QueueRequestOptions and OperationContext Parameters","https://github.com/Azure/azure-sdk-for-java/issues/72","2012-5/14","2014-6/24"
"Unused properties on ContainerACL","https://github.com/Azure/azure-sdk-for-java/issues/73","2012-5/14","2013-1/19"
"BlobContract.create*Blob|copyBlob should return etag of created object","https://github.com/Azure/azure-sdk-for-java/issues/74","2012-5/17","2012-8/7"
"BlobProperties's SequenceNumber property should be nullable","https://github.com/Azure/azure-sdk-for-java/issues/75","2012-5/17","2014-6/24"
"Documentation for SetBlobPropertiesOptions setters is incorrect","https://github.com/Azure/azure-sdk-for-java/issues/76","2012-5/17","2013-1/19"
"getBlobProperties throws when using failing IF_MODIFIED_SINCE access condition","https://github.com/Azure/azure-sdk-for-java/issues/77","2012-5/17","2012-8/7"
"Suggestion: Combine common parts of SetBlobPropertiesOptions and BlobProperties","https://github.com/Azure/azure-sdk-for-java/issues/78","2012-5/17","2013-2/21"
"Silent failure when only specify GetBlobOptions's RangeEnd property","https://github.com/Azure/azure-sdk-for-java/issues/79","2012-5/19","2014-6/24"
"BlobRestProxy.getBlob does not respect GetBlobOptions.setComputeRangeMD5","https://github.com/Azure/azure-sdk-for-java/issues/80","2012-5/20","2012-8/7"
"BlobContract.createPageBlob's length parameter should be long, not int","https://github.com/Azure/azure-sdk-for-java/issues/81","2012-5/20","2012-7/27"
"Suggestion: Allow null container name to indicate root container for blob APIs","https://github.com/Azure/azure-sdk-for-java/issues/82","2012-5/20","2014-6/24"
"Need to properly handle null for blob container names","https://github.com/Azure/azure-sdk-for-java/issues/83","2012-5/20","2012-7/27"
"Get error when try to delete blob snapshot","https://github.com/Azure/azure-sdk-for-java/issues/84","2012-5/21","2012-7/27"
"Source access conditions not honored by BlobRestProxy.copyBlob","https://github.com/Azure/azure-sdk-for-java/issues/85","2012-5/22","2012-8/7"
"Cannot copy blob from implicit root container","https://github.com/Azure/azure-sdk-for-java/issues/86","2012-5/22","2014-6/24"
"All blob lease proxy APIs need to support access conditions","https://github.com/Azure/azure-sdk-for-java/issues/87","2012-5/24","2014-6/24"
"Blob breakLease proxy API signature incorrect","https://github.com/Azure/azure-sdk-for-java/issues/88","2012-5/24","2013-2/8"
"Split maven structure","https://github.com/Azure/azure-sdk-for-java/issues/89","2012-5/28","2014-6/24"
"Base64 decoder doesn't support new lines -- brakes winazurestorage.py, waz-storage","https://github.com/Azure/azure-sdk-for-java/issues/91","2012-5/29","2014-6/25"
"Spike: Service Bus: List*Result classes need to surface continuations","https://github.com/Azure/azure-sdk-for-java/issues/94","2012-6/13","2014-9/12"
"maven plugin for azure","https://github.com/Azure/azure-sdk-for-java/issues/95","2012-6/14","2014-7/29"
"Null Etag in TableResults","https://github.com/Azure/azure-sdk-for-java/issues/96","2012-6/21","2014-6/24"
"TableRestProxy compilation problem","https://github.com/Azure/azure-sdk-for-java/issues/99","2012-6/29","2012-7/24"
"Maven Unit tests not working with JDK 1.7","https://github.com/Azure/azure-sdk-for-java/issues/102","2012-7/10","2013-1/21"
"Queue: updateMessage exposes bug in Queue service","https://github.com/Azure/azure-sdk-for-java/issues/105","2012-7/16","2014-9/12"
"running test goal fails for maven","https://github.com/Azure/azure-sdk-for-java/issues/106","2012-7/16","2012-7/23"
"Table: Using OR with multiple EQ in TableQueryOptions.Query.Filter does not work","https://github.com/Azure/azure-sdk-for-java/issues/107","2012-7/16","2013-1/19"
"Annotate classes and methods not meant for public usage","https://github.com/Azure/azure-sdk-for-java/issues/108","2012-7/16","2013-1/21"
"the date set on the message is not sent over as a brokerproperty","https://github.com/Azure/azure-sdk-for-java/issues/109","2012-7/16","2013-8/2"
"Getqueue for an invalid queue returns 200 and the exception is not wrapped in ServiceException.","https://github.com/Azure/azure-sdk-for-java/issues/110","2012-7/16","2012-7/27"
"Table: Need to encode special characters when serializing entity to XML","https://github.com/Azure/azure-sdk-for-java/issues/111","2012-7/16","2013-2/27"
"Service Bus Timeout Messages","https://github.com/Azure/azure-sdk-for-java/issues/112","2012-7/16","2013-4/11"
"Standardize Body/Properties of the ServiceException","https://github.com/Azure/azure-sdk-for-java/issues/113","2012-7/16","2013-2/21"
"Basic client side validation for service bus","https://github.com/Azure/azure-sdk-for-java/issues/114","2012-7/16","2013-4/29"
"Blob support for anonymous requests","https://github.com/Azure/azure-sdk-for-java/issues/115","2012-7/16","2014-7/29"
"Consider: extend ExponentialRetryPolicy to retry failed connections","https://github.com/Azure/azure-sdk-for-java/issues/116","2012-7/16","2014-9/12"
"Blob: CreateBlobPages parameters inconsistent","https://github.com/Azure/azure-sdk-for-java/issues/117","2012-7/16","2014-6/24"
"Servicebus unit test should cleanup the 'test' queue and topic created","https://github.com/Azure/azure-sdk-for-java/issues/118","2012-7/16","2013-3/1"
"Update to newest version of dependencies","https://github.com/Azure/azure-sdk-for-java/issues/119","2012-7/16","2013-2/13"
"Queue: ListQueuesOptions.*MaxResults should be Integer, not int","https://github.com/Azure/azure-sdk-for-java/issues/120","2012-7/16","2014-9/13"
"Queue: createMessage should throw for null message instead of submitting","https://github.com/Azure/azure-sdk-for-java/issues/121","2012-7/16","2013-3/13"
"Table: ListTablesOptions should have NextTableName property","https://github.com/Azure/azure-sdk-for-java/issues/122","2012-7/16","2013-2/12"
"Table: Entity getters assume strings, but there is no check","https://github.com/Azure/azure-sdk-for-java/issues/123","2012-7/16","2013-2/12"
"Table: TableRestProxy imports classes from ...blob.implementation","https://github.com/Azure/azure-sdk-for-java/issues/124","2012-7/16","2013-8/2"
"Table: Entity's Timestamp should not have a setter","https://github.com/Azure/azure-sdk-for-java/issues/125","2012-7/16","2014-6/24"
"Table: batch method does not validate Operations types","https://github.com/Azure/azure-sdk-for-java/issues/126","2012-7/16","2013-2/12"
"Table: BatchResult returns a list empty abstract classes","https://github.com/Azure/azure-sdk-for-java/issues/127","2012-7/16","2013-2/12"
"Table: BatchResult.Entry name confusingly similar to Entity","https://github.com/Azure/azure-sdk-for-java/issues/128","2012-7/16","2013-2/12"
"Table: Classes derived from BatchResult.Entry need more descriptive names","https://github.com/Azure/azure-sdk-for-java/issues/129","2012-7/16","2013-2/12"
"Core: ServiceException.getHttpStatusCode should be Integer, not int","https://github.com/Azure/azure-sdk-for-java/issues/130","2012-7/16","2013-1/19"
"Table: Property class name misleading, really an EDM value","https://github.com/Azure/azure-sdk-for-java/issues/131","2012-7/16","2013-2/12"
"Table: Pass type information in Constant filter for consistancy","https://github.com/Azure/azure-sdk-for-java/issues/132","2012-7/16","2013-1/19"
"Queue: Need fluent setters for these classes","https://github.com/Azure/azure-sdk-for-java/issues/133","2012-7/16","2012-10/16"
"Blob: Need fluent setters for these classes","https://github.com/Azure/azure-sdk-for-java/issues/134","2012-7/16","2013-4/11"
"Table: BatchOperations.Operation should define common properties","https://github.com/Azure/azure-sdk-for-java/issues/135","2012-7/16","2014-9/12"
"Implement Java checkstyle","https://github.com/Azure/azure-sdk-for-java/issues/136","2012-7/17","2012-7/18"
"Validate parameter for each public method in Java SDK","https://github.com/Azure/azure-sdk-for-java/issues/137","2012-7/17","2013-1/22"
"Add unit tests, establish code coverage standard for Java","https://github.com/Azure/azure-sdk-for-java/issues/141","2012-7/30","2013-1/22"
"provide decode numeric character reference in convenience layer","https://github.com/Azure/azure-sdk-for-java/issues/142","2012-7/31","2014-10/24"
"test createBlobBlockNullContainerWorks depends on presence of root blob container","https://github.com/Azure/azure-sdk-for-java/issues/144","2012-8/7","2012-10/18"
"Provisioning virtual machines","https://github.com/Azure/azure-sdk-for-java/issues/147","2012-8/27","2013-2/12"
"Unit test createBlobBlockNullContainerWorks fails if storage account doesn’t have the $root container ","https://github.com/Azure/azure-sdk-for-java/issues/148","2012-9/6","2012-9/21"
"Error","https://github.com/Azure/azure-sdk-for-java/issues/150","2012-9/16","2012-9/21"
"Consider making API classes non-final, or implement interfaces","https://github.com/Azure/azure-sdk-for-java/issues/153","2012-9/21","2014-9/12"
"BlobClient.listContainers does not work.","https://github.com/Azure/azure-sdk-for-java/issues/156","2012-10/1","2014-9/12"
"Client clock skew can cause getBlobPropertiesIfNotModified unit test to fail","https://github.com/Azure/azure-sdk-for-java/issues/164","2012-10/17","2012-10/17"
"ServiceBusIntegrationTest.rulesMayHaveActionAndFilter unit test failing","https://github.com/Azure/azure-sdk-for-java/issues/165","2012-10/17","2012-10/19"
"Storage client unit test failures","https://github.com/Azure/azure-sdk-for-java/issues/166","2012-10/17","2013-4/10"
"Cleanup listBlockBlobWithNoCommittedBlocksWorks unit test","https://github.com/Azure/azure-sdk-for-java/issues/171","2012-10/19","2013-1/19"
"Unit test testListQueuesAndListQueuesSegmentedLargeNumber  takes too long at takes too much storage resources","https://github.com/Azure/azure-sdk-for-java/issues/175","2012-10/25","2014-7/29"
"Javadoc build warnings for convenience layer should be fixed","https://github.com/Azure/azure-sdk-for-java/issues/181","2012-10/31","2014-9/13"
"Javadoc build warnings for service layer should be fixed","https://github.com/Azure/azure-sdk-for-java/issues/182","2012-10/31","2014-6/25"
"Need to add version info to POM for plugins","https://github.com/Azure/azure-sdk-for-java/issues/183","2012-10/31","2012-10/31"
"Javadocs incorrect for Table string values ","https://github.com/Azure/azure-sdk-for-java/issues/185","2012-11/8","2014-6/24"
"Locale consistency: Some APIs use getBytes() and some use getBytes(""UTF-8"")","https://github.com/Azure/azure-sdk-for-java/issues/186","2012-11/8","2013-4/26"
"Blob: break lease should not require lease_id","https://github.com/Azure/azure-sdk-for-java/issues/187","2012-11/20","2013-1/29"
