"['title']","['url']","['createdAt']","['closedAt']"
"GTFS library writes NaN shape_dist_traveled as NaN not """"","https://github.com/opentripplanner/OpenTripPlanner/issues/1736","2015-2/5","2015-2/10"
"Differentiate between required columns and required non-empty fields","https://github.com/opentripplanner/OpenTripPlanner/issues/1737","2015-2/5","2020-10/15"
"GTFS library does not handle calendar date exception types correctly","https://github.com/opentripplanner/OpenTripPlanner/issues/1738","2015-2/5","2015-2/6"
"Support blank shape_dist_traveled","https://github.com/opentripplanner/OpenTripPlanner/issues/1739","2015-2/5","2022-6/19"
"Itineraries leaving before request time","https://github.com/opentripplanner/OpenTripPlanner/issues/1745","2015-2/9","2020-10/29"
"endRecord not called for frequencies","https://github.com/opentripplanner/OpenTripPlanner/issues/1746","2015-2/10","2015-2/10"
"Implement BANO Geocoder","https://github.com/opentripplanner/OpenTripPlanner/issues/1747","2015-2/11","2015-2/11"
"Merge bedatadriven GeoJON implementation with geojson-jackson library.","https://github.com/opentripplanner/OpenTripPlanner/issues/1748","2015-2/11","2015-2/19"
"Develop a wrapper to save scripting output to PostGIS","https://github.com/opentripplanner/OpenTripPlanner/issues/1749","2015-2/12","2022-6/20"
"New GTFS Library should handle extended GTFS route types","https://github.com/opentripplanner/OpenTripPlanner/issues/1751","2015-2/17","2015-12/10"
"OTP JAR is big again","https://github.com/opentripplanner/OpenTripPlanner/issues/1752","2015-2/20","2015-6/8"
"BusRouteStreetMatcher is very slow","https://github.com/opentripplanner/OpenTripPlanner/issues/1753","2015-2/20","2022-6/20"
"Wrong AgencyAndId attribution to routes","https://github.com/opentripplanner/OpenTripPlanner/issues/1755","2015-2/20","2022-6/20"
"Documentation error related to setting the basePath of OTP","https://github.com/opentripplanner/OpenTripPlanner/issues/1757","2015-2/22","2015-2/23"
"The default 'timeout' configuration option for the routing parameters seems off","https://github.com/opentripplanner/OpenTripPlanner/issues/1758","2015-2/22","2015-2/22"
"Unclarity in new configuration documentation","https://github.com/opentripplanner/OpenTripPlanner/issues/1759","2015-2/22","2020-10/13"
"RouterLifecycleManager interface not necessary","https://github.com/opentripplanner/OpenTripPlanner/issues/1760","2015-2/22","2020-10/15"
"GraphSource.Factory has only one implementation","https://github.com/opentripplanner/OpenTripPlanner/issues/1761","2015-2/22","2020-10/15"
"Add `--version` to output current version on command line","https://github.com/opentripplanner/OpenTripPlanner/issues/1766","2015-2/23","2015-3/23"
"Bike Routing and stairs","https://github.com/opentripplanner/OpenTripPlanner/issues/1768","2015-2/23","2015-10/29"
"multiple occurrences of query params in RoutingResource no longer used","https://github.com/opentripplanner/OpenTripPlanner/issues/1770","2015-2/25","2020-10/15"
"Remove ""qualified mode set sequence"", keeping qualified modes","https://github.com/opentripplanner/OpenTripPlanner/issues/1771","2015-2/25","2022-6/20"
"Remove custom_motor_vehicle and alternative coordinate system support","https://github.com/opentripplanner/OpenTripPlanner/issues/1772","2015-2/25","2015-2/25"
"Use reflection to set routing request","https://github.com/opentripplanner/OpenTripPlanner/issues/1773","2015-2/25","2020-10/13"
"writeDoubleField formats doubles incorrectly in non-English locale","https://github.com/opentripplanner/OpenTripPlanner/issues/1775","2015-2/26","2015-2/26"
"Unconnected stops next to walk paths","https://github.com/opentripplanner/OpenTripPlanner/issues/1776","2015-2/26","2020-10/15"
"Previous and next buttons not working in itineraries widget","https://github.com/opentripplanner/OpenTripPlanner/issues/1778","2015-2/27","2015-3/3"
"NPE in getStoptimesForStopAndDate request","https://github.com/opentripplanner/OpenTripPlanner/issues/1780","2015-3/2","2015-3/3"
"Graph::removeVertexAndEdges() does not allow looping edges","https://github.com/opentripplanner/OpenTripPlanner/issues/1781","2015-3/2","2015-3/2"
"Shift to MapDB 2.0","https://github.com/opentripplanner/OpenTripPlanner/issues/1783","2015-3/2","2020-10/13"
"IntermediatePlaces doesn't seem to work","https://github.com/opentripplanner/OpenTripPlanner/issues/1784","2015-3/2","2020-10/29"
"Single-state SPT limits mode options","https://github.com/opentripplanner/OpenTripPlanner/issues/1785","2015-3/2","2015-3/27"
"Create a Gitter room for OpenTripPlanner","https://github.com/opentripplanner/OpenTripPlanner/issues/1786","2015-3/3","2020-10/13"
"WayPropertySetSource configuration","https://github.com/opentripplanner/OpenTripPlanner/issues/1787","2015-3/3","2022-6/20"
"The Gradle config is no longer working, but is found before the working Maven config by IDE's","https://github.com/opentripplanner/OpenTripPlanner/issues/1790","2015-3/5","2015-3/25"
"Missing tripId in getStoptimesForStopAndDate request","https://github.com/opentripplanner/OpenTripPlanner/issues/1791","2015-3/5","2015-3/23"
"Consider Itineraries that Exceed Max Walk","https://github.com/opentripplanner/OpenTripPlanner/issues/1792","2015-3/5","2022-6/24"
"Apply Max Walk Distance to Entire Trip","https://github.com/opentripplanner/OpenTripPlanner/issues/1793","2015-3/5","2022-6/20"
"OTP Not Using Optimal Board/Alight Stop","https://github.com/opentripplanner/OpenTripPlanner/issues/1794","2015-3/5","2015-11/19"
"Unnecessary Backtracking on Route","https://github.com/opentripplanner/OpenTripPlanner/issues/1795","2015-3/5","2022-6/20"
"Best Result Not Being Returned First","https://github.com/opentripplanner/OpenTripPlanner/issues/1796","2015-3/5","2020-10/15"
"Append ""(path)"" to Footpaths Adjacent to a Similarly-Named Street","https://github.com/opentripplanner/OpenTripPlanner/issues/1797","2015-3/5","2015-4/8"
"Gondola Routes Not Being Used in General Transit Searches","https://github.com/opentripplanner/OpenTripPlanner/issues/1798","2015-3/5","2020-10/15"
"Incorrect Element Naming in XML Response","https://github.com/opentripplanner/OpenTripPlanner/issues/1799","2015-3/5","2016-10/7"
"Simple earliest arrival searches stall for long periods of time","https://github.com/opentripplanner/OpenTripPlanner/issues/1800","2015-3/5","2020-10/15"
"When propagating time ranges from profile routing to the street network, we should use an earliest-arrival search","https://github.com/opentripplanner/OpenTripPlanner/issues/1801","2015-3/6","2020-10/15"
"When finding nearby stops or a non-transit journey, use an earliest arrival search","https://github.com/opentripplanner/OpenTripPlanner/issues/1802","2015-3/6","2015-3/12"
"Pareto search should dominate identical states","https://github.com/opentripplanner/OpenTripPlanner/issues/1803","2015-3/6","2015-3/12"
"Triangle inequality test should use earliest arrival search","https://github.com/opentripplanner/OpenTripPlanner/issues/1804","2015-3/6","2015-3/12"
"WalkableAreaBuilder.pruneAreaEdges should use earliest arrival","https://github.com/opentripplanner/OpenTripPlanner/issues/1805","2015-3/6","2022-6/20"
"ResultSetWithTimes has no result","https://github.com/opentripplanner/OpenTripPlanner/issues/1806","2015-3/6","2015-3/12"
"walkLimitExceeded is always false in response","https://github.com/opentripplanner/OpenTripPlanner/issues/1808","2015-3/11","2020-10/15"
"Store OSM id in edges","https://github.com/opentripplanner/OpenTripPlanner/issues/1809","2015-3/12","2015-7/23"
"Negative edge IDs for backward edges","https://github.com/opentripplanner/OpenTripPlanner/issues/1810","2015-3/12","2015-3/16"
"Outgoing and Incoming are nulls when deserializing Vertex","https://github.com/opentripplanner/OpenTripPlanner/issues/1811","2015-3/12","2015-7/23"
"Assigning of permissions","https://github.com/opentripplanner/OpenTripPlanner/issues/1812","2015-3/12","2020-10/29"
"Unique identifier of User","https://github.com/opentripplanner/OpenTripPlanner/issues/1813","2015-3/12","2020-10/29"
"Missing boarding and alighting in TripTimeShort and StopShort","https://github.com/opentripplanner/OpenTripPlanner/issues/1815","2015-3/13","2022-6/22"
"Represent Access/Egress Legs as Edge Sequence in Profile Router Response","https://github.com/opentripplanner/OpenTripPlanner/issues/1816","2015-3/13","2022-6/22"
"Copy highway tag to relation member ways","https://github.com/opentripplanner/OpenTripPlanner/issues/1817","2015-3/13","2022-6/22"
"PointSets are slow to deserialize","https://github.com/opentripplanner/OpenTripPlanner/issues/1819","2015-3/13","2015-3/23"
"Map bus and Tram Itineraries to Streets ","https://github.com/opentripplanner/OpenTripPlanner/issues/1820","2015-3/16","2015-7/23"
"Trip with blank final times should not crash OTP","https://github.com/opentripplanner/OpenTripPlanner/issues/1821","2015-3/16","2022-6/22"
"Fare Service configuration using JSON","https://github.com/opentripplanner/OpenTripPlanner/issues/1822","2015-3/16","2015-4/1"
"Field Trip Module - Capacity bug","https://github.com/opentripplanner/OpenTripPlanner/issues/1823","2015-3/17","2020-10/13"
"Path by bicycle is impossible","https://github.com/opentripplanner/OpenTripPlanner/issues/1824","2015-3/19","2015-3/21"
"Domination in profile routing","https://github.com/opentripplanner/OpenTripPlanner/issues/1828","2015-3/23","2020-10/15"
"Profile routing shows increase in worst-case accessibility for line deletion","https://github.com/opentripplanner/OpenTripPlanner/issues/1829","2015-3/23","2022-6/22"
"OTP stock web UI: Analyst module problems","https://github.com/opentripplanner/OpenTripPlanner/issues/1830","2015-3/23","2020-10/15"
"maxWalkDistance influences Park-and-Ride and Bike-and-Ride results","https://github.com/opentripplanner/OpenTripPlanner/issues/1833","2015-3/23","2022-6/23"
"Profile routing: access to transit times should be ranges","https://github.com/opentripplanner/OpenTripPlanner/issues/1834","2015-3/24","2015-3/25"
"Cache and reuse profile routing computations","https://github.com/opentripplanner/OpenTripPlanner/issues/1835","2015-3/24","2020-10/15"
"Profile Router is Routing Walk/Bike-Only Trips on Transit Network","https://github.com/opentripplanner/OpenTripPlanner/issues/1836","2015-3/24","2015-3/24"
"RoutingRequest constructors have strange behavior","https://github.com/opentripplanner/OpenTripPlanner/issues/1837","2015-3/24","2022-6/23"
"profile routing access times should be ranges","https://github.com/opentripplanner/OpenTripPlanner/issues/1838","2015-3/25","2020-10/29"
"walkSpeed not entirely respected in profile routing propagation","https://github.com/opentripplanner/OpenTripPlanner/issues/1839","2015-3/26","2022-6/24"
"Implement GraphBuilderParameters::embedRouterConfig","https://github.com/opentripplanner/OpenTripPlanner/issues/1840","2015-3/26","2015-3/27"
"Bicycle Rent being shown as an access mode when it is only walking","https://github.com/opentripplanner/OpenTripPlanner/issues/1842","2015-3/30","2022-6/24"
"Access Modes Hidden When Faster Access Mode Available","https://github.com/opentripplanner/OpenTripPlanner/issues/1843","2015-3/30","2015-4/9"
"Slow (8 minutes) transfer generation","https://github.com/opentripplanner/OpenTripPlanner/issues/1844","2015-4/1","2020-10/29"
"How to connect python to MySQL","https://github.com/opentripplanner/OpenTripPlanner/issues/1845","2015-4/1","2015-4/1"
"Always specify router IDs on command line and eliminate 'default' router ID","https://github.com/opentripplanner/OpenTripPlanner/issues/1846","2015-4/1","2020-10/13"
"Unable to reload graph with HTTP API","https://github.com/opentripplanner/OpenTripPlanner/issues/1847","2015-4/1","2015-4/3"
"Wrong walking segment","https://github.com/opentripplanner/OpenTripPlanner/issues/1850","2015-4/2","2022-6/26"
"Potential race condition in PartialStreetEdge","https://github.com/opentripplanner/OpenTripPlanner/issues/1851","2015-4/2","2022-3/25"
"typos in Developer's Guide","https://github.com/opentripplanner/OpenTripPlanner/issues/1852","2015-4/3","2015-4/8"
"Remove initial wait clamping","https://github.com/opentripplanner/OpenTripPlanner/issues/1854","2015-4/6","2020-10/15"
"Assumptions about dominance function when building TimeSurface from SPT","https://github.com/opentripplanner/OpenTripPlanner/issues/1855","2015-4/6","2020-7/7"
" OTP Security instructions are apparently incomplete ","https://github.com/opentripplanner/OpenTripPlanner/issues/1856","2015-4/7","2022-6/26"
"Profile routing: direct (nontransit) options take 2/3 of search time","https://github.com/opentripplanner/OpenTripPlanner/issues/1857","2015-4/7","2022-6/26"
"rename maxWalkDistance parameter","https://github.com/opentripplanner/OpenTripPlanner/issues/1859","2015-4/8","2022-5/26"
"Ordering of intermediatePlaces is no longer solved with Traveling Salesman","https://github.com/opentripplanner/OpenTripPlanner/issues/1860","2015-4/8","2020-10/29"
"parameter to limit CAR access to street classes","https://github.com/opentripplanner/OpenTripPlanner/issues/1864","2015-4/9","2022-6/26"
"Profile routing: access point logic is wrong","https://github.com/opentripplanner/OpenTripPlanner/issues/1865","2015-4/9","2022-6/26"
"Profile Routing: prune paths at the destination","https://github.com/opentripplanner/OpenTripPlanner/issues/1866","2015-4/9","2015-4/9"
"stoptimes for Frequency Based trip","https://github.com/opentripplanner/OpenTripPlanner/issues/1867","2015-4/9","2022-6/26"
"POST Graph to server without router","https://github.com/opentripplanner/OpenTripPlanner/issues/1868","2015-4/9","2015-4/9"
"Specify router for web interface","https://github.com/opentripplanner/OpenTripPlanner/issues/1869","2015-4/10","2015-4/10"
"Standard API Responses","https://github.com/opentripplanner/OpenTripPlanner/issues/1870","2015-4/10","2020-10/14"
"timepoint attribute response","https://github.com/opentripplanner/OpenTripPlanner/issues/1871","2015-4/13","2022-6/27"
