"['title']","['url']","['createdAt']","['closedAt']"
"Multimodal traversals to destination vertex","https://github.com/opentripplanner/OpenTripPlanner/issues/2808","2019-8/15","2022-8/29"
"Possible duplicates from modified StopPattern in realtime","https://github.com/opentripplanner/OpenTripPlanner/issues/2810","2019-8/21","2019-11/22"
"GBFS URL going bad causes sudden, massive memory leak","https://github.com/opentripplanner/OpenTripPlanner/issues/2811","2019-8/21","2022-8/29"
"Support for Netex extensions to Stop and Stations ","https://github.com/opentripplanner/OpenTripPlanner/issues/2813","2019-8/26","2020-1/6"
"GBFS assumes incorrect URL structure","https://github.com/opentripplanner/OpenTripPlanner/issues/2814","2019-8/26","2021-12/14"
"Two transit stops with the same GPS coordinate will not be transferrable in trip plans","https://github.com/opentripplanner/OpenTripPlanner/issues/2815","2019-8/28","2019-8/30"
"dev-1.x Test failure testBicimad","https://github.com/opentripplanner/OpenTripPlanner/issues/2816","2019-8/29","2020-10/13"
"New feature - UK Way Property Set","https://github.com/opentripplanner/OpenTripPlanner/issues/2818","2019-8/29","2019-11/2"
"Support for Netex Authority on Network and Operator on Route and Trip","https://github.com/opentripplanner/OpenTripPlanner/issues/2823","2019-9/3","2019-10/9"
"Support for NeTEx notices","https://github.com/opentripplanner/OpenTripPlanner/issues/2824","2019-9/4","2019-10/9"
"Uber vehicle availability requests throw 500 errors after ~10 days","https://github.com/opentripplanner/OpenTripPlanner/issues/2827","2019-9/10","2022-8/30"
"car2go trip requests stopped working","https://github.com/opentripplanner/OpenTripPlanner/issues/2828","2019-9/10","2022-8/30"
"Consider all edges near origin / destination","https://github.com/opentripplanner/OpenTripPlanner/issues/2831","2019-9/22","2022-8/30"
"translations.txt file in GTFS","https://github.com/opentripplanner/OpenTripPlanner/issues/2832","2019-9/25","null"
"First start/end search is slow","https://github.com/opentripplanner/OpenTripPlanner/issues/2833","2019-10/1","2020-10/15"
"Barrier: turnstile","https://github.com/opentripplanner/OpenTripPlanner/issues/2834","2019-10/2","2022-8/31"
"Multiple Entity ID Implementations (with/without feed scope)","https://github.com/opentripplanner/OpenTripPlanner/issues/2838","2019-10/9","2022-8/31"
"OpenTripPlanner does not accept all protobuf content-type options","https://github.com/opentripplanner/OpenTripPlanner/issues/2839","2019-10/9","2019-10/15"
"Re-implement stop banning in OTP2 (if there is demand)","https://github.com/opentripplanner/OpenTripPlanner/issues/2843","2019-10/11","2022-8/31"
"GraphQL class cast exception on transfers","https://github.com/opentripplanner/OpenTripPlanner/issues/2844","2019-10/12","2022-9/1"
"Unify SIRI-SX with Netex Notices and GTFS-RT Alerts","https://github.com/opentripplanner/OpenTripPlanner/issues/2846","2019-10/14","2022-9/1"
"Can't build graph with large OSM files","https://github.com/opentripplanner/OpenTripPlanner/issues/2849","2019-10/17","2020-3/7"
"Multiple consecutive walk legs through stops","https://github.com/opentripplanner/OpenTripPlanner/issues/2850","2019-10/19","2019-11/15"
"Netex import fails when Flex Lines exist in zip file ","https://github.com/opentripplanner/OpenTripPlanner/issues/2851","2019-10/21","2019-10/23"
"Review of log messages","https://github.com/opentripplanner/OpenTripPlanner/issues/2853","2019-10/23","2019-11/15"
"Minor documentation update","https://github.com/opentripplanner/OpenTripPlanner/issues/2856","2019-10/24","2019-11/14"
"OTP2 does not take slopes into account","https://github.com/opentripplanner/OpenTripPlanner/issues/2857","2019-10/25","2019-11/19"
"OTP dev-2.x branch error compiling: invalid flag --release","https://github.com/opentripplanner/OpenTripPlanner/issues/2859","2019-10/29","2019-10/30"
"OTP return same Itineraries","https://github.com/opentripplanner/OpenTripPlanner/issues/2867","2019-11/5","2022-9/1"
"Improve OTP data import report","https://github.com/opentripplanner/OpenTripPlanner/issues/2869","2019-11/6","null"
"OTP fails with a NPE on missing stops in the Netex import","https://github.com/opentripplanner/OpenTripPlanner/issues/2872","2019-11/11","2022-3/16"
"OTP bug plan request on route calculation by bus","https://github.com/opentripplanner/OpenTripPlanner/issues/2873","2019-11/12","2019-11/15"
" Request more than one itinerary with profile CAR, WALK or BYCICLE","https://github.com/opentripplanner/OpenTripPlanner/issues/2875","2019-11/13","2019-11/15"
"Combine all OpenStreetMapProviders and OpenStreetMapContentHandlers","https://github.com/opentripplanner/OpenTripPlanner/issues/2878","2019-11/14","2022-3/16"
"Remove StateData","https://github.com/opentripplanner/OpenTripPlanner/issues/2879","2019-11/14","2022-9/1"
"Graph builder stops unexpectedly","https://github.com/opentripplanner/OpenTripPlanner/issues/2880","2019-11/14","2019-11/15"
"IntermediatePlaces not working for isochrones","https://github.com/opentripplanner/OpenTripPlanner/issues/2883","2019-11/17","2020-10/15"
"ArrayIndexOutOfBoundsException happened when creating Ride from TransitPathLeg","https://github.com/opentripplanner/OpenTripPlanner/issues/2884","2019-11/18","2019-12/11"
"ArriveBy implementation and optimization in Raptor","https://github.com/opentripplanner/OpenTripPlanner/issues/2885","2019-11/18","2020-3/20"
"Optimization tuning parameters should be ""hidden"" from OTP clients","https://github.com/opentripplanner/OpenTripPlanner/issues/2886","2019-11/18","2022-9/1"
"NPE exception when try to create StopShort object without parentStation","https://github.com/opentripplanner/OpenTripPlanner/issues/2888","2019-11/19","2022-9/1"
"A travel advice better then no travel advice at all.","https://github.com/opentripplanner/OpenTripPlanner/issues/2889","2019-11/20","2022-3/16"
"Pluggable strategy for reading and writing to data sources","https://github.com/opentripplanner/OpenTripPlanner/issues/2891","2019-11/21","2020-10/13"
"GitHub Security alert on axis, commons-compress, and jackson-databind","https://github.com/opentripplanner/OpenTripPlanner/issues/2892","2019-11/22","2022-9/1"
"GTFS import crashes on unsupported modes","https://github.com/opentripplanner/OpenTripPlanner/issues/2899","2019-11/26","null"
"Car routing - motorcar=agricultural should be denied","https://github.com/opentripplanner/OpenTripPlanner/issues/2901","2019-11/27","2022-9/2"
"Missing info about how to get Vertex Label","https://github.com/opentripplanner/OpenTripPlanner/issues/2903","2019-12/8","2020-10/15"
"Support for OTP command line parameters --buildOsm and --loadOsm","https://github.com/opentripplanner/OpenTripPlanner/issues/2904","2019-12/9","2020-6/5"
"Optimize list of pattens for stops","https://github.com/opentripplanner/OpenTripPlanner/issues/2913","2019-12/23","2022-3/16"
"Lime e-scooters intermittently available","https://github.com/opentripplanner/OpenTripPlanner/issues/2914","2019-12/27","2020-2/8"
"TransitLayer realtime updates are slow and can be out of sync with Graph","https://github.com/opentripplanner/OpenTripPlanner/issues/2918","2020-1/3","2020-2/6"
"MBTA GTFS feed doesn't work / OTP doesn't support missing stop_lat/stop_lon","https://github.com/opentripplanner/OpenTripPlanner/issues/2923","2020-1/11","2022-1/5"
"Limit the transit service period","https://github.com/opentripplanner/OpenTripPlanner/issues/2925","2020-1/12","2020-1/24"
"Unexpected cost added for the wait time between access and transit with range raptor","https://github.com/opentripplanner/OpenTripPlanner/issues/2927","2020-1/16","2020-1/24"
"NPE for StateEditor.makeState() in ItineraryMapper.java","https://github.com/opentripplanner/OpenTripPlanner/issues/2930","2020-1/19","2020-1/19"
"Dynamic search parameters","https://github.com/opentripplanner/OpenTripPlanner/issues/2931","2020-1/24","2020-2/7"
"Missing publicCode on Line","https://github.com/opentripplanner/OpenTripPlanner/issues/2933","2020-1/27","2020-2/6"
"""shape data"" is not reflected in the graphQL API ","https://github.com/opentripplanner/OpenTripPlanner/issues/2934","2020-1/27","2020-2/3"
"Prioritize individual stops when routing","https://github.com/opentripplanner/OpenTripPlanner/issues/2935","2020-1/28","2020-4/23"
"Filter routing result ","https://github.com/opentripplanner/OpenTripPlanner/issues/2936","2020-1/28","2020-10/13"
"route#route_sort_order set to a value by default","https://github.com/opentripplanner/OpenTripPlanner/issues/2938","2020-1/28","2020-1/31"
"maximumTransfers parameter is not taken into consideration","https://github.com/opentripplanner/OpenTripPlanner/issues/2939","2020-1/29","2020-2/6"
"""departure board"" requests does not return the first relevant departures ","https://github.com/opentripplanner/OpenTripPlanner/issues/2940","2020-1/29","2020-2/6"
"Support for next/previous paging of trip results.","https://github.com/opentripplanner/OpenTripPlanner/issues/2941","2020-1/29","2020-2/7"
"Bicycle routing - agricultural and forestry don't allow through traffic","https://github.com/opentripplanner/OpenTripPlanner/issues/2943","2020-1/30","2022-8/4"
"NullPointerException in GraphPathToTripPlanConverter::makePlaces","https://github.com/opentripplanner/OpenTripPlanner/issues/2948","2020-1/31","2020-2/7"
"DirectoryDataSourceTest.testIO test failure","https://github.com/opentripplanner/OpenTripPlanner/issues/2950","2020-2/2","2021-1/21"
"Netex import does not support ServiceLinks","https://github.com/opentripplanner/OpenTripPlanner/issues/2951","2020-2/3","2020-2/19"
"dev-2.x problem loading graph","https://github.com/opentripplanner/OpenTripPlanner/issues/2953","2020-2/3","2020-2/3"
"Index.stopTimesForStop does not handle added TripPatterns","https://github.com/opentripplanner/OpenTripPlanner/issues/2954","2020-2/4","2020-2/26"
"OTP2 - negative waiting time","https://github.com/opentripplanner/OpenTripPlanner/issues/2955","2020-2/4","2022-3/16"
"OTP2 routerInfo","https://github.com/opentripplanner/OpenTripPlanner/issues/2956","2020-2/4","2020-3/20"
"Remove BusRouteStreetMatcher and associated classes.","https://github.com/opentripplanner/OpenTripPlanner/issues/2957","2020-2/5","2020-6/11"
"Performance is not as expected","https://github.com/opentripplanner/OpenTripPlanner/issues/2958","2020-2/5","2022-9/4"
"NullPointerException in GeometryUtils#addStartEndCoordinatesToLineString","https://github.com/opentripplanner/OpenTripPlanner/issues/2962","2020-2/6","2020-2/7"
"Turn restrictions not propagated to split street edges","https://github.com/opentripplanner/OpenTripPlanner/issues/2965","2020-2/9","2021-4/14"
"autoScan missed for OTP 2.0","https://github.com/opentripplanner/OpenTripPlanner/issues/2967","2020-2/9","2020-11/13"
"Missing parent station will cause NullPointerException when getting StopShort","https://github.com/opentripplanner/OpenTripPlanner/issues/2968","2020-2/10","2020-4/16"
"OTPv2 - missing leg fields","https://github.com/opentripplanner/OpenTripPlanner/issues/2977","2020-2/14","2020-7/30"
"NeTEx import fails when StopPoints are not found","https://github.com/opentripplanner/OpenTripPlanner/issues/2979","2020-2/18","2020-2/26"
"OTP Routing API calculates are calculated individually for several cutoffSec","https://github.com/opentripplanner/OpenTripPlanner/issues/2985","2020-2/25","2022-9/4"
"Geometries are lost when TripPatterns are updated","https://github.com/opentripplanner/OpenTripPlanner/issues/2987","2020-2/27","2020-3/5"
"Turn restrictions not respected due to (de)serialization issues","https://github.com/opentripplanner/OpenTripPlanner/issues/2991","2020-2/29","2022-9/4"
"Static street notes get lost in (de)serialization","https://github.com/opentripplanner/OpenTripPlanner/issues/2992","2020-3/1","2022-9/5"
"Paging do not work when there is no results within the search-window. ","https://github.com/opentripplanner/OpenTripPlanner/issues/2995","2020-3/3","2020-3/20"
"feature proposal: generate OpenAPI v3+ specification for the REST apis in OTP dev-1.x, dev-2.x","https://github.com/opentripplanner/OpenTripPlanner/issues/2998","2020-3/7","2020-5/24"
"missing foot legs","https://github.com/opentripplanner/OpenTripPlanner/issues/3001","2020-3/9","2020-3/19"
"Infinite recursion in WalkSteps#addAlert","https://github.com/opentripplanner/OpenTripPlanner/issues/3008","2020-3/18","2020-3/19"
"Log of sub-optimal routing results @Entur ","https://github.com/opentripplanner/OpenTripPlanner/issues/3012","2020-3/20","2020-5/19"
"Stay on the same mode for a given trip","https://github.com/opentripplanner/OpenTripPlanner/issues/3013","2020-3/20","2022-9/5"
"Support for turning *TimeTable View* off","https://github.com/opentripplanner/OpenTripPlanner/issues/3014","2020-3/20","2021-2/18"
"Extreme interchange + wait creates silly journey suggestion","https://github.com/opentripplanner/OpenTripPlanner/issues/3015","2020-3/23","2022-9/5"
"Journey not visually complete at end","https://github.com/opentripplanner/OpenTripPlanner/issues/3016","2020-3/23","2020-4/16"
"--loadStreet Buffer underflow","https://github.com/opentripplanner/OpenTripPlanner/issues/3018","2020-3/25","2020-3/31"
"Merge otp-config, router-config and build-config.","https://github.com/opentripplanner/OpenTripPlanner/issues/3020","2020-3/27","2022-9/5"
"'Transit' option returns itineraries with car + transit + walk","https://github.com/opentripplanner/OpenTripPlanner/issues/3021","2020-3/27","2020-3/28"
"Read-only working directory in graph-builder mode","https://github.com/opentripplanner/OpenTripPlanner/issues/3023","2020-3/31","2020-4/15"
"OTP Routing / transfer issues with certain GTFS feeds","https://github.com/opentripplanner/OpenTripPlanner/issues/3026","2020-3/31","2022-9/5"
"Refactor OTP2 Internal TransitLayer","https://github.com/opentripplanner/OpenTripPlanner/issues/3030","2020-4/3","2022-9/6"
"Geotools is missing from used repositories","https://github.com/opentripplanner/OpenTripPlanner/issues/3034","2020-4/16","2020-6/11"
