"['title']","['url']","['createdAt']","['closedAt']"
"Creating a new RMarkdown file or Shiny app waits for the R runtime to be free","https://github.com/rstudio/rstudio/issues/9672","2021-7/28","null"
"Splitter cursor different on Mac Desktop (Electron)","https://github.com/rstudio/rstudio/issues/9673","2021-7/28","2022-3/30"
"consider tweaking display of calendar version number in About dialog","https://github.com/rstudio/rstudio/issues/9675","2021-7/29","2021-8/26"
"include Copy button in RStudio about dialog","https://github.com/rstudio/rstudio/issues/9677","2021-7/29","2022-1/27"
"python chunk inserted even when R chunk is already in file","https://github.com/rstudio/rstudio/issues/9678","2021-7/29","2021-8/11"
"visual editor quote and en-dash symbol conversion creates unintended source markdown","https://github.com/rstudio/rstudio/issues/9680","2021-7/29","2021-9/27"
"Editing and navigation slow when many code sections are collapsed","https://github.com/rstudio/rstudio/issues/9683","2021-7/30","2022-4/19"
"macOS build doesn't include `-daily-` in filename","https://github.com/rstudio/rstudio/issues/9684","2021-7/30","2021-8/23"
"Object size not shown when containing environment attributes","https://github.com/rstudio/rstudio/issues/9686","2021-7/31","2021-8/12"
"Autocomplete doesn't prompt masked variables with native pipe","https://github.com/rstudio/rstudio/issues/9687","2021-7/31","2021-8/2"
"Proxy code adds Content-Length:0 header, sometimes in violation of spec","https://github.com/rstudio/rstudio/issues/9690","2021-8/2","2021-12/2"
"Unable to launch Rstudio from Anaconda Navigator on cluster","https://github.com/rstudio/rstudio/issues/9691","2021-8/3","2021-8/3"
"Diagnostics alter local R session","https://github.com/rstudio/rstudio/issues/9692","2021-8/3","null"
"Change Visual Markdown Editor Keyboard Shortcuts","https://github.com/rstudio/rstudio/issues/9697","2021-8/4","null"
"Outline Indentation is wrong when putting Comments inside brackets","https://github.com/rstudio/rstudio/issues/9701","2021-8/5","2022-5/18"
"address table editing feedback","https://github.com/rstudio/rstudio/issues/9702","2021-8/6","null"
"Session start metrics","https://github.com/rstudio/rstudio/issues/9703","2021-8/6","2022-5/18"
"Inability to access .local/share/rstudio places user in an inescapable error cycle","https://github.com/rstudio/rstudio/issues/9704","2021-8/6","null"
"revoked_cookie table not getting updated when a user logs out","https://github.com/rstudio/rstudio/issues/9705","2021-8/6","2021-8/12"
"RStudio Server open source can't restart due to a confused internal database update","https://github.com/rstudio/rstudio/issues/9706","2021-8/6","2021-8/25"
"RStudio viewer incorrectly coerces all numeric types to doubles before formatting","https://github.com/rstudio/rstudio/issues/9707","2021-8/6","null"
"Columns wont move along when scrolling horizontally ","https://github.com/rstudio/rstudio/issues/9708","2021-8/6","null"
"Server start and verification don't report failures due to unrecognized options","https://github.com/rstudio/rstudio/issues/9709","2021-8/9","null"
"Treat ""Caption/Alt"" field for images differently depending on file type","https://github.com/rstudio/rstudio/issues/9713","2021-8/9","2021-12/28"
"Turn off (or change) chunk syntax highlighting for non-default languages","https://github.com/rstudio/rstudio/issues/9714","2021-8/10","null"
"Log file permissions for rserver change after session start in open source version","https://github.com/rstudio/rstudio/issues/9715","2021-8/10","2021-8/18"
"Logging may not work after fork, before exec for some code paths","https://github.com/rstudio/rstudio/issues/9719","2021-8/10","null"
"Incorrect filename in Save dialog for untitled files (Electron)","https://github.com/rstudio/rstudio/issues/9720","2021-8/10","2022-3/30"
"CSS diagnostics: Make warnings configurable","https://github.com/rstudio/rstudio/issues/9721","2021-8/11","2022-2/22"
"Can't select and copy server version information in Safari","https://github.com/rstudio/rstudio/issues/9722","2021-8/11","2021-8/23"
"Sometimes the arrows don't appear when clicking on a pane border in RStudio Desktop ","https://github.com/rstudio/rstudio/issues/9723","2021-8/11","2022-3/30"
"RStudio UI colorspace not rendering SRGB values from theme file?","https://github.com/rstudio/rstudio/issues/9727","2021-8/12","null"
"Show additional info in terminal diagnostics","https://github.com/rstudio/rstudio/issues/9729","2021-8/12","2022-3/2"
"HTML <input> with type='checkbox'/'radio' doesn't render correctly in viewer","https://github.com/rstudio/rstudio/issues/9730","2021-8/12","2022-3/2"
"improve vim mode: use Rstudio as frontend for NeoVim","https://github.com/rstudio/rstudio/issues/9731","2021-8/13","null"
"RStudio stuck with R 4.1 for dataframe over 50 columns","https://github.com/rstudio/rstudio/issues/9732","2021-8/13","2021-8/13"
"Drag-and-drop images link to absolute path in Visual Editor","https://github.com/rstudio/rstudio/issues/9734","2021-8/13","2021-11/30"
"ggplot2 ribbon doesn't display on setting axis limits when Graphics backend is Windows","https://github.com/rstudio/rstudio/issues/9736","2021-8/15","null"
"Menu bar clipping; get rid of RStudio classic theme.","https://github.com/rstudio/rstudio/issues/9738","2021-8/16","2021-11/30"
"bump required version of packrat prior to release","https://github.com/rstudio/rstudio/issues/9741","2021-8/16","2021-8/26"
"RStudio dailies ""latest"" aliases are stuck pointing at old builds","https://github.com/rstudio/rstudio/issues/9743","2021-8/17","2021-12/15"
"Rstudio - Error while saving: no such file or directory","https://github.com/rstudio/rstudio/issues/9744","2021-8/17","null"
"version1.4 can not display Chinese reference in Rmarkdown :@Citation for zotero ","https://github.com/rstudio/rstudio/issues/9745","2021-8/17","2021-11/15"
"MS Edge version 92 gets unsupported browser error from Rstudio-Server, even though minimum version is listed as 79","https://github.com/rstudio/rstudio/issues/9748","2021-8/17","null"
"Unable to use packages; prompted with ""Error in install.packages: Updating loaded packages""","https://github.com/rstudio/rstudio/issues/9752","2021-8/18","2021-8/19"
"Zotero entry with Chinese author and title uses generic ""cite"" for citation key","https://github.com/rstudio/rstudio/issues/9754","2021-8/19","2021-11/15"
"Option to show ""hidden"" objects starting with . in Environment pane","https://github.com/rstudio/rstudio/issues/9755","2021-8/19","null"
"cmd + fn + 3 does not open reactlog in shiny apps run in the viewer pane","https://github.com/rstudio/rstudio/issues/9757","2021-8/19","null"
"Rename doesn't work","https://github.com/rstudio/rstudio/issues/9760","2021-8/20","2021-8/26"
"[Feature Request] add ""Close all Views"" option to context menu and shortcuts","https://github.com/rstudio/rstudio/issues/9761","2021-8/21","null"
"rbbt Zotero addin fails in Visual Editor mode","https://github.com/rstudio/rstudio/issues/9762","2021-8/21","2021-9/13"
"Ctl+K failed to add a hyperlink in visual mode","https://github.com/rstudio/rstudio/issues/9763","2021-8/21","2021-11/23"
"Update links to cheatsheets","https://github.com/rstudio/rstudio/issues/9764","2021-8/21","2021-11/29"
"Viewing nested data from view pane does not honor filtering","https://github.com/rstudio/rstudio/issues/9767","2021-8/23","null"
"Configuration that loses X-CSRF-Token causes infinite sign in loop","https://github.com/rstudio/rstudio/issues/9768","2021-8/23","2021-10/15"
"RHEL allows installation of earlier versions of RStudio Server and open source on top of Workbench","https://github.com/rstudio/rstudio/issues/9769","2021-8/24","null"
"RStudio shows wrong variable labels in the data viewer.","https://github.com/rstudio/rstudio/issues/9771","2021-8/24","2022-2/7"
"{lubridate} Duration type (`<dtrn>`) incorrectly shows as `<time>` within R markdown editor code chunks","https://github.com/rstudio/rstudio/issues/9772","2021-8/24","null"
"submit reticulate 1.21 to CRAN","https://github.com/rstudio/rstudio/issues/9773","2021-8/24","2021-9/14"
"Wrong terminal keymap","https://github.com/rstudio/rstudio/issues/9775","2021-8/25","2022-3/8"
"Shiny button ""Reload App"" behaves the same as ""Run App""","https://github.com/rstudio/rstudio/issues/9776","2021-8/25","2022-3/9"
"Redirect always uses HTTP protocol.","https://github.com/rstudio/rstudio/issues/9777","2021-8/26","null"
"Can not create RSA-Key, Access Denied, Special Characters in Usernames","https://github.com/rstudio/rstudio/issues/9778","2021-8/26","null"
"FR: Insert section (heading) in R Presentation files","https://github.com/rstudio/rstudio/issues/9782","2021-8/27","null"
"Arrow icons are missing on the column switcher","https://github.com/rstudio/rstudio/issues/9783","2021-8/27","2021-9/1"
"/var/run/rstudio-server should be created on startup","https://github.com/rstudio/rstudio/issues/9785","2021-8/27","null"
"Autocomplete for column names does not work in pipeline when package name is specified","https://github.com/rstudio/rstudio/issues/9786","2021-8/27","null"
"Redirect link to RStudio daily build broken, breaks homebrew","https://github.com/rstudio/rstudio/issues/9788","2021-8/28","2021-8/31"
"HTML code snippets don't work in R Mardown document body","https://github.com/rstudio/rstudio/issues/9789","2021-8/29","null"
"Context menu does not take focus when opened with the menu key","https://github.com/rstudio/rstudio/issues/9790","2021-8/30","null"
"Support R4.2.0: adapt to Windows memory limit changes","https://github.com/rstudio/rstudio/issues/9792","2021-8/30","2021-12/2"
"RSTUDIO_VERSION is not parseable as a package version","https://github.com/rstudio/rstudio/issues/9795","2021-8/31","2021-10/4"
"RStudio Desktop (Preview) do not open *.bib files","https://github.com/rstudio/rstudio/issues/9797","2021-9/1","2022-3/2"
"View blame on Github opens master branch even when there is not master (instead of local branch or main branch)","https://github.com/rstudio/rstudio/issues/9798","2021-9/1","null"
"Where in RStudio source to add PATH ?","https://github.com/rstudio/rstudio/issues/9799","2021-9/1","2021-9/1"
"Faster loading of new references from Zotero","https://github.com/rstudio/rstudio/issues/9800","2021-9/1","2021-11/15"
"Copy with Ctrl+C not working in console, while right click + ""Copy"" does","https://github.com/rstudio/rstudio/issues/9801","2021-9/1","2022-1/13"
"RStudio Server on Red Hat 8 doesn't work with PostgreSQL","https://github.com/rstudio/rstudio/issues/9802","2021-9/1","2021-9/9"
"Adding Sys.setenv(PATH = ...) to /usr/local/lib/R/etc/Renviron.site doesn't change PATH in RStudio-server","https://github.com/rstudio/rstudio/issues/9804","2021-9/2","2021-9/4"
"cant start rstudio-server-1.4.1717 as non-root","https://github.com/rstudio/rstudio/issues/9805","2021-9/2","2021-9/8"
"Visual markdown mode turns tight lists into spaced out lists","https://github.com/rstudio/rstudio/issues/9806","2021-9/2","2021-9/27"
"Error: pandoc document conversion failed with error 4","https://github.com/rstudio/rstudio/issues/9807","2021-9/2","2022-3/27"
"""Run All Chunks Above"" skips `eval=FALSE` but not `eval=var` when variable is `FALSE`","https://github.com/rstudio/rstudio/issues/9808","2021-9/2","2021-9/3"
"Limit/warn size of `environmentTmp` files.","https://github.com/rstudio/rstudio/issues/9809","2021-9/2","2022-3/21"
"An odd situation where a character vector cannot be passed along with pipe using CTRL+ENTER when the cursor is at one of the following functions","https://github.com/rstudio/rstudio/issues/9810","2021-9/3","null"
".ssh folder location inconsistent under Windows","https://github.com/rstudio/rstudio/issues/9811","2021-9/3","2022-4/26"
"Project-level Appearance settings","https://github.com/rstudio/rstudio/issues/9812","2021-9/3","2022-4/3"
"find + replace whole word shows whole word only but replaces partial matches","https://github.com/rstudio/rstudio/issues/9813","2021-9/4","2022-1/27"
"Default Files directory when folder missing on launch should be project's home dir.","https://github.com/rstudio/rstudio/issues/9814","2021-9/4","null"
"Renviron.site and Rprofile.site don't allow to change the PATH environment variable","https://github.com/rstudio/rstudio/issues/9815","2021-9/4","null"
"Set up a way to render Rmarkdown to google doc like online WYSIWYG editor","https://github.com/rstudio/rstudio/issues/9816","2021-9/5","2022-3/28"
"Use file-choose dialog when exporting plots as images","https://github.com/rstudio/rstudio/issues/9817","2021-9/6","2022-4/3"
"The R session process exited with code 9","https://github.com/rstudio/rstudio/issues/9818","2021-9/6","2022-3/28"
"Ctrl+Clicking on object names do not observe the environment hierarchy","https://github.com/rstudio/rstudio/issues/9819","2021-9/6","2021-9/7"
"Git Tab Unavailable","https://github.com/rstudio/rstudio/issues/9820","2021-9/6","2022-4/10"
"LaTeX commands are broken when switching from visual markdown editor to source editor (backslashes are duplicated)","https://github.com/rstudio/rstudio/issues/9821","2021-9/7","2021-10/14"
"Path autocompletion inconsistent with RMarkdown + Project folder","https://github.com/rstudio/rstudio/issues/9822","2021-9/7","2021-9/7"
"Windows Error on resuming from sleep","https://github.com/rstudio/rstudio/issues/9823","2021-9/7","2022-5/23"
"R 4.2: support UTF-8 code page with UCRT builds of R","https://github.com/rstudio/rstudio/issues/9824","2021-9/7","2021-12/6"
"Add option to change default Project location","https://github.com/rstudio/rstudio/issues/9825","2021-9/8","null"
