"createdAt","closedAt","title","url"
"2018-4/30","2018-5/8","Singleton from a FactoryBean may be post-processed twice if the first post-processing triggers a second attempt to get the bean [SPR-16783]","https://github.com/spring-projects/spring-framework/issues/21323"
"2018-4/30","null","Bean/@Configuration reverse dependency insight feature [SPR-16784]","https://github.com/spring-projects/spring-framework/issues/21324"
"2018-5/1","null","Support wildcard patterns in @PropertySource locations [SPR-16785]","https://github.com/spring-projects/spring-framework/issues/21325"
"2018-5/2","2018-5/9","Enhance JavaConfig Spring MVC configuration to handle easily the 404 scenario [SPR-16786]","https://github.com/spring-projects/spring-framework/issues/21326"
"2018-5/2","2020-8/31","LiveBeansView is not really fit for purpose any more [SPR-16787]","https://github.com/spring-projects/spring-framework/issues/21327"
"2018-5/2","2018-7/26","Webflux: Default Resource as fallback for non-existing resources [SPR-16788]","https://github.com/spring-projects/spring-framework/issues/21328"
"2018-5/3","2018-5/8","Task ""docsZip"" copies duplicate reference files [SPR-16789]","https://github.com/spring-projects/spring-framework/issues/21329"
"2018-5/3","2018-5/3","Spring Guide recommends to use obsolete method [SPR-16790]","https://github.com/spring-projects/spring-framework/issues/21330"
"2018-5/3","2018-5/8","Restore YamlProcessor duplicate key handling against SnakeYAML 1.18+ (plus compatibility with 1.21) [SPR-16791]","https://github.com/spring-projects/spring-framework/issues/21331"
"2018-5/3","2019-7/11","Get the last element from ""LinkedMultiValueMap"" [SPR-16792]","https://github.com/spring-projects/spring-framework/issues/21332"
"2018-5/3","2018-5/15","Add WebFilter + Native Netty Support [SPR-16793]","https://github.com/spring-projects/spring-framework/issues/21333"
"2018-5/4","null","Use superclass of MessageFormat in MessageSourceSupport so more Formats can be used [SPR-16794]","https://github.com/spring-projects/spring-framework/issues/21334"
"2018-5/6","2018-5/15","MockMvc + WebClient (HtmlUnit) + ModelAndView throws 404 (NotFound) [SPR-16795]","https://github.com/spring-projects/spring-framework/issues/21335"
"2018-5/6","2018-5/11","ControllerLinkBuilder#toUriComponentsBuilder encoded twice [SPR-16796]","https://github.com/spring-projects/spring-framework/issues/21336"
"2018-5/7","null","Allow creation of immutable collections through CollectionFactory [SPR-16797]","https://github.com/spring-projects/spring-framework/issues/21337"
"2018-5/8","2018-6/12","Deprecate JSONP support and update MappingJackson2JsonView defaults [SPR-16798]","https://github.com/spring-projects/spring-framework/issues/21338"
"2018-5/8","2018-6/12","docs.zip does not contain resources at the root anymore [SPR-16799]","https://github.com/spring-projects/spring-framework/issues/21339"
"2018-5/9","null","LocalSessionFactoryBean and Hibernate 5.2: NullPointerException in afterPropertiesSet [SPR-16800]","https://github.com/spring-projects/spring-framework/issues/21340"
"2018-5/9","2018-6/12","Add description for StompBrokerRelayMessageHandler [SPR-16801]","https://github.com/spring-projects/spring-framework/issues/21341"
"2018-5/9","2018-6/12","Documentation refers to org.projectreactor:reactor-net which seem not to exist on projectreactor Bismuth [SPR-16802]","https://github.com/spring-projects/spring-framework/issues/21342"
"2018-5/9","2018-7/22","AspectJ annotation pointcuts fail to evaluate against interface-based proxies [SPR-16803]","https://github.com/spring-projects/spring-framework/issues/21343"
"2018-5/9","2018-7/26","WebClient support application/x-www-form-urlencoded by default [SPR-16804]","https://github.com/spring-projects/spring-framework/issues/21344"
"2018-5/9","2018-10/8","Improve UnsupportedMediaTypeException and UnsupportedMediaTypeStatusException to include body type [SPR-16805]","https://github.com/spring-projects/spring-framework/issues/21345"
"2018-5/9","2018-7/25","WebClient support same body types for x-www-form-urlencoded and json [SPR-16806]","https://github.com/spring-projects/spring-framework/issues/21346"
"2018-5/10","2018-7/24","WebMvcConfigurer.configureMessageConverters behavior doesn't match documentation [SPR-16807]","https://github.com/spring-projects/spring-framework/issues/21347"
"2018-5/10","2018-7/26","Support use of MultipartFile as input to RestTemplate or WebClient [SPR-16808]","https://github.com/spring-projects/spring-framework/issues/21348"
"2018-5/10","null","Use ""internalSet"" instead of normal setter. [SPR-16809]","https://github.com/spring-projects/spring-framework/issues/21349"
"2018-5/10","2018-5/11","Model attributes added within postHandle of a HandlerInterceptor are not ignored on String redirect if ignoreDefaultModelOnRedirect of RequestMappingHandlerAdapter is set to true [SPR-16810]","https://github.com/spring-projects/spring-framework/issues/21350"
"2018-5/10","2018-6/12","Incorrect Java Syntax in Spring Framework Documentation [SPR-16811]","https://github.com/spring-projects/spring-framework/issues/21351"
"2018-5/11","2018-7/26","Extract ScheduledAnnotationBeanPostProcessor.createRunnable() [SPR-16812]","https://github.com/spring-projects/spring-framework/issues/21352"
"2018-5/11","2018-6/12","UriComponentsBuilder injected into a WebFlux controller method argument uses the full URI [SPR-16813]","https://github.com/spring-projects/spring-framework/issues/21353"
"2018-5/11","2018-5/11","Spring-jdbc 5.0.5 NamedParameterJdbcTemplate.batchUpdate ORA-01000  [SPR-16814]","https://github.com/spring-projects/spring-framework/issues/21354"
"2018-5/11","2018-5/12","No default dashboard for Eureka Server in Finchley.RC1  [SPR-16815]","https://github.com/spring-projects/spring-framework/issues/21355"
"2018-5/12","2018-6/12","Process cannot exit when the SchedulerFactoryBean fails to initialize [SPR-16816]","https://github.com/spring-projects/spring-framework/issues/21356"
"2018-5/13","2018-5/14","Hamcrest dependency missing when using Junit 5 [SPR-16817]","https://github.com/spring-projects/spring-framework/issues/21357"
"2018-5/13","2018-5/14","Optional<T> it is not working with generic context object  [SPR-16818]","https://github.com/spring-projects/spring-framework/issues/21358"
"2018-5/13","2018-7/26","Improve handling of unknown status codes by WebClient [SPR-16819]","https://github.com/spring-projects/spring-framework/issues/21359"
"2018-5/14","2018-5/17","Provide example of a WebSocketHandler implementation for WebFlux  [SPR-16820]","https://github.com/spring-projects/spring-framework/issues/21360"
"2018-5/14","2018-5/14","Spring 5.0.5.RELEASE version doesnt support SpringBeanAutowiringInterceptor. [SPR-16821]","https://github.com/spring-projects/spring-framework/issues/21361"
"2018-5/14","null","Provide a mechanism to be notified that a bean has been created [SPR-16822]","https://github.com/spring-projects/spring-framework/issues/21362"
"2018-5/14","2018-6/12","Filter synthetic in addition to bridge in ReflectionUtils#USER_DECLARED_METHODS [SPR-16823]","https://github.com/spring-projects/spring-framework/issues/21363"
"2018-5/14","2018-5/16","Support request attributes for HttpRequest/ClientHttpRequest [SPR-16824]","https://github.com/spring-projects/spring-framework/issues/21364"
"2018-5/15","2018-5/16","RequestParamMethodArgumentResolver don't correctly parse arguments [SPR-16825]","https://github.com/spring-projects/spring-framework/issues/21365"
"2018-5/15","2018-8/1","Connection acquired while calling a stored procedure via JPA is not released [SPR-16826]","https://github.com/spring-projects/spring-framework/issues/21366"
"2018-5/16","2019-11/19","Capitalize strings with the correctly implementation [SPR-16827]","https://github.com/spring-projects/spring-framework/issues/21367"
"2018-5/16","2018-7/26","Apply Hibernate Integrator through LocalSessionFactoryBean [SPR-16828]","https://github.com/spring-projects/spring-framework/issues/21368"
"2018-5/16","2018-6/12","Improve toString in path extension and query parameter predicates [SPR-16829]","https://github.com/spring-projects/spring-framework/issues/21369"
"2018-5/16","2018-6/12","ServerHttpRequest.Builder should allow setting SslInfo [SPR-16830]","https://github.com/spring-projects/spring-framework/issues/21370"
"2018-5/17","2018-8/7","ConcurrentModel.addAttribute(name, value) javadoc should not declare null value as acceptable [SPR-16831]","https://github.com/spring-projects/spring-framework/issues/21371"
"2018-5/17","2018-7/26","ClassPathResource.isReadable() returns true for directory in runnable jar result in download empty file [SPR-16832]","https://github.com/spring-projects/spring-framework/issues/21372"
"2018-5/17","2018-10/2","java.nio.file.Path support in FileSystemResource (with regular createRelative behavior, superseding PathResource) [SPR-16833]","https://github.com/spring-projects/spring-framework/issues/21373"
"2018-5/17","2018-7/26","Extending ScheduledTaskRegistrar functionality [SPR-16834]","https://github.com/spring-projects/spring-framework/issues/21374"
"2018-5/17","null","Unable to inject string /map in xml bean [SPR-16835]","https://github.com/spring-projects/spring-framework/issues/21375"
"2018-5/17","2018-7/5","Restrict allowed HTTP methods in HiddenHttpMethodFilter [SPR-16836]","https://github.com/spring-projects/spring-framework/issues/21376"
"2018-5/17","null","When we remove bean from the application context, its aliases must be cleared as well [SPR-16837]","https://github.com/spring-projects/spring-framework/issues/21377"
"2018-5/18","2018-7/26","PathMatchingResourcePatternResolver should enforce OS-independent sorting of directory content [SPR-16838]","https://github.com/spring-projects/spring-framework/issues/21378"
"2018-5/18","2018-10/19","A lite configuration class's member classes are processed when it's imported but not when it's registered directly [SPR-16839]","https://github.com/spring-projects/spring-framework/issues/21379"
"2018-5/18","2018-8/8","@DateTimeFormat annotations are necessary both on field and constructor parameter in the immutable form class [SPR-16840]","https://github.com/spring-projects/spring-framework/issues/21380"
"2018-5/18","2018-9/2","Validation failure not exposed next to binding failure for immutable form class [SPR-16841]","https://github.com/spring-projects/spring-framework/issues/21381"
"2018-5/18","2018-6/12","""Want"" two-way-ssl not containing SSL-Certificate is not checkable due to contract violation [SPR-16842]","https://github.com/spring-projects/spring-framework/issues/21382"
"2018-5/18","2018-7/26","Problem with passing null parameter to MapSqlParameterSource  [SPR-16843]","https://github.com/spring-projects/spring-framework/issues/21383"
"2018-5/18","2018-6/12","Spring overrides user requested STOMP version  [SPR-16844]","https://github.com/spring-projects/spring-framework/issues/21384"
"2018-5/18","2018-11/19","Java 9: Avoid illegal reflective access warning for SpEL method reference [SPR-16845]","https://github.com/spring-projects/spring-framework/issues/21385"
"2018-5/19","2018-10/10","webflux truncates payload [SPR-16846]","https://github.com/spring-projects/spring-framework/issues/21386"
"2018-5/19","2022-2/18","Publish updated XSD with versioned alternatives [SPR-16847]","https://github.com/spring-projects/spring-framework/issues/21387"
"2018-5/21","2018-7/24","HierarchicalUriComponents#toUri should encode if necessary [SPR-16848]","https://github.com/spring-projects/spring-framework/issues/21388"
"2018-5/21","2018-6/12","Confusing javadoc in YamlProcessor.setDocumentMatchers [SPR-16849]","https://github.com/spring-projects/spring-framework/issues/21389"
"2018-5/21","null","JmsTemplate with TransactionSession does not call rollback, while sending message error.  [SPR-16850]","https://github.com/spring-projects/spring-framework/issues/21390"
"2018-5/21","2018-12/24","Update MockHttpServletRequest default method to GET [SPR-16851]","https://github.com/spring-projects/spring-framework/issues/21391"
"2018-5/21","2018-6/12","Spring MVC: @EnableScheduling needs to be redeclared for each application context [SPR-16852]","https://github.com/spring-projects/spring-framework/issues/21392"
"2018-5/21","2018-5/24","Spring websocket: consider add a Send Event through the AbstractSubProtocolEvent hierarchy [SPR-16853]","https://github.com/spring-projects/spring-framework/issues/21393"
"2018-5/22","2018-8/8","No type-based error code used by immutable form class when type conversion error occurs [SPR-16854]","https://github.com/spring-projects/spring-framework/issues/21394"
"2018-5/22","2018-7/26","Make FormHttpMessageWriter easier to extend [SPR-16855]","https://github.com/spring-projects/spring-framework/issues/21395"
"2018-5/22","2018-6/5","Protected methods in HttpMessageConverterExtractor and DecoderHttpMessageReader to extract MediaType [SPR-16856]","https://github.com/spring-projects/spring-framework/issues/21396"
"2018-5/22","2018-8/17","Make it possible to disable Scheduled job via cron expression [SPR-16858]","https://github.com/spring-projects/spring-framework/issues/21397"
"2018-5/22","2018-5/23","Security vulnerability fixes for CVE-2018-1270, CVE-2018-1273, CVE-2018-1271, CVE-2018-1274 [SPR-16859]","https://github.com/spring-projects/spring-framework/issues/21398"
"2018-5/22","2018-11/9","Spring is inconsistent in the encoding/decoding of URLs [SPR-16860]","https://github.com/spring-projects/spring-framework/issues/21399"
"2018-5/22","2018-6/12","Spring WebSocket: Indicate Stomp disconnect event would be executed twice [SPR-16861]","https://github.com/spring-projects/spring-framework/issues/21400"
"2018-5/22","2018-6/12","Flawed implementations of ResourceResolverChain and ResourceTransformerChain [SPR-16862]","https://github.com/spring-projects/spring-framework/issues/21401"
"2018-5/22","2018-7/26","Process X-Forwarded-Ssl headers properly [SPR-16863]","https://github.com/spring-projects/spring-framework/issues/21402"
"2018-5/22","2018-6/12","ResourceHandlerRegistry example in ref docs needs to use setCacheControl [SPR-16864]","https://github.com/spring-projects/spring-framework/issues/21403"
"2018-5/23","2018-5/24","MvcResult-->mockResponse-->headers will lose a apart of  headers [SPR-16865]","https://github.com/spring-projects/spring-framework/issues/21404"
"2018-5/23","2018-6/12","Restore lenient null return value for ConditionContext.getBeanFactory() [SPR-16866]","https://github.com/spring-projects/spring-framework/issues/21405"
"2018-5/23","2018-6/12","MatrixVariable with Encoding does not work. [SPR-16867]","https://github.com/spring-projects/spring-framework/issues/21406"
"2018-5/23","2018-6/12","PathVariable with nested router function throws IllegalArgumentException [SPR-16868]","https://github.com/spring-projects/spring-framework/issues/21407"
"2018-5/23","2018-6/12","MockMvc - IllegalStateException: Async result for handler was not set during specified timeToWait=-1 [SPR-16869]","https://github.com/spring-projects/spring-framework/issues/21408"
"2018-5/24","2018-5/24","Facing java.lang.UnsupportedOperationException on websphere 8.5.5.11 [SPR-16870]","https://github.com/spring-projects/spring-framework/issues/21409"
"2018-5/25","2018-6/12","SimpleAliasRegistry misses log out in case of bean override [SPR-16871]","https://github.com/spring-projects/spring-framework/issues/21410"
"2018-5/25","null","Allow registration of application event listeners in a functional way [SPR-16872]","https://github.com/spring-projects/spring-framework/issues/21411"
"2018-5/25","2018-7/26","WebClient.Builder option to customize every request [SPR-16873]","https://github.com/spring-projects/spring-framework/issues/21412"
"2018-5/25","2018-7/26","Support for form parameters with HTTP DELETE [SPR-16874]","https://github.com/spring-projects/spring-framework/issues/21413"
"2018-5/26","2019-5/1","When adding @ExceptionHandler for java.lang.Exception, handlers for nested exceptions stop working [SPR-16875]","https://github.com/spring-projects/spring-framework/issues/21414"
"2018-5/27","null","Move synchronization point creation just before transaction begins to enable routing datasources to act on transaction definition [SPR-16876]","https://github.com/spring-projects/spring-framework/issues/21415"
"2018-5/27","2018-7/26","Subclass-resolved generic return type declarations for handler methods [SPR-16877]","https://github.com/spring-projects/spring-framework/issues/21416"
"2018-5/28","2018-5/28","RequestMapping works on private methods [SPR-16878]","https://github.com/spring-projects/spring-framework/issues/21417"
"2018-5/29","2018-5/29","Nested PathPatternPredicate doesn't expose path variables [SPR-16879]","https://github.com/spring-projects/spring-framework/issues/21418"
"2018-5/29","2018-5/30","Stored procedures are resolved against the public PostgreSQL schema [SPR-16880]","https://github.com/spring-projects/spring-framework/issues/21419"
"2018-5/29","2018-6/12","AbstractRequestLoggingFilter.isIncludeHeaders() is accidentally public [SPR-16881]","https://github.com/spring-projects/spring-framework/issues/21420"
"2018-5/31","2018-6/14","ReflectivePropertyAccessor should cache sorted methods [SPR-16882]","https://github.com/spring-projects/spring-framework/issues/21421"
"2018-5/31","2018-7/26","Revisit PropertyResolver Kotlin extensions [SPR-16883]","https://github.com/spring-projects/spring-framework/issues/21422"
