"['title']","['url']","['createdAt']","['closedAt']"
"AbstractApplicationContext.isActive() out of sync with multicaster [SPR-5348]","https://github.com/spring-projects/spring-framework/issues/10021","2008-12/9","2009-2/12"
"Fetching _eventId throws uncaught ClassCastException if it is not a String [SPR-5349]","https://github.com/spring-projects/spring-framework/issues/10022","2008-11/22","2012-6/19"
"Very misleading error message when wrong type of Object assigned to a generic list [SPR-5350]","https://github.com/spring-projects/spring-framework/issues/10023","2008-12/10","2012-6/19"
"add the possibility to specify the custom transactionInterceptor when using <tx:annotation-driven> [SPR-5351]","https://github.com/spring-projects/spring-framework/issues/10024","2008-12/10","2012-6/19"
"Can't use aspects around Axis2 service beans [SPR-5352]","https://github.com/spring-projects/spring-framework/issues/10025","2008-12/10","2012-6/14"
"Can't use aspects around Axis2 service beans [SPR-5353]","https://github.com/spring-projects/spring-framework/issues/10026","2008-12/10","2012-6/14"
"Binding doesn't work when no radio button in a set is selected [SPR-5354]","https://github.com/spring-projects/spring-framework/issues/10027","2008-12/11","2019-1/12"
"@Qualifier no longer works in 3.0 [SPR-5355]","https://github.com/spring-projects/spring-framework/issues/10028","2008-12/11","2012-6/19"
"break circular dependency of optional import package org.springframework.orm.support in context [SPR-5356]","https://github.com/spring-projects/spring-framework/issues/10029","2008-12/11","2012-6/14"
"Add postProcessAfterDestruction to DestructionAwareBeanPostProcessor [SPR-5357]","https://github.com/spring-projects/spring-framework/issues/10030","2008-12/11","2012-6/19"
"Add adapter classes for all bean post processor interfaces [SPR-5358]","https://github.com/spring-projects/spring-framework/issues/10031","2008-12/11","2012-6/19"
"Collection (List) backed form fields bound via <form:checkbox> or  <form:radiobutton> generate invalid HTML id attribute [SPR-5359]","https://github.com/spring-projects/spring-framework/issues/10032","2008-12/12","2012-5/18"
"Threads bottlenecking in DefaultSingletonBeanRegistry when using Wicket's @SpringBean annotation for injection [SPR-5360]","https://github.com/spring-projects/spring-framework/issues/10033","2008-12/12","2015-9/22"
"Modify beans on the fly without shutting down the container [SPR-5361]","https://github.com/spring-projects/spring-framework/issues/10034","2008-12/15","2012-6/19"
"@RequestMapping best match gives wrong Controller method when using wildcards [SPR-5362]","https://github.com/spring-projects/spring-framework/issues/10035","2008-12/15","2012-6/19"
"Implement if() pointcut keyword [SPR-5364]","https://github.com/spring-projects/spring-framework/issues/10037","2008-12/15","2019-1/12"
"@PathVariable is unable to match trailing end of a URL [SPR-5365]","https://github.com/spring-projects/spring-framework/issues/10038","2008-12/16","2012-6/19"
"@RequestMapping is not resolved with springsource dm-server-ee-1.0.1 [SPR-5366]","https://github.com/spring-projects/spring-framework/issues/10039","2008-12/16","2012-6/19"
"PathVariable mappings are greedy over hard coded mappings [SPR-5367]","https://github.com/spring-projects/spring-framework/issues/10040","2008-12/16","2012-6/19"
"@Controllers deployed in the root Spring context not auto-detected by default annotation handler mapping [SPR-5368]","https://github.com/spring-projects/spring-framework/issues/10041","2008-12/17","2015-9/22"
"Property Placeholder Configurer Incorrectly Reports ""Circular placeholder reference"" Error For Repeated Nested Placeholders [SPR-5369]","https://github.com/spring-projects/spring-framework/issues/10042","2008-12/17","2012-10/31"
"TilesConfigurer setDefinitions does not trim input (e.g. <value>/WEB-INF/tiles-layout.xml     </value>) while formatting xml in eclipse adds whitespace. [SPR-5370]","https://github.com/spring-projects/spring-framework/issues/10043","2008-12/17","2012-6/19"
"Preserve previously set field values when processing @Resource and @Autowired annotations [SPR-5371]","https://github.com/spring-projects/spring-framework/issues/10044","2008-12/18","2012-6/19"
"AbstractJpaTest and AbstractAnnotationAwareTransactionalTests are not deprecated [SPR-5372]","https://github.com/spring-projects/spring-framework/issues/10045","2008-12/19","2018-12/28"
"@PathVariable doesn't always work without the value specified in the use of the annotation [SPR-5373]","https://github.com/spring-projects/spring-framework/issues/10046","2008-12/22","2009-2/12"
"SPEL PropertyOrFieldReference not threadsafe [SPR-5374]","https://github.com/spring-projects/spring-framework/issues/10047","2008-12/22","2012-6/19"
"AbstractXsltView still documented [SPR-5375]","https://github.com/spring-projects/spring-framework/issues/10048","2008-12/23","2015-9/22"
"DefaultLobHandler should honour ""wrapAsLob"" for getting data too [SPR-5376]","https://github.com/spring-projects/spring-framework/issues/10049","2008-12/25","2012-6/19"
"@SessionParam or @SessionAttribute Annotation for passing a Session Attribute to a Controller [SPR-5377]","https://github.com/spring-projects/spring-framework/issues/10050","2008-12/26","2016-1/26"
"AOP fails with interface implemented in Groovy with defaulted method parameter [SPR-5378]","https://github.com/spring-projects/spring-framework/issues/10051","2008-12/27","2018-12/27"
"Doc: @Autowired with @Qualifier never matches a bean with autowire-candidate=""false"" [SPR-5379]","https://github.com/spring-projects/spring-framework/issues/10052","2008-12/29","2012-6/19"
"MarshallingView should override AbstractView instead of AbstractUrlBasedView [SPR-5380]","https://github.com/spring-projects/spring-framework/issues/10053","2009-1/1","2012-6/19"
"Spring-form tags don't filter out double-quotes from id attributes. [SPR-5381]","https://github.com/spring-projects/spring-framework/issues/10054","2009-1/1","2012-5/18"
"org.springframework.web.servlet.tags.form.TagIdGenerator doesn't remove characters [] and double-quotes [SPR-5382]","https://github.com/spring-projects/spring-framework/issues/10055","2009-1/1","2012-6/19"
"Label tag doesn't escape [] and double-quotes for map-based and indexed properties [SPR-5383]","https://github.com/spring-projects/spring-framework/issues/10056","2009-1/1","2012-3/5"
"checkboxes and radiobuttons tags generate <li> elements which doesn't let you click on the text to select corresponding checkbox or radiobutton [SPR-5384]","https://github.com/spring-projects/spring-framework/issues/10057","2009-1/1","2012-6/19"
"All maven2 artifactIds change (will break a lot of builds for maven users) [SPR-5385]","https://github.com/spring-projects/spring-framework/issues/10058","2009-1/1","2012-6/19"
"SelectTag (multiple=true) and CheckboxesTag generate invalid html for map-based properties (if path contains double-quotes) [SPR-5386]","https://github.com/spring-projects/spring-framework/issues/10059","2009-1/3","2012-3/1"
"ThreadPoolExecutor waitForTasksToCompleteOnShutdown doesn't work as expected [SPR-5387]","https://github.com/spring-projects/spring-framework/issues/10060","2009-1/4","2013-1/23"
"Component scanning not working with multiple source directories in Eclipse [SPR-5388]","https://github.com/spring-projects/spring-framework/issues/10061","2009-1/4","2011-6/3"
"TypeUtils.isAssignable does not support GenericArrayType [SPR-5389]","https://github.com/spring-projects/spring-framework/issues/10062","2009-1/4","2018-12/28"
"TypeUtils.isAssignable should return true for ParametrizedType assignable to Object [SPR-5390]","https://github.com/spring-projects/spring-framework/issues/10063","2009-1/4","2012-6/19"
"Add ControllerMethodRequestToViewNameTranslator [SPR-5391]","https://github.com/spring-projects/spring-framework/issues/10064","2009-1/5","2015-9/22"
"Have AnnotationMethodHandlerAdapter save @Controller invocation context so it can be used during view resolution and rendering [SPR-5392]","https://github.com/spring-projects/spring-framework/issues/10065","2009-1/5","2015-9/22"
"Add ControllerRelativeViewResolver [SPR-5393]","https://github.com/spring-projects/spring-framework/issues/10066","2009-1/5","2015-9/22"
"Add support for @Controller-relative resource bundles (for messages, themes, etc) [SPR-5394]","https://github.com/spring-projects/spring-framework/issues/10067","2009-1/5","2015-9/22"
"ApplicationContext not closed when using @ContextConfiguration to implement integration tests [SPR-5395]","https://github.com/spring-projects/spring-framework/issues/10068","2009-1/5","2012-6/19"
"Provide clean way to handle binding simple @RequestParam [SPR-5396]","https://github.com/spring-projects/spring-framework/issues/10069","2009-1/5","2015-9/22"
"Add support for outputting a value formatted by a Converter from a JSP [SPR-5397]","https://github.com/spring-projects/spring-framework/issues/10070","2008-8/20","2012-6/19"
"Ordering of ServletContextAware and ApplicationContextAware callbacks makes testing FreeMarkerView (and similar classes) impossible [SPR-5398]","https://github.com/spring-projects/spring-framework/issues/10071","2009-1/6","2012-6/19"
"Provide test ContextLoader for @ContextConfiguration that creates a WebApplicationContext [SPR-5399]","https://github.com/spring-projects/spring-framework/issues/10072","2009-1/6","2009-7/8"
"form:errors tag generates invalid id attribute when used with ""indexed"" command object properties (array, list...) [SPR-5400]","https://github.com/spring-projects/spring-framework/issues/10073","2009-1/6","2019-1/12"
"AnnotationBeanConfigurerAspect is created as a singleton and cannot be shared across multiple contexts [SPR-5401]","https://github.com/spring-projects/spring-framework/issues/10074","2009-1/7","2011-10/8"
"NullPointerException in JmsException [SPR-5402]","https://github.com/spring-projects/spring-framework/issues/10075","2009-1/7","2012-6/19"
"MissingServletRequestParameterExceptions thrown from AnnotationMethodHandlerAdapter should include class and method [SPR-5403]","https://github.com/spring-projects/spring-framework/issues/10076","2009-1/8","2012-6/19"
"AbstractTestNGSpringContextTests: Spring beans not available within @BeforeTest methods [SPR-5404]","https://github.com/spring-projects/spring-framework/issues/10077","2009-1/11","2011-10/10"
"ReloadableResourceBundleMessageSource requires cacheSeconds to be refreshable -- is this a performance issue?  [SPR-5405]","https://github.com/spring-projects/spring-framework/issues/10078","2009-1/12","2011-3/31"
"Make Tiles 2 easier to configure in Spring MVC [SPR-5406]","https://github.com/spring-projects/spring-framework/issues/10079","2009-1/13","2012-6/19"
"Hot deploy changes to hibernate configuration files packaged in a jar are not picked up by Jetty [SPR-5407]","https://github.com/spring-projects/spring-framework/issues/10080","2009-1/13","2012-6/19"
"Usage of  special characters as part of form element name. [SPR-5408]","https://github.com/spring-projects/spring-framework/issues/10081","2009-1/13","2012-3/12"
"Support for PUTting and POSTing non-form data [SPR-5409]","https://github.com/spring-projects/spring-framework/issues/10082","2009-1/13","2012-6/19"
"RequestParam can't properly parse an optional boolean parameter [SPR-5410]","https://github.com/spring-projects/spring-framework/issues/10083","2009-1/14","2012-6/19"
"TilesConfigurer class no longer works with Tiles 2.1.1 [SPR-5411]","https://github.com/spring-projects/spring-framework/issues/10084","2009-1/14","2012-6/19"
"SpringBeanAutowiringInterceptor.autowireBean() has wrong signature [SPR-5412]","https://github.com/spring-projects/spring-framework/issues/10085","2009-1/14","2012-6/19"
"XStreamMarshaller.setImplicitCollection(Map) is insufficient [SPR-5449]","https://github.com/spring-projects/spring-framework/issues/10086","2009-1/29","2012-6/19"
"CglibMethodInvocation fields are not accessible by subclasses [SPR-5413]","https://github.com/spring-projects/spring-framework/issues/10087","2009-1/14","2012-6/18"
"BridgeMethodResolver is unable to locate bridged method for hibernate Cglib-wrapped class implementing a generic interface [SPR-5414]","https://github.com/spring-projects/spring-framework/issues/10088","2009-1/15","2012-6/19"
"springmodules project is dead [SPR-5415]","https://github.com/spring-projects/spring-framework/issues/10089","2009-1/17","2011-1/18"
"With binder.setRequiredFields constraint set, submitting an empty value for a required request parameter not binding an empty string to backing JavaBean [SPR-5416]","https://github.com/spring-projects/spring-framework/issues/10090","2009-1/19","2011-10/10"
"Integrating validation into the @MVC request lifecycle [SPR-5417]","https://github.com/spring-projects/spring-framework/issues/10091","2009-1/19","2012-6/19"
"Additional support for mapping validation errors to localized messages [SPR-5418]","https://github.com/spring-projects/spring-framework/issues/10092","2009-1/19","2015-9/22"
"Infinite loop in bean creation when placeholder used for bean name [SPR-5419]","https://github.com/spring-projects/spring-framework/issues/10093","2009-1/19","2012-6/19"
"FactoryBean should be able to declare beans it/the created bean depends on [SPR-5420]","https://github.com/spring-projects/spring-framework/issues/10094","2009-1/20","2012-6/19"
"@RequestMapping type-level params not taken into account consistently [SPR-5421]","https://github.com/spring-projects/spring-framework/issues/10095","2009-1/20","2012-6/19"
"spring-jee-2.5.xsd on springframework.org does not specify new expose-access-context attribute for jee:remote-slsb [SPR-5422]","https://github.com/spring-projects/spring-framework/issues/10096","2009-1/20","2009-3/23"
"Spring TX unsupport lazy transaction enlistment of JBoss JCA [SPR-5423]","https://github.com/spring-projects/spring-framework/issues/10097","2009-1/20","2009-2/12"
"How to provide mulit language support for a web application using springs [SPR-5424]","https://github.com/spring-projects/spring-framework/issues/10098","2009-1/21","2012-6/19"
"provide class type properties for application context [SPR-5425]","https://github.com/spring-projects/spring-framework/issues/10099","2009-1/21","2012-6/19"
"Allow for custom processing or result objects returned from handler/controller methods [SPR-5426]","https://github.com/spring-projects/spring-framework/issues/10100","2009-1/21","2012-6/19"
"Can't use read-only of transaction in DataSourceTransactionManager [SPR-5427]","https://github.com/spring-projects/spring-framework/issues/10101","2009-1/21","2015-9/22"
"TestContext to become subclassable [SPR-5428]","https://github.com/spring-projects/spring-framework/issues/10102","2009-1/22","2013-10/26"
"Update Pet Clinic to use HSQL as an embedded database [SPR-5429]","https://github.com/spring-projects/spring-framework/issues/10103","2009-1/23","2012-6/19"
"Spring MVC views.properties uses xl.(class) syntax [SPR-5430]","https://github.com/spring-projects/spring-framework/issues/10104","2009-1/23","2012-6/19"
"Allow BeanDefinitionDecorator to not create an beans if it chooses [SPR-5431]","https://github.com/spring-projects/spring-framework/issues/10105","2009-1/26","2012-6/19"
"HibernateTemplate - changed Hibernate Session load() and get() semantic [SPR-5432]","https://github.com/spring-projects/spring-framework/issues/10106","2009-1/26","2009-2/12"
"@RequestMapping to narrow on Request Header details [SPR-5433]","https://github.com/spring-projects/spring-framework/issues/10107","2009-1/26","2012-6/19"
"ReflectionUtils.findMethod does not find methods for Object.class [SPR-5434]","https://github.com/spring-projects/spring-framework/issues/10108","2009-1/27","2012-6/19"
"SimpleJdbcCall doesn't retrieve out value from function call for MS SQLServer [SPR-5435]","https://github.com/spring-projects/spring-framework/issues/10109","2009-1/27","2012-6/19"
"Please provide a hook in DispatcherServlet to build custom ServletRequestAttributes [SPR-5436]","https://github.com/spring-projects/spring-framework/issues/10110","2009-1/27","2018-12/26"
"JoinPoint and Singature toString, toShortString, and toLongString don't return useful information [SPR-5437]","https://github.com/spring-projects/spring-framework/issues/10111","2009-1/27","2012-6/19"
"org.springframework.expression: Bug in TemplateAwareExpressionParser when expressionString contains '}' [SPR-5438]","https://github.com/spring-projects/spring-framework/issues/10112","2009-1/27","2012-6/19"
"""!target(...)"" pointcut expression never matches any method [SPR-5439]","https://github.com/spring-projects/spring-framework/issues/10113","2009-1/27","2019-1/12"
"grammatical error in LobHandler javadoc [SPR-5440]","https://github.com/spring-projects/spring-framework/issues/10114","2009-1/27","2012-6/19"
"Spring expression: NPE in org.springframework.expression.spel.ast.Ternary [SPR-5441]","https://github.com/spring-projects/spring-framework/issues/10115","2009-1/28","2012-6/19"
"Using InternalResourceView for content types other than text/html [SPR-5442]","https://github.com/spring-projects/spring-framework/issues/10116","2009-1/29","2015-9/22"
"Add a getter for simpleJdbcTemplate in AbstractTransactionalJUnit4SpringContextTests & AbstractTransactionalTestNGSpringContextTests [SPR-5443]","https://github.com/spring-projects/spring-framework/issues/10117","2009-1/29","2012-6/19"
"Add SQL error code mapping for Ingres DBMS [SPR-5444]","https://github.com/spring-projects/spring-framework/issues/10118","2009-1/29","2012-6/19"
"Extend @RequestMapping to explicitly indicate no view to resolve [SPR-5445]","https://github.com/spring-projects/spring-framework/issues/10119","2009-1/29","2012-6/13"
"Change exception message in exception thrown when placeholder is unresolvable from PropertyPlaceholderConfigurer to include beanName [SPR-5446]","https://github.com/spring-projects/spring-framework/issues/10120","2009-1/30","2012-6/19"
"Allow ParameterizableViewController to take a View instead of viewName [SPR-5447]","https://github.com/spring-projects/spring-framework/issues/10121","2009-1/30","2012-6/19"
