"createdAt","closedAt","title","url"
"2005-2/7","2005-2/27","StringTrimmerEditor to support trimming of CR/LF [SPR-693]","https://github.com/spring-projects/spring-framework/issues/5421"
"2005-2/7","2005-2/15","OpenSessionInViewFilter with JTA Transactions [SPR-694]","https://github.com/spring-projects/spring-framework/issues/5422"
"2005-2/7","2005-6/13","Add FactoryBean that generates a factory that can provide initialization values [SPR-695]","https://github.com/spring-projects/spring-framework/issues/5423"
"2005-2/7","2006-11/14","Remote EJB access lacks narrowing [SPR-696]","https://github.com/spring-projects/spring-framework/issues/5424"
"2005-2/7","2005-2/27","Support description metadata for operations in MetadataModelMBeanInfoAssembler [SPR-697]","https://github.com/spring-projects/spring-framework/issues/5425"
"2005-2/8","2005-2/13","HEAD request support [SPR-698]","https://github.com/spring-projects/spring-framework/issues/5426"
"2005-2/8","2005-3/25","Hibernate Query by example support [SPR-699]","https://github.com/spring-projects/spring-framework/issues/5427"
"2005-2/9","2006-3/13","JSR 94 support [SPR-700]","https://github.com/spring-projects/spring-framework/issues/5428"
"2005-2/10","2012-6/19","XMLC View [SPR-701]","https://github.com/spring-projects/spring-framework/issues/5429"
"2005-2/10","2005-2/13","org.springframework.util.StringUtils#tokenizeToStringArray not honoring ignoreEmptyTokens parameter [SPR-702]","https://github.com/spring-projects/spring-framework/issues/5430"
"2005-2/10","2012-6/19","Make Controller aware of the url mapping [SPR-703]","https://github.com/spring-projects/spring-framework/issues/5431"
"2005-2/10","2005-2/15","LocaleChangeInterceptor executing a redudant instruction if there is no parameter [SPR-704]","https://github.com/spring-projects/spring-framework/issues/5432"
"2005-2/11","2005-2/12","TransactionAwareDSP with iBatis duplicates ConnectionSynchronization in TransactionManager [SPR-705]","https://github.com/spring-projects/spring-framework/issues/5433"
"2005-2/11","2012-6/19","Inner bean definition exception messages could be improved [SPR-706]","https://github.com/spring-projects/spring-framework/issues/5434"
"2005-2/13","2011-4/15","Log4jConfigurer to support classpath: location [SPR-707]","https://github.com/spring-projects/spring-framework/issues/5435"
"2005-2/13","2005-2/13","ClassCastException with MethodMapTransactionAttributeSource [SPR-708]","https://github.com/spring-projects/spring-framework/issues/5436"
"2005-2/13","2005-2/24","Add JDBC batch support for Statement's [SPR-709]","https://github.com/spring-projects/spring-framework/issues/5437"
"2005-2/13","2005-2/15","Double closing connection with Hibernate [SPR-710]","https://github.com/spring-projects/spring-framework/issues/5438"
"2005-2/13","2005-2/13","DefaultPropertiesPersister exception on zero length line [SPR-711]","https://github.com/spring-projects/spring-framework/issues/5439"
"2005-2/13","2005-2/14","MockHttpServletRequest.getSession(true) does not always create a session [SPR-712]","https://github.com/spring-projects/spring-framework/issues/5440"
"2005-2/14","2005-2/14","ClassUtils.forName should trim whitespace [SPR-713]","https://github.com/spring-projects/spring-framework/issues/5441"
"2005-2/15","2005-2/16","Bean names retrieval (including factorybeans) without re-instantiating them [SPR-714]","https://github.com/spring-projects/spring-framework/issues/5442"
"2005-2/15","2005-2/15","use init size to improve performance of object serialization [SPR-715]","https://github.com/spring-projects/spring-framework/issues/5443"
"2005-2/15","2005-2/15","Documentation Code Error [SPR-716]","https://github.com/spring-projects/spring-framework/issues/5444"
"2005-2/15","2005-2/27","Still too early connection closing when using OSIVI [SPR-717]","https://github.com/spring-projects/spring-framework/issues/5445"
"2005-2/16","2006-1/4","AbstractWizardController should check for valid pages or at least report an error [SPR-718]","https://github.com/spring-projects/spring-framework/issues/5446"
"2005-2/16","2012-6/19","SingletonBeanFactoryLocator recursion problem [SPR-719]","https://github.com/spring-projects/spring-framework/issues/5447"
"2005-2/16","2005-8/3","formBackingObject created even if sessionForm is set to true. [SPR-720]","https://github.com/spring-projects/spring-framework/issues/5448"
"2005-2/16","2005-2/28","referenceData() in AbstractFormController is never called. [SPR-721]","https://github.com/spring-projects/spring-framework/issues/5449"
"2005-2/17","2007-11/6","Application listeners that are prototypes aren't auto-added when instantiated [SPR-722]","https://github.com/spring-projects/spring-framework/issues/5450"
"2005-2/17","2005-2/28","Transaction timeout not always enforced [SPR-723]","https://github.com/spring-projects/spring-framework/issues/5451"
"2005-2/18","2005-2/22","Small DispatcherServlet refactoring [SPR-724]","https://github.com/spring-projects/spring-framework/issues/5452"
"2005-2/18","2005-2/21","Make OpenSessionInViewFilter more extensible [SPR-725]","https://github.com/spring-projects/spring-framework/issues/5453"
"2005-2/18","2005-2/28","BindException calls setValue() with toString'ed() version of Object [SPR-726]","https://github.com/spring-projects/spring-framework/issues/5454"
"2005-2/19","2005-3/25","setSingleton in AbstractFactoryBean [SPR-727]","https://github.com/spring-projects/spring-framework/issues/5455"
"2005-2/20","2005-2/20","[Patch] simple fixes found [SPR-728]","https://github.com/spring-projects/spring-framework/issues/5456"
"2005-2/21","2012-6/19","Allow Non-Bean Dependency Injection [SPR-729]","https://github.com/spring-projects/spring-framework/issues/5457"
"2005-2/21","2005-3/11","Refactor AbstractXsltView to use Source instead of DOM [SPR-730]","https://github.com/spring-projects/spring-framework/issues/5458"
"2005-2/21","2012-6/19","Default XSLT view resolver to simplify using XSLT views [SPR-731]","https://github.com/spring-projects/spring-framework/issues/5459"
"2005-2/21","2005-2/21","[PATCH] Remove map lookup when iterating [SPR-732]","https://github.com/spring-projects/spring-framework/issues/5460"
"2005-2/21","2005-3/20","Spring doesn't recognize MySQL deadlock exceptions [SPR-733]","https://github.com/spring-projects/spring-framework/issues/5461"
"2005-2/22","2012-6/19","SimpleMappingExceptionResolver could have an option to NOT log specific exceptions [SPR-734]","https://github.com/spring-projects/spring-framework/issues/5462"
"2005-2/22","2005-3/25","Old version of jasperreports library jar still in CVS [SPR-735]","https://github.com/spring-projects/spring-framework/issues/5463"
"2005-2/22","2005-7/21","cayenne-1.1.jar in CVS includes old version of some apache classes [SPR-736]","https://github.com/spring-projects/spring-framework/issues/5464"
"2005-2/22","2008-1/7","Configuring EhCacheManagerFactoryBean in same XML [SPR-737]","https://github.com/spring-projects/spring-framework/issues/5465"
"2005-2/22","2005-7/21","let Hibernate LocalSessionFactoryBean use the contexts EhCache [SPR-738]","https://github.com/spring-projects/spring-framework/issues/5466"
"2005-2/23","2005-4/24","Step-by-step tutorial broken with HSQLDB 1.7.2+ [SPR-739]","https://github.com/spring-projects/spring-framework/issues/5467"
"2005-2/25","2005-6/16","consider adding varStatus attribute to spring:bind [SPR-740]","https://github.com/spring-projects/spring-framework/issues/5468"
"2005-2/27","2012-6/19","Creation of beans.xml from pre-populated object graph... [SPR-741]","https://github.com/spring-projects/spring-framework/issues/5469"
"2005-2/27","2005-2/27","old version of  mysql driver bundled [SPR-742]","https://github.com/spring-projects/spring-framework/issues/5470"
"2005-2/27","2012-6/19","Change default JSR-160 protocol to RMI [SPR-743]","https://github.com/spring-projects/spring-framework/issues/5471"
"2005-2/27","2005-2/27","Detect proxies and look for attributes on superclass in MetadataModelMBeanInfoAssembler [SPR-744]","https://github.com/spring-projects/spring-framework/issues/5472"
"2005-2/27","2005-2/28","Enable HandlerInterceptor to interrupt request in postHandle [SPR-745]","https://github.com/spring-projects/spring-framework/issues/5473"
"2005-2/28","2007-12/2","Configurable Transaction Synchronization [SPR-746]","https://github.com/spring-projects/spring-framework/issues/5474"
"2005-2/28","2005-3/11","AbstractXsltView doesn't set an ErrorListener on the TransformerFactory [SPR-747]","https://github.com/spring-projects/spring-framework/issues/5475"
"2005-2/28","2005-2/28","Binding to a Long complains when the value is null. [SPR-748]","https://github.com/spring-projects/spring-framework/issues/5476"
"2005-2/28","2012-6/19","Extend 'util' namespace to support 'map', 'set' and 'list'. [SPR-749]","https://github.com/spring-projects/spring-framework/issues/5477"
"2005-2/28","2012-6/19","Proof read of chaper 12 of reference doc [SPR-750]","https://github.com/spring-projects/spring-framework/issues/5478"
"2005-2/28","2012-6/19","Logging Session Changes (patch included) [SPR-751]","https://github.com/spring-projects/spring-framework/issues/5479"
"2005-2/28","2005-3/21","AbstractBeanFactory.getType() ignores exceptions [SPR-752]","https://github.com/spring-projects/spring-framework/issues/5480"
"2005-2/28","2005-3/20","DataSourceUtils.doCloseConnectionIfNecessary '==' not sufficient. [SPR-753]","https://github.com/spring-projects/spring-framework/issues/5481"
"2005-2/28","2005-3/3","Clarify UnsatisfiedDependencyException text for ambiguous constructor injection parameters [SPR-754]","https://github.com/spring-projects/spring-framework/issues/5482"
"2005-3/1","2005-3/20","Sending mail to a server requiring authentication [SPR-755]","https://github.com/spring-projects/spring-framework/issues/5483"
"2005-3/1","2005-3/3","Log Message Swamping: MultiActionController (patch included) [SPR-756]","https://github.com/spring-projects/spring-framework/issues/5484"
"2005-3/1","2007-1/6","Support for JasperReports Applet Viewer [SPR-757]","https://github.com/spring-projects/spring-framework/issues/5485"
"2005-3/1","2005-3/25","BeanUtils.copyProperties doesn't respect ignoreProperties [SPR-758]","https://github.com/spring-projects/spring-framework/issues/5486"
"2005-3/2","2005-3/3","AopUtils#getAllInterfacesForClassAsList might yield duplicates [SPR-759]","https://github.com/spring-projects/spring-framework/issues/5487"
"2005-3/3","2005-3/25","ReloadableResourceBundleMessageSource requires cacheSeconds to be refreshable [SPR-760]","https://github.com/spring-projects/spring-framework/issues/5488"
"2005-3/3","2005-3/22","Nested Property Editor / Transformer for Collections [SPR-761]","https://github.com/spring-projects/spring-framework/issues/5489"
"2005-3/3","2012-6/19","Add ThreadLocal example to doco [SPR-762]","https://github.com/spring-projects/spring-framework/issues/5490"
"2005-3/4","2005-3/5","IllegalAccessException/InvalidPropertyException in AbstractWizardFormController [SPR-763]","https://github.com/spring-projects/spring-framework/issues/5491"
"2005-3/5","2012-6/19","Correct doco wrt to ordering view resolvers [SPR-764]","https://github.com/spring-projects/spring-framework/issues/5492"
"2005-3/5","2005-3/16","Duplicate resources in PathMatchingResourcePatternResolver.findAllClassPathResources [SPR-765]","https://github.com/spring-projects/spring-framework/issues/5493"
"2005-3/8","2005-3/8","[PATCH] Add logging statements to LazyConnectionDataSourceProxy [SPR-767]","https://github.com/spring-projects/spring-framework/issues/5494"
"2005-3/9","2012-6/19","Cyclic references via ProxyFactoryBean throw an BeanCreationException [SPR-768]","https://github.com/spring-projects/spring-framework/issues/5495"
"2005-3/9","2005-3/9","PropertyOverrideConfigurer should log unknown beans at lower level [SPR-769]","https://github.com/spring-projects/spring-framework/issues/5496"
"2005-3/9","2005-3/10","JDBCAccessor forces JDBC connection to be created during initialization [SPR-770]","https://github.com/spring-projects/spring-framework/issues/5497"
"2005-3/9","2005-3/10","JmsConnectionFactoryBean Does Not Handle Null Usernames/Passwords [SPR-771]","https://github.com/spring-projects/spring-framework/issues/5498"
"2005-3/9","2018-9/19","Multiple schedulers [SPR-772]","https://github.com/spring-projects/spring-framework/issues/5499"
"2005-3/10","2005-3/20","TransactionManagerName is not used when no userTransaction specified [SPR-773]","https://github.com/spring-projects/spring-framework/issues/5500"
"2005-3/10","2012-6/19","RequiredDependencyCheckingPostProcessor [SPR-774]","https://github.com/spring-projects/spring-framework/issues/5501"
"2005-3/11","2005-3/20","DataBinder tries to bind required fields with null value resulting in two errors [SPR-775]","https://github.com/spring-projects/spring-framework/issues/5502"
"2005-3/11","2005-3/14","Return Number Bytes Copied in FileCopyUtils [SPR-776]","https://github.com/spring-projects/spring-framework/issues/5503"
"2005-3/12","2005-3/14","Extend HibernateTemplate for entityName methods [SPR-777]","https://github.com/spring-projects/spring-framework/issues/5504"
"2005-3/14","2012-6/19","Not aplying interceptors when registering controllers with the CommonsPathMapHandlerMapping [SPR-778]","https://github.com/spring-projects/spring-framework/issues/5505"
"2005-3/14","2005-3/21","iBatis 2 reference guide patch [SPR-779]","https://github.com/spring-projects/spring-framework/issues/5506"
"2005-3/14","2005-3/25","in spring-reference (3.15) ""FileRetrievingFactoryBean"" is used instead of ""FieldRetrievingFactoryBean"" [SPR-780]","https://github.com/spring-projects/spring-framework/issues/5507"
"2005-3/14","2005-3/25","AOP before advice example not correct [SPR-781]","https://github.com/spring-projects/spring-framework/issues/5508"
"2005-3/14","2005-3/15","javax.management.MalformedObjectNameException: Missing ':' character in ObjectName exception.  [SPR-782]","https://github.com/spring-projects/spring-framework/issues/5509"
"2005-3/15","2005-3/18","VelocityLayoutView analogous to VelocityLayoutServlet (in velocity-tools) [SPR-783]","https://github.com/spring-projects/spring-framework/issues/5510"
"2005-3/15","2012-6/19","Sequence of call with MethodInvokingJobDetailFactoryBean [SPR-784]","https://github.com/spring-projects/spring-framework/issues/5511"
"2005-3/15","2005-3/23","[JMX] - Metadata Support for Operation Parameters [SPR-785]","https://github.com/spring-projects/spring-framework/issues/5512"
"2005-3/15","2012-6/19","serializing proxy for simulating call-by-value [SPR-786]","https://github.com/spring-projects/spring-framework/issues/5513"
"2005-3/15","2014-4/21","GZIP compression filter [SPR-787]","https://github.com/spring-projects/spring-framework/issues/5514"
"2005-3/16","2012-6/19","Request log filter [SPR-788]","https://github.com/spring-projects/spring-framework/issues/5515"
"2005-3/16","2012-6/19","Add a cancelView to SimpleFormController [SPR-789]","https://github.com/spring-projects/spring-framework/issues/5516"
"2005-3/16","2005-3/20","'prefix' and 'suffix' properties for InternalPathMethodNameResolver [SPR-790]","https://github.com/spring-projects/spring-framework/issues/5517"
"2005-3/16","2012-6/19","""global forwards"" for Spring framework [SPR-791]","https://github.com/spring-projects/spring-framework/issues/5518"
"2005-3/16","2005-4/8","Support For Event Listeners [SPR-792]","https://github.com/spring-projects/spring-framework/issues/5519"
"2005-3/16","2005-3/25","AbstractWizardFormController with sessionForm=false NPE [SPR-793]","https://github.com/spring-projects/spring-framework/issues/5520"
