"createdAt","closedAt","title","url"
"2020-10/9","2020-12/1","Add support for input masks in evasion attacks where possible","https://github.com/Trusted-AI/adversarial-robustness-toolbox/issues/652"
"2020-10/13","2020-11/4","Enable Consistent Outputs From TF/Pytorch Faster-RCNN's","https://github.com/Trusted-AI/adversarial-robustness-toolbox/issues/655"
"2020-10/14","2020-11/4","Check if preprocessing_defences can be enabled in PyTorchDeepSpeech","https://github.com/Trusted-AI/adversarial-robustness-toolbox/issues/657"
"2020-10/14","2020-11/4","Enable PGD and FGSM attacks on `art.estimators.speech_recognition` estimators","https://github.com/Trusted-AI/adversarial-robustness-toolbox/issues/658"
"2020-10/14","2020-11/4","Enable passing a list for DPatch's patch_shape","https://github.com/Trusted-AI/adversarial-robustness-toolbox/issues/661"
"2020-10/15","2020-11/14","Implement STRIP defense against poisoning attacks","https://github.com/Trusted-AI/adversarial-robustness-toolbox/issues/664"
"2020-10/15","2021-3/16","Add backward compatibility for TensorFlow v2 to v1","https://github.com/Trusted-AI/adversarial-robustness-toolbox/issues/665"
"2020-10/15","2020-11/20","Add clean label backdoor attack  ","https://github.com/Trusted-AI/adversarial-robustness-toolbox/issues/666"
"2020-10/15","2020-10/16","PyTorchDeepSpeech.loss_gradient seems to fail with AttributeError in line 412","https://github.com/Trusted-AI/adversarial-robustness-toolbox/issues/668"
"2020-10/16","2020-12/1","FGSM attack not working well (cannot replicate adversarial_training_mnist.ipynb under notebooks)","https://github.com/Trusted-AI/adversarial-robustness-toolbox/issues/670"
"2020-10/16","null","Add Safe Predictions for Abstaining Classifiers","https://github.com/Trusted-AI/adversarial-robustness-toolbox/issues/671"
"2020-10/16","2020-11/4","NaN values in adversarial examples generated by ImperceptibleASRPytorch","https://github.com/Trusted-AI/adversarial-robustness-toolbox/issues/672"
"2020-10/20","2020-12/1","Enhance JPegCompression defense","https://github.com/Trusted-AI/adversarial-robustness-toolbox/issues/673"
"2020-10/20","2020-12/1","Enable passing a list for attacks' mask argument","https://github.com/Trusted-AI/adversarial-robustness-toolbox/issues/674"
"2020-10/20","2020-10/20","Using Multiple Attacks ","https://github.com/Trusted-AI/adversarial-robustness-toolbox/issues/675"
"2020-10/21","2020-12/1","Support variable length inputs in preprocessing defenses","https://github.com/Trusted-AI/adversarial-robustness-toolbox/issues/680"
"2020-10/22","2020-10/23","What is the adversarial training approach in classifier?","https://github.com/Trusted-AI/adversarial-robustness-toolbox/issues/683"
"2020-10/26","2020-11/9","classifier accuracy increasing as attack strength (epsilon) increases","https://github.com/Trusted-AI/adversarial-robustness-toolbox/issues/687"
"2020-10/27","2020-11/4","PGD and FGM fail on PyTorchDeepSpeech if labels are not provided","https://github.com/Trusted-AI/adversarial-robustness-toolbox/issues/688"
"2020-10/28","2020-12/1","Add progress bar to art.utils.get_file","https://github.com/Trusted-AI/adversarial-robustness-toolbox/issues/692"
"2020-10/28","2020-12/1","Make ART_DATA_PATH configurable after import","https://github.com/Trusted-AI/adversarial-robustness-toolbox/issues/693"
"2020-10/28","2020-11/4","Making numpy object arrays from ragged sequences is deprecated","https://github.com/Trusted-AI/adversarial-robustness-toolbox/issues/694"
"2020-10/29","null","Enable PGD attack on PyTorch Faster-RCNN using np object arrays as input","https://github.com/Trusted-AI/adversarial-robustness-toolbox/issues/697"
"2020-10/29","2020-11/2","Certified accuracy","https://github.com/Trusted-AI/adversarial-robustness-toolbox/issues/699"
"2020-10/30","2020-11/5","unable to replicate a result from Athalye et al 2018 with art -- issue with gradient calculation?","https://github.com/Trusted-AI/adversarial-robustness-toolbox/issues/702"
"2020-11/2","null","Add a small number of test audio samples","https://github.com/Trusted-AI/adversarial-robustness-toolbox/issues/706"
"2020-11/2","2021-3/16","Add test runner for Lingvo ASR estimator","https://github.com/Trusted-AI/adversarial-robustness-toolbox/issues/707"
"2020-11/3","2020-12/1","Simpler usage for PreprocessorPyTorch","https://github.com/Trusted-AI/adversarial-robustness-toolbox/issues/708"
"2020-11/4","2020-12/1","Change application of mask in PGD","https://github.com/Trusted-AI/adversarial-robustness-toolbox/issues/710"
"2020-11/5","2020-12/1","Change Implementation of Random Restarts in PGD ","https://github.com/Trusted-AI/adversarial-robustness-toolbox/issues/714"
"2020-11/5","2020-12/1","Attacked image generated to fool tesseract not working ","https://github.com/Trusted-AI/adversarial-robustness-toolbox/issues/715"
"2020-11/6","null","Remove all of the duplicated and slightly different fix_get_mnist_subset fixture","https://github.com/Trusted-AI/adversarial-robustness-toolbox/issues/717"
"2020-11/8","2020-11/10","data augmentation with classifier.fit","https://github.com/Trusted-AI/adversarial-robustness-toolbox/issues/721"
"2020-11/9","2021-7/12","Questions regarding adversarial trainer","https://github.com/Trusted-AI/adversarial-robustness-toolbox/issues/724"
"2020-11/11","2020-11/21","PyTorchDataGenerator always returns the same batch","https://github.com/Trusted-AI/adversarial-robustness-toolbox/issues/728"
"2020-11/11","2020-12/1","Github Action per Framework","https://github.com/Trusted-AI/adversarial-robustness-toolbox/issues/729"
"2020-11/12","2021-4/16","Remove @FrameworkAgnostic Markers","https://github.com/Trusted-AI/adversarial-robustness-toolbox/issues/732"
"2020-11/12","2021-4/16","Test run analysis","https://github.com/Trusted-AI/adversarial-robustness-toolbox/issues/733"
"2020-11/13","2020-12/1","Support for Python > 3.7 and/or scikit-learn > 0.22","https://github.com/Trusted-AI/adversarial-robustness-toolbox/issues/734"
"2020-11/13","2020-12/1","Randomized Smoothing Wrapper","https://github.com/Trusted-AI/adversarial-robustness-toolbox/issues/735"
"2020-11/16","2020-12/3","example of using ExpectationOverTransformation (EoT) wrapper with preprocessing defence","https://github.com/Trusted-AI/adversarial-robustness-toolbox/issues/739"
"2020-11/17","2021-4/16","empirical robustness","https://github.com/Trusted-AI/adversarial-robustness-toolbox/issues/742"
"2020-11/17","null","Investigate Pytorch compatibility with poisoning attacks","https://github.com/Trusted-AI/adversarial-robustness-toolbox/issues/745"
"2020-11/17","null","Move all poisoning defense tests to the new ART Testing Framework","https://github.com/Trusted-AI/adversarial-robustness-toolbox/issues/746"
"2020-11/17","2020-12/1","Support preprocessing in the pytorch imperceptable asr attack","https://github.com/Trusted-AI/adversarial-robustness-toolbox/issues/747"
"2020-11/24","2021-1/8","Any example/tutorial that demonstrate the model extraction attacks?","https://github.com/Trusted-AI/adversarial-robustness-toolbox/issues/756"
"2020-11/25","2020-11/26","A Little Suggestion: Add noise return for UniversalPerturbation","https://github.com/Trusted-AI/adversarial-robustness-toolbox/issues/758"
"2020-11/27","null","""Only Keras classifiers (v2.2.4) are supported for this defence"" in poisoning_defense_neural_cleanse.ipynd","https://github.com/Trusted-AI/adversarial-robustness-toolbox/issues/764"
"2020-11/28","2021-4/16","BinaryInputDetector Discussion","https://github.com/Trusted-AI/adversarial-robustness-toolbox/issues/766"
"2020-11/29","2020-11/29","max_iter in PGD attack does not work","https://github.com/Trusted-AI/adversarial-robustness-toolbox/issues/769"
"2020-11/30","null","detection_adversarial_samples_cifar10.ipynb is not working correctly on nbviewer. The reason is tf version.","https://github.com/Trusted-AI/adversarial-robustness-toolbox/issues/770"
"2020-11/30","2020-12/1","[install failed] UnicodeDecodeError: 'gbk' codec can't decode byte 0xad in position 1843: illegal multibyte sequence","https://github.com/Trusted-AI/adversarial-robustness-toolbox/issues/771"
"2020-12/1","2021-1/9","""Divided by zero issue"" using Wasserstein Attack","https://github.com/Trusted-AI/adversarial-robustness-toolbox/issues/776"
"2020-12/1","2020-12/1","TypeError: __init__() got an unexpected keyword argument 'max_iters' in PoisoningAttackSVM.ipynb","https://github.com/Trusted-AI/adversarial-robustness-toolbox/issues/777"
"2020-12/2","2021-3/16","Implement set_learning_phase method(s) as no-op where applicable","https://github.com/Trusted-AI/adversarial-robustness-toolbox/issues/779"
"2020-12/8","2021-1/9","Argument model not defined in super.__init__() of PyTorchFasterRCNN","https://github.com/Trusted-AI/adversarial-robustness-toolbox/issues/788"
"2020-12/9","2021-3/16","Rename skipMlFramework to skip_framework or skip_ml_framework","https://github.com/Trusted-AI/adversarial-robustness-toolbox/issues/793"
"2020-12/10","2021-4/16","What is the fastest way to create adverserial examples for RandomForest ou GradientBoosting? Are there ways to speed up the process?","https://github.com/Trusted-AI/adversarial-robustness-toolbox/issues/795"
"2020-12/13","null","Example use of Some of the attacks","https://github.com/Trusted-AI/adversarial-robustness-toolbox/issues/797"
"2020-12/13","2021-1/9","Use tqdm.auto imports for use in notebooks","https://github.com/Trusted-AI/adversarial-robustness-toolbox/issues/798"
"2020-12/15","2021-1/9","Having trouble generating speech recognition adversarial samples.","https://github.com/Trusted-AI/adversarial-robustness-toolbox/issues/800"
"2020-12/15","2021-1/9","PixelThreshold attack does not scale back input samples in range [0, 1]","https://github.com/Trusted-AI/adversarial-robustness-toolbox/issues/801"
"2020-12/17","2020-12/17","Github Action which verifies that each ART test was run at least once","https://github.com/Trusted-AI/adversarial-robustness-toolbox/issues/803"
"2020-12/17","2020-12/17","Integrate all duplicated mnist_subset fixtures across tests","https://github.com/Trusted-AI/adversarial-robustness-toolbox/issues/804"
"2020-12/18","2021-2/5","Update KerasClassifier for deprecation of set_learning_phase","https://github.com/Trusted-AI/adversarial-robustness-toolbox/issues/806"
"2020-12/22","null","Remove @FrameworkAgnostic Markers","https://github.com/Trusted-AI/adversarial-robustness-toolbox/issues/807"
"2020-12/23","2021-1/9","Missing Keras import guard in KerasClassifier's custom_loss_gradient function.","https://github.com/Trusted-AI/adversarial-robustness-toolbox/issues/809"
"2020-12/25","2021-3/16","UnboundLocalError: local variable 'archive' referenced before assignment????","https://github.com/Trusted-AI/adversarial-robustness-toolbox/issues/811"
"2021-1/1","2021-1/1","Can we use TF Data API with art.estimators.classification.KerasClassifier?","https://github.com/Trusted-AI/adversarial-robustness-toolbox/issues/812"
"2021-1/2","null","Support for multioutput model ","https://github.com/Trusted-AI/adversarial-robustness-toolbox/issues/813"
"2021-1/4","2021-1/9","Successful Pixel Attack and Threshold Attacks!","https://github.com/Trusted-AI/adversarial-robustness-toolbox/issues/817"
"2021-1/5","2021-3/16","Add support for Numba and investigate performance improvements","https://github.com/Trusted-AI/adversarial-robustness-toolbox/issues/819"
"2021-1/6","2021-3/16","Add subclass-specific params to estimator_params list","https://github.com/Trusted-AI/adversarial-robustness-toolbox/issues/821"
"2021-1/7","2021-3/16","Expand range of eps_step (and potentially eps) in PGD","https://github.com/Trusted-AI/adversarial-robustness-toolbox/issues/823"
"2021-1/7","2021-3/16","Better PGD handling of NaN and Inf gradient outputs","https://github.com/Trusted-AI/adversarial-robustness-toolbox/issues/824"
"2021-1/7","2021-3/16","SklearnClassifier produces probabilities instead of logits for DeepFool","https://github.com/Trusted-AI/adversarial-robustness-toolbox/issues/826"
"2021-1/8","null","Package name ""art"" has already been taken on pypi","https://github.com/Trusted-AI/adversarial-robustness-toolbox/issues/830"
"2021-1/8","2021-3/16","Implement Convex Polytope clean label attack ","https://github.com/Trusted-AI/adversarial-robustness-toolbox/issues/831"
"2021-1/9","2021-2/20","PGD fails when running targeted attack with PyTorch or TensorFlow","https://github.com/Trusted-AI/adversarial-robustness-toolbox/issues/832"
"2021-1/11","2021-2/20","AutoAttack should pass kwargs of generate to internal calls attack.generate","https://github.com/Trusted-AI/adversarial-robustness-toolbox/issues/835"
"2021-1/11","null","SklearnClassifier does not support sklearn-like estimators (e.g. ThunderSVM)","https://github.com/Trusted-AI/adversarial-robustness-toolbox/issues/836"
"2021-1/13","2021-2/20","'BlackBoxClassifier' object has no attribute 'channels_first'","https://github.com/Trusted-AI/adversarial-robustness-toolbox/issues/837"
"2021-1/14","2021-2/20","Bad performance of targeted versions of AutoPGD and PGD attacks ","https://github.com/Trusted-AI/adversarial-robustness-toolbox/issues/840"
"2021-1/14","2021-2/20","JSMA only iterates once when clip_values is not set","https://github.com/Trusted-AI/adversarial-robustness-toolbox/issues/841"
"2021-1/14","2021-1/14","JSMA only iterates one when clip_values is not set","https://github.com/Trusted-AI/adversarial-robustness-toolbox/issues/842"
"2021-1/15","2021-4/16","two questions on zoo attack.","https://github.com/Trusted-AI/adversarial-robustness-toolbox/issues/845"
"2021-1/18","2021-3/16","Preprocessing for PyTorch models","https://github.com/Trusted-AI/adversarial-robustness-toolbox/issues/846"
"2021-1/18","2021-2/20","Update channel index selection in ShadowAttack for PyTorch models","https://github.com/Trusted-AI/adversarial-robustness-toolbox/issues/847"
"2021-1/18","2021-3/16","Implement Adversarial Patch framework-specific in PyTorch","https://github.com/Trusted-AI/adversarial-robustness-toolbox/issues/851"
"2021-1/18","2021-3/16","Add EoT for image modifications like brightness, contrast, etc.","https://github.com/Trusted-AI/adversarial-robustness-toolbox/issues/852"
"2021-1/18","2021-3/16","Extend mask feature in AdversarialPatch*.apply_patch to include perspective transformation","https://github.com/Trusted-AI/adversarial-robustness-toolbox/issues/853"
"2021-1/18","2021-2/20","Add patch reset option to method generate of Adversarial Patch attacks","https://github.com/Trusted-AI/adversarial-robustness-toolbox/issues/854"
"2021-1/19","2021-2/20","Batch SimBA","https://github.com/Trusted-AI/adversarial-robustness-toolbox/issues/855"
"2021-1/19","2021-1/19","SimBA bug? inconsistent with the original paper ","https://github.com/Trusted-AI/adversarial-robustness-toolbox/issues/856"
"2021-1/21","null","Cross Evaluation Test Parent Test Class","https://github.com/Trusted-AI/adversarial-robustness-toolbox/issues/859"
"2021-1/22","2021-2/20","Enable GPU support in PyTorchClassifier.loss","https://github.com/Trusted-AI/adversarial-robustness-toolbox/issues/861"
"2021-1/26","2021-6/15","Support for TensorBoard in art.attacks","https://github.com/Trusted-AI/adversarial-robustness-toolbox/issues/864"
"2021-1/26","2021-5/24","New preprocessing model for natural corruptions","https://github.com/Trusted-AI/adversarial-robustness-toolbox/issues/865"
"2021-1/26","null","Implement estimators and attacks for NLP tasks","https://github.com/Trusted-AI/adversarial-robustness-toolbox/issues/866"
"2021-1/26","2021-2/20","Functionally Equivalent Extraction delta converges to 0","https://github.com/Trusted-AI/adversarial-robustness-toolbox/issues/867"
