"['title']","['url']","['createdAt']","['closedAt']"
"IRR and FIR","https://github.com/grame-cncm/faust/issues/462","2020-7/8","2020-7/10"
"faust2wasm -emcc flag attempts to use missing webaudio-asm.cpp","https://github.com/grame-cncm/faust/issues/465","2020-7/15","2020-7/19"
"2.27.1: httpd build fails on invalid conversion","https://github.com/grame-cncm/faust/issues/467","2020-7/22","2020-7/25"
"faust2api openframeworks+jack setup","https://github.com/grame-cncm/faust/issues/468","2020-7/25","2021-2/12"
"2.27.1 source tarball has been reuploaded (and doesn't reflect 2.27.1)","https://github.com/grame-cncm/faust/issues/469","2020-7/29","2020-8/4"
"Expressions in control() get optimised inappropriately","https://github.com/grame-cncm/faust/issues/470","2020-7/29","null"
"-fm def does not compile","https://github.com/grame-cncm/faust/issues/472","2020-7/31","null"
"faust2jaqt wants alsa","https://github.com/grame-cncm/faust/issues/473","2020-7/31","2020-8/4"
"MIDI glitches","https://github.com/grame-cncm/faust/issues/474","2020-8/11","2020-8/29"
"Warning in generated code -Wunused-parameter","https://github.com/grame-cncm/faust/issues/475","2020-8/12","null"
"faust2caqt / faust2au: failing to compile faust dsp files that incorporate additional custom header files","https://github.com/grame-cncm/faust/issues/476","2020-8/12","null"
"make uninstall throws /bin/sh: Argument list too long","https://github.com/grame-cncm/faust/issues/477","2020-8/13","null"
"Usage of sys/sysctl.h","https://github.com/grame-cncm/faust/issues/479","2020-8/13","2020-8/25"
"Extremely slow compilation.","https://github.com/grame-cncm/faust/issues/480","2020-8/16","null"
"faustgen-1.45-win64.zip released without faustgen\externals\msp\faustgen-resources","https://github.com/grame-cncm/faust/issues/481","2020-8/25","2021-2/12"
"A Segmentation fault in cosprim.hh:49:13","https://github.com/grame-cncm/faust/issues/482","2020-8/26","null"
"Aliasing and oversampling","https://github.com/grame-cncm/faust/issues/484","2020-8/28","2020-8/28"
"Remove faust-manual for Faust repo (moved in faustdoc)","https://github.com/grame-cncm/faust/issues/488","2020-9/6","2020-9/9"
"Does the tutorial need to be updated now we have ES8388 driver support?","https://github.com/grame-cncm/faust/issues/489","2020-9/7","2020-9/8"
"Faust installer didn't come with faust2esp32. Is there a precomipled w32 binary available. ","https://github.com/grame-cncm/faust/issues/490","2020-9/10","2020-9/17"
"faust Unity OSX is gone","https://github.com/grame-cncm/faust/issues/491","2020-9/14","null"
"Unable to make for ubuntu 18.04 'missing: PKG_CONFIG_EXECUTABLE)'","https://github.com/grame-cncm/faust/issues/493","2020-9/19","2020-9/20"
"error: undefined symbol: CPPInstVisitor::gFunctionSymbolTable","https://github.com/grame-cncm/faust/issues/494","2020-9/21","2020-9/21"
"Please add cmake variables to enable language backends","https://github.com/grame-cncm/faust/issues/495","2020-9/21","2020-9/22"
"Faust to CodeBlocks converter","https://github.com/grame-cncm/faust/issues/496","2020-9/24","2020-11/20"
"ir2dsp error","https://github.com/grame-cncm/faust/issues/498","2020-9/25","2020-10/6"
"faust on LyraT esp32. faust out of scope when setParamValue is used in a task / function.","https://github.com/grame-cncm/faust/issues/499","2020-9/26","2020-10/4"
"Mesh2Faust Demos not working","https://github.com/grame-cncm/faust/issues/500","2020-9/26","2020-10/6"
"I want to help","https://github.com/grame-cncm/faust/issues/501","2020-9/27","2020-10/2"
"Online Compiler is Down","https://github.com/grame-cncm/faust/issues/506","2020-10/6","2020-10/9"
"faust2teensy strange behaviour","https://github.com/grame-cncm/faust/issues/507","2020-10/10","null"
"faust2csound faust to cabbage ","https://github.com/grame-cncm/faust/issues/508","2020-10/11","2020-10/23"
"createPolyDSPFactoryFromString, how to set controls ? ","https://github.com/grame-cncm/faust/issues/509","2020-10/18","2020-10/18"
"VHDL Branch: Converting a .dsp.flop file to VHDL instructions using FloPoCo","https://github.com/grame-cncm/faust/issues/510","2020-10/29","2020-11/1"
"Make SR limit much higher","https://github.com/grame-cncm/faust/issues/513","2020-11/11","2020-11/13"
"The online compiler seems not to produce uptodate SuperCollider UGens","https://github.com/grame-cncm/faust/issues/514","2020-11/13","2021-2/20"
"Rust: avoid allocation when calling dsp.compute()?","https://github.com/grame-cncm/faust/issues/515","2020-11/13","null"
"[JACK] [JAQT] ADSR release not working","https://github.com/grame-cncm/faust/issues/516","2020-11/16","2020-11/16"
"voice stealing generate click","https://github.com/grame-cncm/faust/issues/518","2020-11/17","2020-11/17"
"faust2vsti troubles on Arch Linux","https://github.com/grame-cncm/faust/issues/519","2020-11/17","null"
"faust2supercollider: filenames with dash (""a-b.dsp"") breaks compilation","https://github.com/grame-cncm/faust/issues/520","2020-11/22","2022-1/1"
"faust2sc should throw error if it encountrers problems generating a file","https://github.com/grame-cncm/faust/issues/521","2020-11/22","null"
"Saving/restoring the DSP state ?","https://github.com/grame-cncm/faust/issues/522","2020-11/25","null"
"Faust2Teensy Tutorial","https://github.com/grame-cncm/faust/issues/523","2020-11/27","2020-11/27"
"Faust vsti for OSX through online IDE generating effect instead of instrument","https://github.com/grame-cncm/faust/issues/524","2020-11/27","null"
"Documentation missing for ma.decimal","https://github.com/grame-cncm/faust/issues/526","2020-12/1","2020-12/1"
"process = hslider(""min"", 0, 0, 1, 0.1);   crashes compiler","https://github.com/grame-cncm/faust/issues/527","2020-12/3","2020-12/3"
"violin bow question","https://github.com/grame-cncm/faust/issues/529","2020-12/19","2020-12/22"
"dlang backend: misuse of the static keyword","https://github.com/grame-cncm/faust/issues/530","2020-12/19","2021-1/11"
"Keyword __restrict__ not recognized by compilers","https://github.com/grame-cncm/faust/issues/532","2020-12/20","2020-12/20"
"faust-mode.el needs to be updated in new release","https://github.com/grame-cncm/faust/issues/533","2020-12/20","2021-2/4"
"getting faust2au to work on Mojave","https://github.com/grame-cncm/faust/issues/536","2020-12/22","2020-12/22"
"Bad code puts compiler in infinite loop situation","https://github.com/grame-cncm/faust/issues/537","2020-12/22","null"
"What Docker container I should use to compile in lv2?","https://github.com/grame-cncm/faust/issues/540","2021-1/22","null"
"How to costumize the UI?","https://github.com/grame-cncm/faust/issues/541","2021-1/27","2021-1/29"
"Feature request: load rc file in faust2sndfile","https://github.com/grame-cncm/faust/issues/542","2021-1/27","2021-6/22"
"MESG less zoomed when Rate is deactivated.","https://github.com/grame-cncm/faust/issues/543","2021-1/27","2021-1/27"
"Text is illegible when compiling to web platform","https://github.com/grame-cncm/faust/issues/544","2021-1/29","2021-1/30"
"Please add support for pcm5102  on ESP32 or point me into proper direction.","https://github.com/grame-cncm/faust/issues/545","2021-1/29","2021-1/29"
"soundfile primitive broken in C++ architectures","https://github.com/grame-cncm/faust/issues/546","2021-1/30","2021-1/31"
"Exponential and logarithmic slider scales not working in Qt applications","https://github.com/grame-cncm/faust/issues/547","2021-1/30","null"
"Integer increment not working in CAQT sliders","https://github.com/grame-cncm/faust/issues/548","2021-2/8","null"
"faust2sig not working with, apparently, ffunctions","https://github.com/grame-cncm/faust/issues/549","2021-2/8","null"
"faust-built executable doesn't clear Jack buffer and leaves sound on after it exits","https://github.com/grame-cncm/faust/issues/552","2021-2/16","2021-4/27"
"INCLUDE_DYNAMIC or INCLUDE_STATIC should be enabled by default, otherwise only headers are installed and not library","https://github.com/grame-cncm/faust/issues/553","2021-2/17","2021-3/5"
"Adding logue SDK architecure","https://github.com/grame-cncm/faust/issues/555","2021-2/24","null"
"faust fails with '-lang cpp not supported', but configure said that cpp was built","https://github.com/grame-cncm/faust/issues/558","2021-3/2","2021-3/4"
"Error: unable to open CAQt app due to hslider ranges","https://github.com/grame-cncm/faust/issues/559","2021-3/5","null"
"Issue with alsa/asoundlib.h and gtk/gtk.h when compiling","https://github.com/grame-cncm/faust/issues/562","2021-3/12","2021-3/16"
"gtk2 is EOL","https://github.com/grame-cncm/faust/issues/563","2021-3/12","null"
"Compiler segfaults on Windows when exceeding a certain stacksize","https://github.com/grame-cncm/faust/issues/564","2021-3/13","2021-3/16"
"faust2supercollider ""Audio Rate inputs""","https://github.com/grame-cncm/faust/issues/565","2021-3/20","2021-3/20"
"making more instrument bodies","https://github.com/grame-cncm/faust/issues/566","2021-3/21","null"
"Scalar variables for 1-sample delay lines","https://github.com/grame-cncm/faust/issues/567","2021-3/23","null"
"Cannot repeatedly open faust2alsa compiled programs on ubuntu","https://github.com/grame-cncm/faust/issues/568","2021-3/26","null"
"Make rdtable/rwtable size parameter behaves like the @ primitive","https://github.com/grame-cncm/faust/issues/571","2021-4/12","null"
"faust2supercollider/faust2sc breaks with ruby > 2.7","https://github.com/grame-cncm/faust/issues/572","2021-4/16","2021-4/16"
"Checks for llvm versions break on minor version update of llvm","https://github.com/grame-cncm/faust/issues/573","2021-4/16","2021-4/16"
"ExpValueConverter not working well","https://github.com/grame-cncm/faust/issues/574","2021-4/16","null"
"Faust2PNG and other converters relying on inkscape fails","https://github.com/grame-cncm/faust/issues/578","2021-4/25","null"
"Move examples into separate repository","https://github.com/grame-cncm/faust/issues/579","2021-4/26","null"
"`faust osc.dsp` generates a 64k entry lookup table; why?","https://github.com/grame-cncm/faust/issues/580","2021-4/26","2021-6/7"
"Crash on windows with SPulsaxophone","https://github.com/grame-cncm/faust/issues/581","2021-5/3","2022-8/22"
"faust2supercollider: Feature requests/ideas","https://github.com/grame-cncm/faust/issues/582","2021-5/8","2022-1/1"
"Optimization opportunity for input control changes","https://github.com/grame-cncm/faust/issues/584","2021-5/15","null"
"Trouble creating VST3 via faust2juce with JUCE 6.0.8","https://github.com/grame-cncm/faust/issues/585","2021-5/23","2021-6/4"
"Missing include for limits, but commit introduces too many changes","https://github.com/grame-cncm/faust/issues/586","2021-5/29","2021-5/29"
"Integrate native rust audio libraries (CPAL)","https://github.com/grame-cncm/faust/issues/588","2021-6/3","null"
"faust2juce sets IS_SYNTH=1 when ""nvoices"" was NOT found in the dsp file","https://github.com/grame-cncm/faust/issues/589","2021-6/5","2021-6/7"
"Controls under a tabbed control do not display correctly in VST Created via JUCE.","https://github.com/grame-cncm/faust/issues/597","2021-6/17","null"
"Request: Provide ability to run faust compiler WASM version in Nodejs","https://github.com/grame-cncm/faust/issues/598","2021-6/18","null"
"VST via JUCE, bargraph doesn't display when top of range is 0.0, OK when top is 6.0.","https://github.com/grame-cncm/faust/issues/599","2021-6/19","2021-6/22"
"AddressSanitizer: SEGV on unknown address 0x000000000000 ","https://github.com/grame-cncm/faust/issues/604","2021-6/24","null"
"About constant numerical expressions","https://github.com/grame-cncm/faust/issues/605","2021-6/26","2021-6/26"
"multiple definition of `__exidx_end' when building two audio objects for teensy","https://github.com/grame-cncm/faust/issues/606","2021-6/28","null"
"Does not work with qt6","https://github.com/grame-cncm/faust/issues/609","2021-7/4","null"
"mixing lib","https://github.com/grame-cncm/faust/issues/611","2021-7/7","2021-7/9"
"Faust VST/AU plugins - report latency to host?","https://github.com/grame-cncm/faust/issues/614","2021-7/9","null"
"Compiling with int's","https://github.com/grame-cncm/faust/issues/615","2021-7/10","null"
"Magnetophon compressors not working in online IDE - edit: not in AU either","https://github.com/grame-cncm/faust/issues/616","2021-7/11","null"
