"['title']","['url']","['createdAt']","['closedAt']"
"Computing tables during compilation","https://github.com/grame-cncm/faust/issues/621","2021-7/19","null"
"faust2portaudiorust gives compile errors","https://github.com/grame-cncm/faust/issues/624","2021-7/22","2021-7/22"
"Access Faust code for the example models","https://github.com/grame-cncm/faust/issues/625","2021-7/24","2021-7/25"
" interpreter_dsp::compute allocates memory","https://github.com/grame-cncm/faust/issues/626","2021-7/26","2021-7/27"
"Faust/JUCE Setup","https://github.com/grame-cncm/faust/issues/627","2021-7/27","null"
"libfaust: dsp_poly not clearing voices with instanceClear() when voice control is off","https://github.com/grame-cncm/faust/issues/628","2021-8/1","2021-8/15"
"libfaust: polyphonic vars don't work when voices are grouped but otherwise do ","https://github.com/grame-cncm/faust/issues/629","2021-8/1","2021-8/2"
"faust2juce ignores channel configurations","https://github.com/grame-cncm/faust/issues/630","2021-8/3","null"
"faust2juce draws white on white gui by default","https://github.com/grame-cncm/faust/issues/631","2021-8/3","null"
"Add the copysign function","https://github.com/grame-cncm/faust/issues/633","2021-8/6","2021-8/7"
"Mixed-precision processing","https://github.com/grame-cncm/faust/issues/634","2021-8/6","null"
"faust2unity no sound in editor","https://github.com/grame-cncm/faust/issues/637","2021-8/14","null"
"faust2unity iOS plugin linking error","https://github.com/grame-cncm/faust/issues/638","2021-8/14","2021-12/6"
"Web IDE - Browser support","https://github.com/grame-cncm/faust/issues/640","2021-8/19","2021-8/20"
"Faust for ESP32: example code not compiling","https://github.com/grame-cncm/faust/issues/644","2021-9/1","2021-9/29"
"[coreaudio] coreaudio doesn't work as expected when the chosen input device has outputs","https://github.com/grame-cncm/faust/issues/645","2021-9/2","2021-9/4"
"ERROR : path 'mod_depth' is already used without si.smoo","https://github.com/grame-cncm/faust/issues/646","2021-9/3","null"
"faust2csound generates incorrect Csound opcode registration","https://github.com/grame-cncm/faust/issues/648","2021-9/4","2021-9/4"
"Create new DSP factory when imports changed","https://github.com/grame-cncm/faust/issues/649","2021-9/11","2021-10/6"
"teensy setParamValue crashes if path does not exists","https://github.com/grame-cncm/faust/issues/650","2021-9/13","2021-10/6"
"Why are some control names showing up as 0x00 ?","https://github.com/grame-cncm/faust/issues/651","2021-9/14","2021-9/14"
"Compilation errors on Windows 10, Msys2 MinGW64","https://github.com/grame-cncm/faust/issues/652","2021-9/18","2021-10/4"
"Memory corruptions in Faust compiler","https://github.com/grame-cncm/faust/issues/653","2021-9/24","null"
"SEGV_CTree:branch","https://github.com/grame-cncm/faust/issues/655","2021-10/4","null"
"FPE_divExtendedNode","https://github.com/grame-cncm/faust/issues/656","2021-10/4","null"
"FPE_remNode","https://github.com/grame-cncm/faust/issues/657","2021-10/4","null"
"Bela build fails when using GUI","https://github.com/grame-cncm/faust/issues/659","2021-10/18","2021-10/18"
"Bela build fails when using MIDI","https://github.com/grame-cncm/faust/issues/660","2021-10/18","2021-10/18"
"logical & and | in generated c code","https://github.com/grame-cncm/faust/issues/661","2021-10/19","2022-2/14"
"RFE: get XML string from libfaust without writing to file","https://github.com/grame-cncm/faust/issues/665","2021-10/28","2021-11/4"
"example reverb/greyhole.dsp broken","https://github.com/grame-cncm/faust/issues/668","2021-10/30","2021-11/27"
"Compile Faust to AssemblyScript? [Feature request]","https://github.com/grame-cncm/faust/issues/674","2021-11/21","null"
"key function for alternative tuning doesn't work","https://github.com/grame-cncm/faust/issues/675","2021-11/21","2021-11/21"
"deprecated `which` prints warnings to stderr","https://github.com/grame-cncm/faust/issues/676","2021-12/2","null"
"exepath::resolvelink does not correctly multilevel symlinks","https://github.com/grame-cncm/faust/issues/677","2021-12/2","null"
"The meters of plug-ins generated by faust2juce are displayed as collapsed.","https://github.com/grame-cncm/faust/issues/681","2021-12/15","null"
"Daisy architecture file missing sample rate","https://github.com/grame-cncm/faust/issues/682","2021-12/17","null"
"[FR] Support SDRAM memory option in Daisy","https://github.com/grame-cncm/faust/issues/683","2021-12/17","null"
"FAUST 2.37.3 with LLVM 13.0.0 crashes","https://github.com/grame-cncm/faust/issues/684","2021-12/18","2021-12/19"
"Question: dynamic node (aka live coding or hot reload) systems using faust for their nodes?","https://github.com/grame-cncm/faust/issues/685","2021-12/20","null"
"CSharp backend generating invalid code for ""IsInfinity""","https://github.com/grame-cncm/faust/issues/686","2021-12/31","2022-1/1"
"GetInputRate and GetOutputRate need to be removed from CSharp interface","https://github.com/grame-cncm/faust/issues/687","2021-12/31","2022-1/1"
"Android Oboe architecture stops when head phone is plugged in","https://github.com/grame-cncm/faust/issues/691","2022-1/3","2022-1/4"
"make interp fails","https://github.com/grame-cncm/faust/issues/693","2022-1/7","2022-1/7"
"DSP on the Teensy with Faust not working when FaustZita object connected","https://github.com/grame-cncm/faust/issues/694","2022-1/11","null"
"Setting voice params in faust2api DSP engine works counter intuitive ","https://github.com/grame-cncm/faust/issues/695","2022-1/14","2022-1/23"
"Proposal - expand console.h to accept a list of control-rate values instead of a single value","https://github.com/grame-cncm/faust/issues/698","2022-1/27","2022-1/29"
"Want to silence an error when loading soundfile","https://github.com/grame-cncm/faust/issues/699","2022-1/28","null"
"faust2sc.py does not remove whitespace from parameters","https://github.com/grame-cncm/faust/issues/702","2022-2/1","2022-2/1"
"webaudio wasm processor ReferenceError can't find variable Faustxxxx","https://github.com/grame-cncm/faust/issues/706","2022-2/11","null"
"Docs to add new driver support","https://github.com/grame-cncm/faust/issues/710","2022-2/20","2022-2/28"
"Missing Documentation for enable/control primitive","https://github.com/grame-cncm/faust/issues/714","2022-3/1","2022-3/1"
"MIDI “key” parameter not working","https://github.com/grame-cncm/faust/issues/715","2022-3/11","2022-3/12"
"[wasm] Appetite for adding alternate faust-to-wasm via c++ and the wasi-sdk?","https://github.com/grame-cncm/faust/issues/717","2022-3/14","2022-3/18"
"-soundfile and -double do no work correctly in a lot of faust2xx tools","https://github.com/grame-cncm/faust/issues/718","2022-3/18","null"
"faust2sc.py does not support groups","https://github.com/grame-cncm/faust/issues/722","2022-4/6","null"
"generator/description.cpp:132: possible use of wrong operator ?","https://github.com/grame-cncm/faust/issues/723","2022-4/8","2022-4/21"
"Surprising effects of vgroup/hgroup on how controls and parameters work","https://github.com/grame-cncm/faust/issues/725","2022-4/13","2022-4/23"
"Faust2alqt execution error report","https://github.com/grame-cncm/faust/issues/726","2022-4/15","2022-4/15"
"faust2faustvst / arm64 compilation fail","https://github.com/grame-cncm/faust/issues/727","2022-4/17","2022-4/21"
"Missing Parenthesis in D backend","https://github.com/grame-cncm/faust/issues/729","2022-4/18","2022-4/18"
"feature request: additional metadata support for lv2 architecture (tooltip as comment, logarithimic/enumeration port props)","https://github.com/grame-cncm/faust/issues/730","2022-4/22","2022-4/22"
"Proper API export using -fvisibility=hidden","https://github.com/grame-cncm/faust/issues/732","2022-4/24","2022-6/8"
"Incorrect interval computation ","https://github.com/grame-cncm/faust/issues/733","2022-4/25","null"
"Headless plugins / output parameters handling / OSC","https://github.com/grame-cncm/faust/issues/735","2022-5/4","null"
"'to_string' is not a member of 'std' when building for teensy","https://github.com/grame-cncm/faust/issues/736","2022-5/6","2022-5/6"
"Recursively defined tables generating incorrect code ","https://github.com/grame-cncm/faust/issues/737","2022-5/17","null"
"faust2sc.py TemporaryDirectory Error","https://github.com/grame-cncm/faust/issues/739","2022-5/22","null"
"pitchShift does not seem to work on macOS with -double","https://github.com/grame-cncm/faust/issues/740","2022-6/2","2022-6/3"
"Exported VST/VSTi crashes FL Studio 20 on Win 10 64","https://github.com/grame-cncm/faust/issues/743","2022-6/10","2022-6/17"
"faust-ide export to vcvrack does not appear to work on Big Sur","https://github.com/grame-cncm/faust/issues/744","2022-6/20","2022-6/21"
"Feature request: Add Raspberry RP2040 support","https://github.com/grame-cncm/faust/issues/747","2022-6/25","null"
"faust2sc.py: Path not properly escaped on macos","https://github.com/grame-cncm/faust/issues/752","2022-6/28","null"
"@grame/libfaust: Faust variable is not exported from FaustLibrary.js","https://github.com/grame-cncm/faust/issues/753","2022-6/29","null"
"@grame/libfaust: Embind found a leaked C++ instance vector<int> - memory leak?","https://github.com/grame-cncm/faust/issues/754","2022-6/29","null"
"Using os.oscsin at higher frequencies produces a triangular wave instead of a sine wave","https://github.com/grame-cncm/faust/issues/755","2022-6/29","null"
"@grame/libfaust: .compileNode() doesn't return details about syntax errors","https://github.com/grame-cncm/faust/issues/756","2022-6/29","null"
"If style:radio is specified, the display will be corrupted in the Web IDE.","https://github.com/grame-cncm/faust/issues/758","2022-7/2","null"
"faust2atomsnippets usage documentation","https://github.com/grame-cncm/faust/issues/760","2022-7/20","2022-7/22"
"faust2minimal underlinking","https://github.com/grame-cncm/faust/issues/761","2022-7/20","2022-7/22"
"faust2au: uses POSIX shell but includes bash-scripts","https://github.com/grame-cncm/faust/issues/762","2022-7/20","2022-7/22"
"faust2cagtk claims it's Linux","https://github.com/grame-cncm/faust/issues/763","2022-7/20","2022-7/22"
"faust2cpalrust fails","https://github.com/grame-cncm/faust/issues/765","2022-7/20","2022-7/22"
"pthread underlinking of libOSCFaust.so and libfaustmachine.so","https://github.com/grame-cncm/faust/issues/766","2022-7/21","2022-7/22"
"faust2raqt fails to build (cannot find rtaudio headers)","https://github.com/grame-cncm/faust/issues/767","2022-7/21","2022-7/22"
"missing namespace for `cerr`","https://github.com/grame-cncm/faust/issues/768","2022-7/21","2022-7/22"
"'numeric_limits' undeclared due to missing inclusion of <limits>","https://github.com/grame-cncm/faust/issues/769","2022-7/21","2022-7/22"
"faust2ros hangs with faust-2.41.1","https://github.com/grame-cncm/faust/issues/770","2022-7/21","null"
"faust2audiokit does not work","https://github.com/grame-cncm/faust/issues/772","2022-7/26","null"
"Looking for a 'stretch' function","https://github.com/grame-cncm/faust/issues/773","2022-7/28","2022-7/28"
"'cstdint' file not found [faust2ios]","https://github.com/grame-cncm/faust/issues/774","2022-7/29","null"
"Demo colored_noise broken","https://github.com/grame-cncm/faust/issues/777","2022-8/4","2022-8/5"
"Issue with faust2sndfile","https://github.com/grame-cncm/faust/issues/779","2022-8/7","null"
"feature request: allow to explicitly enable foreign functions with LLVM","https://github.com/grame-cncm/faust/issues/783","2022-8/17","2022-8/18"
"attach'ed hbargraph is removed if first bus gets terminated","https://github.com/grame-cncm/faust/issues/785","2022-8/19","null"
"FIR gives NaNs","https://github.com/grame-cncm/faust/issues/786","2022-8/22","null"
"explicit variable-name separator required","https://github.com/grame-cncm/faust/issues/787","2022-8/22","2022-8/24"
"Wrong FAUSTFLOAT in UI ?","https://github.com/grame-cncm/faust/issues/788","2022-8/22","null"
"Faust2AndroidUnity wrong path","https://github.com/grame-cncm/faust/issues/789","2022-8/24","null"
"FaustSawtooth example compilation error: narrowing convertion","https://github.com/grame-cncm/faust/issues/791","2022-8/25","2022-8/25"
