['closedAt'],['createdAt'],['title'],['url']
,2020-8/18,"Multiple ""closing duplicate stream"" entries in liquibase log (level=FINE).",https://github.com/liquibase/liquibase/issues/1328
,2020-8/18,Provide an API to be able to serialize comments in changelog files,https://github.com/liquibase/liquibase/issues/1329
2022-8/22,2020-8/18,setColumnRemarks incorrectly changes the table comment on MariaDB,https://github.com/liquibase/liquibase/issues/1330
,2020-8/18,Cannot Use includeAll with changeLogDirectory,https://github.com/liquibase/liquibase/issues/1331
2022-9/6,2020-8/19,changeSetId & changeSetAuthor tags are not getting recognized by liquibase in rollback while using liquibase formatted sql.,https://github.com/liquibase/liquibase/issues/1335
,2020-8/21,DATABASECHANGELOGLOCK table cannot be created on Derby 10.5,https://github.com/liquibase/liquibase/issues/1338
,2020-8/21,Extraneous Output from liquibase-maven-plugin:4.0.0,https://github.com/liquibase/liquibase/issues/1339
2022-5/23,2020-8/24,Spacing after column in dynamic sql acts a junk character,https://github.com/liquibase/liquibase/issues/1340
,2020-8/24,Liquibase stopped working after upgrading from 3.6.3 to 3.8.7/3.10.2,https://github.com/liquibase/liquibase/issues/1341
2022-9/6,2020-8/25,Liquibase 4.0.0 does not log the SQL-Error in case of an erroneous change set,https://github.com/liquibase/liquibase/issues/1343
2022-8/15,2020-8/25,Liquibase 4.0.0 liquibase.exception. There is a problem with the Cyrillic,https://github.com/liquibase/liquibase/issues/1344
2020-8/31,2020-8/25,Postgres connection string not printed if connection fails because database does not exist,https://github.com/liquibase/liquibase/issues/1345
2020-8/27,2020-8/25,Liquibase does not enforce case (lowercase) when running changeset,https://github.com/liquibase/liquibase/issues/1347
2021-8/5,2020-8/27,Wrong path in case of relativeToChangelogFile = true and databaseChangeLog has logicalFilePath != PhisicalFilePath,https://github.com/liquibase/liquibase/issues/1353
2021-8/31,2020-8/27,NPE triggered by liquibase.Scope.getLog,https://github.com/liquibase/liquibase/issues/1354
,2020-8/28,Allow UUID ARRAY column,https://github.com/liquibase/liquibase/issues/1356
2021-8/31,2020-8/28,Allow bit column in postgresql ,https://github.com/liquibase/liquibase/issues/1357
,2020-8/28,"Rename ""DATICAL_SPERRORLOG"" table to ""LIQUIBASE__SPERRORLOG"" when running Liquibase Pro with SQL Plus",https://github.com/liquibase/liquibase/issues/1358
,2020-8/29,Unexpected error running Liquibase: Backup Server: 4.172.1.4: The value of 'allocated pages threshold' has been set to 40%.,https://github.com/liquibase/liquibase/issues/1359
,2020-8/30,Incorrect parsing of time values in csv files,https://github.com/liquibase/liquibase/issues/1360
,2020-9/1,CreateProcedure Script with sql file failing on db2 ,https://github.com/liquibase/liquibase/issues/1363
2021-4/5,2020-9/1,DateTimeType.java:38 NullPointerException (liquibase 4.0.0),https://github.com/liquibase/liquibase/issues/1366
2020-9/11,2020-9/1,MacOS: Liquibase installer can't be opened because Apple cannot check it for malicious software.,https://github.com/liquibase/liquibase/issues/1368
2020-9/3,2020-9/2,liquibase-maven-plugin : blob/clob missing size when changelog generated from JPA,https://github.com/liquibase/liquibase/issues/1373
,2020-9/2,NullPointerException in LoadDataChange,https://github.com/liquibase/liquibase/issues/1374
,2020-9/2,Liquibase 4.0.0 core - DB2 error - SQLCODE=-542,https://github.com/liquibase/liquibase/issues/1375
2020-11/3,2020-9/4,executeCommand changeSet fails on >=3.10.1,https://github.com/liquibase/liquibase/issues/1378
,2020-9/4,Liquibase should notify if ChangeLog has an out-of-date XSD reference,https://github.com/liquibase/liquibase/issues/1381
,2020-9/5,YAML changelogs with many references cannot be parsed with snakeyaml 1.26,https://github.com/liquibase/liquibase/issues/1382
,2020-9/7,addPrimaryKey / addUniqueConstraint could support forIndexName on PostgreSQL,https://github.com/liquibase/liquibase/issues/1384
2022-5/23,2020-9/9,.sql format changelog only executes the first changeset on sqlite database,https://github.com/liquibase/liquibase/issues/1387
,2020-9/9,Running update that adds a view on Oracle fails with a ORA-00933,https://github.com/liquibase/liquibase/issues/1388
2020-11/4,2020-9/9,"Precondition onFail=""WARN"" doesn't work properly",https://github.com/liquibase/liquibase/issues/1389
,2020-9/10,[PostgreSQL 12] SQL Gen for SERIAL and BIGSERIAL is wrong,https://github.com/liquibase/liquibase/issues/1393
2021-10/7,2020-9/10,CURRENT_TIMESTAMP/NOW functions loose precision arguments on MySql ,https://github.com/liquibase/liquibase/issues/1395
2022-8/16,2020-9/11,"Precision INT,BigInt in mysql",https://github.com/liquibase/liquibase/issues/1398
,2020-9/14,[FR] Allow for JDBC driver downloads from Maven Central,https://github.com/liquibase/liquibase/issues/1401
2020-11/17,2020-9/15,ConcurrentModificationExecption when updating multiple schema's in parallel,https://github.com/liquibase/liquibase/issues/1402
2021-7/29,2020-9/17,DropAll doesn't work anymore on DB2 for i,https://github.com/liquibase/liquibase/issues/1411
2021-2/23,2020-9/18,liquibase.sqlplus.path line in liquibase/examples/xml/liquibase.sqlplus.conf should be commented out,https://github.com/liquibase/liquibase/issues/1416
,2020-9/21,sql formatted changesets with preconditions and rollbacks outside the comments,https://github.com/liquibase/liquibase/issues/1420
2020-9/25,2020-9/23,IncludeAll documentation mysterious,https://github.com/liquibase/liquibase/issues/1426
2020-9/25,2020-9/23,Can I config my liquibase.properties with envionment variables,https://github.com/liquibase/liquibase/issues/1428
2021-7/14,2020-9/23,createSequence for PostgreSQL <10 doesn't work because [AS] syntax is not supported,https://github.com/liquibase/liquibase/issues/1429
,2020-9/25,Status does not throw an error if 2 or more IDENTICAL changeSets exist in the same changeLog,https://github.com/liquibase/liquibase/issues/1432
2021-2/26,2020-9/28,includeAll not working with Liquibase 4.0.0,https://github.com/liquibase/liquibase/issues/1436
2020-11/3,2020-9/29,"XML Export adds ',xxx' instead of ','",https://github.com/liquibase/liquibase/issues/1438
,2020-9/30,Schema/Catalog should be quoted if it is a reserved word,https://github.com/liquibase/liquibase/issues/1439
2020-10/1,2020-9/30,Liquibase Maven plugin configuration does not work inside execution declaration,https://github.com/liquibase/liquibase/issues/1442
,2020-9/30,IncludeAll missing important things when executing with jdbc,https://github.com/liquibase/liquibase/issues/1444
2021-10/29,2020-10/1,There is encoding problem with latest 4.x.x liquibase,https://github.com/liquibase/liquibase/issues/1445
2020-10/1,2020-10/1,Batch mode for Postgres fails integration tests,https://github.com/liquibase/liquibase/issues/1446
2021-5/21,2020-10/2,Too many open file on spring application start,https://github.com/liquibase/liquibase/issues/1449
,2020-10/2,liquibase dropAll error drop pg_stat_statements,https://github.com/liquibase/liquibase/issues/1451
2020-12/18,2020-10/5,'afterColumn' and 'position' not working in Firebird and Oracle databases,https://github.com/liquibase/liquibase/issues/1452
,2020-10/5,Improve LockService functionality and flexibility,https://github.com/liquibase/liquibase/issues/1453
2020-10/6,2020-10/6,[PostgreSQL] Support ENUM object ,https://github.com/liquibase/liquibase/issues/1454
2022-8/11,2020-10/7,ExecutorService is not threadsafe - getExecutor can be called concurrently,https://github.com/liquibase/liquibase/issues/1455
2020-10/7,2020-10/7,Liquibase 4.x.x endDelimiter doesn't work,https://github.com/liquibase/liquibase/issues/1458
2020-11/11,2020-10/7,`preConditions` not working when using addDefaultValue,https://github.com/liquibase/liquibase/issues/1459
,2020-10/8,ColumnSnapshotGeneratorInformix.readDataType() wrongly sets colLength value with column size (for informix DATETIME datatype),https://github.com/liquibase/liquibase/issues/1462
,2020-10/8,Add the unexpectedChangeSets command with the Liquibase Maven Plugin,https://github.com/liquibase/liquibase/issues/1464
,2020-10/9,Add ignore:true changeset attribute to Formatted SQL changeLogs,https://github.com/liquibase/liquibase/issues/1466
,2020-10/12,Provide R2DBC-based Executor,https://github.com/liquibase/liquibase/issues/1470
,2020-10/12,Make liquibase.liquibase.clearCheckSums extendable,https://github.com/liquibase/liquibase/issues/1472
2020-11/3,2020-10/14,Consider alternative location for banner.txt,https://github.com/liquibase/liquibase/issues/1476
2020-11/24,2020-10/14,Liquibase 3.10+/4.1+ missing UniqueConstraints in snapshot,https://github.com/liquibase/liquibase/issues/1477
,2020-10/14,indexExists Preconditions fall back to the user's defaultSchema instead of given schema name,https://github.com/liquibase/liquibase/issues/1478
2021-12/3,2020-10/15,PostgreSQL 12 Support,https://github.com/liquibase/liquibase/issues/1482
2021-4/22,2020-10/16,Error handling long Postgres table names,https://github.com/liquibase/liquibase/issues/1483
2021-8/5,2020-10/17,[WARNING] Cannot create filesystem for url target/test-classes,https://github.com/liquibase/liquibase/issues/1486
2020-10/19,2020-10/18,www.liquibase.org Domain has expired,https://github.com/liquibase/liquibase/issues/1488
2020-11/3,2020-10/18,loadUpdateData broken for clob/text fields in 3.10.3,https://github.com/liquibase/liquibase/issues/1489
,2020-10/18,CreateIndexGeneratorFirebird generates invalid SQL on computed field,https://github.com/liquibase/liquibase/issues/1490
2021-10/26,2020-10/19,"Auto rollback doesn't work for change type ""addNotNullConstraint"" with named constraints [Oracle 19]",https://github.com/liquibase/liquibase/issues/1492
,2020-10/19,[MySQL] TIMESTAMP(x) is not being snapshotted well enough,https://github.com/liquibase/liquibase/issues/1494
,2020-10/22,DB is left in an inconsitent state after connection to database is lost,https://github.com/liquibase/liquibase/issues/1498
2022-9/6,2020-10/22,Issues with the logger cast,https://github.com/liquibase/liquibase/issues/1499
,2020-10/22,Custom SQL executed not showing up in 4.x versions of Liquibase with the INFO verbosity level,https://github.com/liquibase/liquibase/issues/1501
2021-7/14,2020-10/25,Does liquibase java 11 support(with module-info.java),https://github.com/liquibase/liquibase/issues/1505
2021-8/5,2020-10/26,Regression: StackOverflowError processing large Postgres SQL changeset,https://github.com/liquibase/liquibase/issues/1507
2020-11/10,2020-10/27,MySql 8.0 requires create and drop of temporary tables to run generateChangeLog,https://github.com/liquibase/liquibase/issues/1510
,2020-10/28,Oracle temporary table on generateChangeLog is created as normal table,https://github.com/liquibase/liquibase/issues/1516
2022-8/22,2020-10/29,"'""validateForeignKey "" contains extra space' bug still present in XSD 4.1 and at XSD URIs",https://github.com/liquibase/liquibase/issues/1517
,2020-11/2,logFile doesn't have any logging content when used with 4.1.1,https://github.com/liquibase/liquibase/issues/1521
2020-11/5,2020-11/2,"Fix xsd, remove surplus space after validateForeignKey (4.1.xsd / 4.2.xsd)",https://github.com/liquibase/liquibase/issues/1523
2020-11/6,2020-11/3,Incorrect documentation link in the getting started guide for changelog files,https://github.com/liquibase/liquibase/issues/1526
2021-10/7,2020-11/3,computeMD5 with special characters has 2 different outputs,https://github.com/liquibase/liquibase/issues/1527
2021-6/9,2020-11/5,"liquibase-maven-plugin propertyFile YAML bug loading wrong username from application*.yml depending on order (Maven, Spring)",https://github.com/liquibase/liquibase/issues/1529
,2020-11/13,updateTestingRollback behaviour is different from doc,https://github.com/liquibase/liquibase/issues/1535
2020-11/17,2020-11/14,CockroachDatabase.isCorrectDatabaseImplementation has to check whether it is JdbcConnection otherwise fails with cast exception,https://github.com/liquibase/liquibase/issues/1536
,2020-11/14,"Encapsulate getTag, buildFullContext logic in changeSet so it can be reused in extensions",https://github.com/liquibase/liquibase/issues/1537
,2020-11/16,Liquibase key pair authentication error,https://github.com/liquibase/liquibase/issues/1539
2022-5/31,2020-11/16,Spring Resource Accessor can't access change logs not from a classpath.,https://github.com/liquibase/liquibase/issues/1540
,2020-11/17,Use ChangeLogHistoryService.clearAllCheckSums implementations in Liquibase.clearCheckSums instead of direct UpdateStatement call,https://github.com/liquibase/liquibase/issues/1543
,2020-11/18,"LBPro ERROR: ""Unable to drop DATICAL_SPERRORLOG table"" after SQL Plus changeset failure",https://github.com/liquibase/liquibase/issues/1546
2020-11/18,2020-11/18,5 unique constraint limit,https://github.com/liquibase/liquibase/issues/1547
,2020-11/19,RowCountPrecondition fails on tables containing more than Integer.MAX_VALUE rows,https://github.com/liquibase/liquibase/issues/1549
,2020-11/19,DiffChangeLog command is never stops with big Oracle table (8000 tables and a lot of FK),https://github.com/liquibase/liquibase/issues/1550
,2020-11/19,loadData fails to insert data when usePreparedStatements=true,https://github.com/liquibase/liquibase/issues/1551
,2020-11/20,Support for GraalVM native images,https://github.com/liquibase/liquibase/issues/1552
2022-7/28,2020-11/20,Do not split SQL on delimiters within BEGIN/END blocks,https://github.com/liquibase/liquibase/issues/1553
2020-11/23,2020-11/23,CockroachDatabase NullPointerException when using Hibernate database,https://github.com/liquibase/liquibase/issues/1554
,2020-11/23,Log Warnings due to FileSystemNotFoundException,https://github.com/liquibase/liquibase/issues/1555
2022-6/17,2020-11/26,Add option/envvar to disable banner,https://github.com/liquibase/liquibase/issues/1561
2021-7/29,2020-11/27,Invalid update SQL generated for HSQL database in InsertOrUpdateGeneratorHsql.java,https://github.com/liquibase/liquibase/issues/1562
2022-5/23,2020-11/30,add lifecycle support,https://github.com/liquibase/liquibase/issues/1564
,2020-12/1,No validation errors when <property> definitions wrong,https://github.com/liquibase/liquibase/issues/1566
2020-12/7,2020-12/2,Contents of migration file aren't getting executed,https://github.com/liquibase/liquibase/issues/1567
2021-12/7,2020-12/2,Inconsistent synchronization causes sporadic NPEs,https://github.com/liquibase/liquibase/issues/1568
,2020-12/2,[Feature idea] provide default properties for data types for the current DBMS ,https://github.com/liquibase/liquibase/issues/1569
2021-12/7,2020-12/3,XML tag <createSequence ...> produces invalid SQL for H2 database,https://github.com/liquibase/liquibase/issues/1570
,2020-12/4,"dropAllForeignKeyConstraints performance/errors in liquibase 3.10.3, works perfect in liquibase 3.4.2",https://github.com/liquibase/liquibase/issues/1571
2020-12/4,2020-12/4,java.lang.StringIndexOutOfBoundsException: String index out of range,https://github.com/liquibase/liquibase/issues/1573
2021-9/10,2020-12/7,LB v4.2.0 - Variables are NOT substituted when using nested properties deeper than level 1 in another property definition with YAML,https://github.com/liquibase/liquibase/issues/1574
2020-12/9,2020-12/8,mvn liquibase:diff throws NPE,https://github.com/liquibase/liquibase/issues/1576
,2020-12/9,Fix XML example and documentation for onFail preconditions,https://github.com/liquibase/liquibase/issues/1578
,2020-12/9,ChangeLogHistoryService upgradeChecksums doesnt work as it appears to be intended,https://github.com/liquibase/liquibase/issues/1579
,2020-12/10,LoadUpdateData doesn't update blob from csv data file,https://github.com/liquibase/liquibase/issues/1581
2020-12/11,2020-12/10,NullPointerException - referenceUrl=hibernate:spring (mvn liquibase:diff),https://github.com/liquibase/liquibase/issues/1583
,2020-12/11,Race condition and possible lock bypass if two nodes run on clean schema,https://github.com/liquibase/liquibase/issues/1584
2022-8/12,2020-12/11,"Maven Plugin Displays ""[project, pluginDescriptor]""",https://github.com/liquibase/liquibase/issues/1585
,2020-12/11,Liquibase Maven Plugin throws an error with a diff goal requiring a changelogFile referenced,https://github.com/liquibase/liquibase/issues/1586
,2020-12/15,Postgres 11.10 Liquibase Initialization databasechangeloglock Race Condition,https://github.com/liquibase/liquibase/issues/1588
2021-7/29,2020-12/16,"No validation errors when customChange param has no ""name"" attribute",https://github.com/liquibase/liquibase/issues/1591
,2020-12/16,Add documentation on how to register a changelog from the liquibase docker images,https://github.com/liquibase/liquibase/issues/1594
2021-2/26,2020-12/17,"since refacoring of ClassLoaderResourceAccessor in 4..0.0-beta2, searchPath ""classpath*:"" is not handled anymore correctly",https://github.com/liquibase/liquibase/issues/1595
2021-10/26,2020-12/18,Liquibase does not honor deferrable and initially deferred on Primary Key,https://github.com/liquibase/liquibase/issues/1597
2021-11/15,2020-12/18,Extra backslash added in the column values in the genarated sql,https://github.com/liquibase/liquibase/issues/1598
2021-1/6,2020-12/21,spring-boot-autoconfigure-2.1.17.RELEASE Cannot resolve classpath,https://github.com/liquibase/liquibase/issues/1599
2021-8/5,2020-12/22,CLI doesn't work with Spring Boot Classloader on Windows,https://github.com/liquibase/liquibase/issues/1600
,2020-12/23,Derby CLOB: generate Changelog with diffType data: excpetion,https://github.com/liquibase/liquibase/issues/1601
,2020-12/24,Filename + Id + Author is not being treated as unique in ValidatingVisitor.findChangeSet  method,https://github.com/liquibase/liquibase/issues/1603
2022-2/14,2020-12/28,"Underscore in schemaName causes error relation ""databasechangelog"" already exists",https://github.com/liquibase/liquibase/issues/1604
,2020-12/29,Liquibase rollback by tag can work unexpectedly when more than one changelog files are used,https://github.com/liquibase/liquibase/issues/1605
2021-1/6,2020-12/30,Owasp-Dependency-Checker list finding CVE-2017-18640 for snakeyaml-1.2.4,https://github.com/liquibase/liquibase/issues/1608
2022-8/5,2020-12/30,CORE-3198 Regression - prefer internal XSD usage,https://github.com/liquibase/liquibase/issues/1609
,2020-12/30,diffChangelog command is not respecting the changeSetAuthor option,https://github.com/liquibase/liquibase/issues/1610
,2021-1/4,BatchInsert is translated wrongly for Oracle custom changes,https://github.com/liquibase/liquibase/issues/1613
,2021-1/4,Addition of liquibase.update(),https://github.com/liquibase/liquibase/issues/1614
,2021-1/4,API inconsistency - Liquibase creation file vs. DatabaseChangeLog,https://github.com/liquibase/liquibase/issues/1615
,2021-1/4,Liquibase API simplification,https://github.com/liquibase/liquibase/issues/1616
2021-1/6,2021-1/5,Outdated snakeyaml version in documentation,https://github.com/liquibase/liquibase/issues/1618
2021-1/12,2021-1/7,Usage of endDelimiter in scripts now require spacing,https://github.com/liquibase/liquibase/issues/1623
2021-11/15,2021-1/11,preConditions onSqlOutput TEST configuration does not work for nested changelogs,https://github.com/liquibase/liquibase/issues/1624
2021-11/15,2021-1/13,indexExists precondition not working for function index in MySQL 8,https://github.com/liquibase/liquibase/issues/1626
2021-10/29,2021-1/13,spring.liquibase.tag property not being honored,https://github.com/liquibase/liquibase/issues/1627
2021-12/21,2021-1/14,dropPrimaryKey's dropIndex attribute is missing from the xsd,https://github.com/liquibase/liquibase/issues/1628
,2021-1/15,"Liquibase CLI ""validation"" command returns success status on a validation errors",https://github.com/liquibase/liquibase/issues/1630
2021-4/5,2021-1/15,java.lang.NullPointerException during DIFF operation,https://github.com/liquibase/liquibase/issues/1631
,2021-1/18,setColumnRemarks Mysql  execute sql : ALTER TABLE [tabeName]  COMMENT = 'your comment';,https://github.com/liquibase/liquibase/issues/1632
2021-1/20,2021-1/18,addColumn remarks change table remarks  mysql,https://github.com/liquibase/liquibase/issues/1633
2022-5/23,2021-1/18,modifyDataType set remarks null mysql,https://github.com/liquibase/liquibase/issues/1634
,2021-1/18,Error reading changelog files from classpath,https://github.com/liquibase/liquibase/issues/1635
,2021-1/18,Liquibase potentially not applying changesets in order,https://github.com/liquibase/liquibase/issues/1636
,2021-1/19,Wrong checksum validation for included sql changelog,https://github.com/liquibase/liquibase/issues/1637
2021-2/11,2021-1/20,ClassCastException on moving to mysql-connector-java version 8.0.23,https://github.com/liquibase/liquibase/issues/1639
,2021-1/20,Liquibase failed when hyphen char in schema name,https://github.com/liquibase/liquibase/issues/1640
2021-1/20,2021-1/20,Add deprecated LogFactory.getInstance() to smooth upgrade to 4.x,https://github.com/liquibase/liquibase/issues/1641
,2021-1/21,Parameter in script is replaced with environment variable instead of configured parameter,https://github.com/liquibase/liquibase/issues/1644
,2021-1/21,changeset checksum different with and without liquibase-percona (liquibase 3.10.3),https://github.com/liquibase/liquibase/issues/1646
2021-1/31,2021-1/22,Bad cast in StandardChangeLogHistoryService.getRanChangeSets(),https://github.com/liquibase/liquibase/issues/1647
2021-2/9,2021-1/26,ChangeExecListener-API cannot be used due to HubChangeExecListener,https://github.com/liquibase/liquibase/issues/1651
2022-8/22,2021-1/26,Liquibase Diff/Changelog generating unique constraints that have columns repeated multiple times,https://github.com/liquibase/liquibase/issues/1654
,2021-1/27,Formatted SQL Changelogs should support global labels,https://github.com/liquibase/liquibase/issues/1656
2021-2/11,2021-1/27,Relative Path error when using the includeAll tag and Springboot,https://github.com/liquibase/liquibase/issues/1657
,2021-1/28,Update (or any other command) with label also include changelogs without labels.,https://github.com/liquibase/liquibase/issues/1660
2022-1/26,2021-2/1,futureRollbackSQL command throws an unexpected command parameter.,https://github.com/liquibase/liquibase/issues/1662
2022-3/9,2021-2/1,futureRollbackFromTagSQL command is unrecognized.,https://github.com/liquibase/liquibase/issues/1663
,2021-2/5,read configuration file variables,https://github.com/liquibase/liquibase/issues/1666
,2021-2/5,Insert UUID from CSV into Oracle,https://github.com/liquibase/liquibase/issues/1667
2022-8/15,2021-2/6,sqlFile ignores encoding parameter,https://github.com/liquibase/liquibase/issues/1670
2021-11/9,2021-2/6,addColumn ignores deleteCascade,https://github.com/liquibase/liquibase/issues/1671
2022-7/6,2021-2/6,loadData inserts NULL when CSV contains function,https://github.com/liquibase/liquibase/issues/1672
,2021-2/6,ClassLoaderResourceAccessor non-functional in Maven-like SetUp,https://github.com/liquibase/liquibase/issues/1673
,2021-2/8,Executed SQL not logged in 4.x versions of Liquibase,https://github.com/liquibase/liquibase/issues/1674
,2021-2/8,Liquibase doesn't validate bad formatted SQL changesets,https://github.com/liquibase/liquibase/issues/1675
,2021-2/8,Increase minimum java version from 8 to 11,https://github.com/liquibase/liquibase/issues/1677
,2021-2/9,Command fails if this is the first time running updateSQL,https://github.com/liquibase/liquibase/issues/1678
,2021-2/10,-D command line option doesn't override parameters in properties file,https://github.com/liquibase/liquibase/issues/1680
2022-8/11,2021-2/10,Checksums change between 2 liquibase versions: moving from 3.6.3 to 3.8.9,https://github.com/liquibase/liquibase/issues/1681
2021-2/12,2021-2/10,Liquibase 4.3.0 throws NullPointerExceptions without snakeyaml in the classpath,https://github.com/liquibase/liquibase/issues/1682
,2021-2/11, issues with postgres 12,https://github.com/liquibase/liquibase/issues/1683
,2021-2/11,Require JSON library in Liquibase,https://github.com/liquibase/liquibase/issues/1684
,2021-2/11,loadData - NullPointerException when type not provided and column name invalid,https://github.com/liquibase/liquibase/issues/1687
2021-3/11,2021-2/12,Default ConsoleUIService.allowPrompt to false,https://github.com/liquibase/liquibase/issues/1689
2021-3/24,2021-2/12,"Answering prompt auto-registration for liquibase-base with ""N"" leads to CommandExecutionException",https://github.com/liquibase/liquibase/issues/1690
2021-4/22,2021-2/12,Refactor LiquibaseConfiguration API,https://github.com/liquibase/liquibase/issues/1691
2021-3/9,2021-2/12,Support setting LiquibaseConfiguration values with environment variables,https://github.com/liquibase/liquibase/issues/1693
,2021-2/12,Add ability to have cascading liquibase.properties files,https://github.com/liquibase/liquibase/issues/1694
,2021-2/14,"Adding a non-nullable column to existing table fails. The ""value"" attribute is ignored.",https://github.com/liquibase/liquibase/issues/1695
2021-2/15,2021-2/15,IncludeAll does not work for Java 9+,https://github.com/liquibase/liquibase/issues/1696
,2021-2/15,Add support for Indexes with Included Columns,https://github.com/liquibase/liquibase/issues/1697
2021-6/24,2021-2/15,loaddata is slow when csv file doesn't specify type,https://github.com/liquibase/liquibase/issues/1699
,2021-2/15,Support yaml and json formatted defaults file,https://github.com/liquibase/liquibase/issues/1700
2021-5/6,2021-2/15,Refactor LiquibaseCommand API,https://github.com/liquibase/liquibase/issues/1701
2021-6/7,2021-2/15,Replace existing CLI integration with one that dynamically leverages LiquibaseCommand classes,https://github.com/liquibase/liquibase/issues/1702
