['closedAt'],['createdAt'],['title'],['url']
,2021-2/15,Replace existing Maven integration with one that uses the LiquibaseCommand API,https://github.com/liquibase/liquibase/issues/1703
,2021-2/15,Replace existing Ant integration with one that uses the LiquibaseCommand API,https://github.com/liquibase/liquibase/issues/1704
,2021-2/15,Refactor Spring integration to use the LiquibaseCommand API ,https://github.com/liquibase/liquibase/issues/1705
,2021-2/15,Refactor Servlet integration to use the new LiquibaseCommand API,https://github.com/liquibase/liquibase/issues/1706
2022-8/10,2021-2/16,logicalFilePath is case insensitive but the update on databasechangelog is case sensitive,https://github.com/liquibase/liquibase/issues/1707
,2021-2/19,Filenames are stored differently CLI <> Maven,https://github.com/liquibase/liquibase/issues/1709
2021-2/23,2021-2/19,"NPE when replying ""N"" to report operation to Liquibase Hub",https://github.com/liquibase/liquibase/issues/1711
2022-3/10,2021-2/19,TableExistsPrecondition can't find table,https://github.com/liquibase/liquibase/issues/1712
,2021-2/23,Changeset should use ObjectQuotingStrategy from parent changelog then database if not set,https://github.com/liquibase/liquibase/issues/1714
2021-2/24,2021-2/24,Diff output does not reflect differences between 2 snapshot files,https://github.com/liquibase/liquibase/issues/1718
,2021-2/24,.tar.gz package has all files at root,https://github.com/liquibase/liquibase/issues/1719
,2021-2/25,SpringLiquibase should not resolve Classloader URLs twice,https://github.com/liquibase/liquibase/issues/1721
2021-5/25,2021-2/25,Wrong dependency order when generating diffChangeLog for addColumn --> addPrimaryKey,https://github.com/liquibase/liquibase/issues/1722
2021-4/5,2021-2/26,Failed to resolve properties file,https://github.com/liquibase/liquibase/issues/1723
,2021-2/28,setColumnRemarks fails due to missing columnDataType,https://github.com/liquibase/liquibase/issues/1726
,2021-2/28,dropindex tableName attribute is required in the XSD while it shouldn't be,https://github.com/liquibase/liquibase/issues/1727
,2021-3/1,"Run diff command on mssql output a lot of column ""defaultValueConstraintName changed"" messages",https://github.com/liquibase/liquibase/issues/1728
2021-12/7,2021-3/1,IBM DB2z Database - INFORMATION_SCHEMA.CONSTRAINTS table not found Exception,https://github.com/liquibase/liquibase/issues/1730
,2021-3/1,primaryKeyExists pre condition with table name and primary key name is malfunctioning on Oracle,https://github.com/liquibase/liquibase/issues/1731
2021-4/22,2021-3/1,Ensure backward-compatibility as part of the LiquibaseConfiguration API refactoring,https://github.com/liquibase/liquibase/issues/1732
,2021-3/2,The XSD misses the message attribute for the <stop> change,https://github.com/liquibase/liquibase/issues/1734
2021-3/5,2021-3/2,addForeignKeyConstraint documentation is inconsistent regarding SQLite,https://github.com/liquibase/liquibase/issues/1735
2021-8/31,2021-3/2,"deleteCascade=""true"" on addForeignKeyConstraint is simply ignored",https://github.com/liquibase/liquibase/issues/1736
,2021-3/2,Unused DatabaseInfoAttributes attribute group in XSD,https://github.com/liquibase/liquibase/issues/1737
,2021-3/2,liquibase 'status' implementation is flawed,https://github.com/liquibase/liquibase/issues/1739
,2021-3/3,XSD allows multiple comment tags while only the last is taken into account,https://github.com/liquibase/liquibase/issues/1740
,2021-3/3,Liquibase pollutes System.out in a Spring Boot application,https://github.com/liquibase/liquibase/issues/1741
,2021-3/3,please provide sha256sum file for the release,https://github.com/liquibase/liquibase/issues/1742
,2021-3/3,sequenceAttributes incrementBy has wrong type in XSD,https://github.com/liquibase/liquibase/issues/1743
2021-3/12,2021-3/5,ConcurrentModificationException in ExecutorService.getExecutor,https://github.com/liquibase/liquibase/issues/1748
2021-8/5,2021-3/5,liquibase.exception.LockException: java.lang.ClassCastException: java.time.LocalDateTime cannot be cast to java.util.Date,https://github.com/liquibase/liquibase/issues/1749
2022-9/1,2021-3/5,liquibase.ignoreRecycleBinWarning cannot be set in liquibase.properties,https://github.com/liquibase/liquibase/issues/1750
2021-5/6,2021-3/8,Support backwards compatibility as part of the LiquibaseCommand API refactoring,https://github.com/liquibase/liquibase/issues/1752
2021-3/24,2021-3/10,Documentation mistake - quotes in yaml for dbms,https://github.com/liquibase/liquibase/issues/1753
2021-5/21,2021-3/10,When loading changelogs LiquibaseEntityResolver slows down loading of huge changelog file structures by inefficiently processing classpath resources,https://github.com/liquibase/liquibase/issues/1754
,2021-3/10,Inconsistent changelog filename after updating to 4.3.1,https://github.com/liquibase/liquibase/issues/1755
2021-5/20,2021-3/10,Liquibase Jenkins Runner: Remove v1.4.7 from the Liquibase Runner downloads page.,https://github.com/liquibase/liquibase/issues/1757
2022-7/6,2021-3/10,Postgres - the operator ? is installed as ??,https://github.com/liquibase/liquibase/issues/1759
2021-11/2,2021-3/11,<sqlFile> change does not respect encoding attribute as mentioned in the documentation,https://github.com/liquibase/liquibase/issues/1760
,2021-3/11,Generated Oracle SQL by <loadUpdateData> change is not executable with sqlplus,https://github.com/liquibase/liquibase/issues/1761
,2021-3/11,modifyDataType does not preserve nullability on MSSQL,https://github.com/liquibase/liquibase/issues/1763
2021-8/5,2021-3/11,Postgres Functions and Question Marks,https://github.com/liquibase/liquibase/issues/1764
2021-6/2,2021-3/15,DATABASECHANGELOG.DATEEXECUTED created as datetime in MySQL 5.7 ,https://github.com/liquibase/liquibase/issues/1766
,2021-3/15,Liquibase loadUpdateData doesn't properly insert H2 column text 'scale values mean',https://github.com/liquibase/liquibase/issues/1767
2021-4/26,2021-3/18,ObjectQuotingStrategy doesn't qoute value from insert statement,https://github.com/liquibase/liquibase/issues/1769
2021-6/2,2021-3/18,Liquibase 4.3.1 logs not being output to log4j2 specified log file,https://github.com/liquibase/liquibase/issues/1770
2021-4/28,2021-3/22,Allow any CLI arguments to be used either before or after the command,https://github.com/liquibase/liquibase/issues/1773
2022-2/25,2021-3/23,SQL Generator bug. Arguments for TIME and INTERVAL datatypes.,https://github.com/liquibase/liquibase/issues/1774
,2021-3/23,Sequence create/alter does not set CacheSize for mssql,https://github.com/liquibase/liquibase/issues/1775
2021-7/26,2021-3/28,Logger API compatibility broke starting in 3.6.0,https://github.com/liquibase/liquibase/issues/1777
2021-7/16,2021-3/29,indexExists DOES NOT find index for H2-DB,https://github.com/liquibase/liquibase/issues/1778
2021-8/31,2021-3/29,PostgresDatabase should ignroe addPrimeryKey clustered false,https://github.com/liquibase/liquibase/issues/1779
,2021-3/30,Liquibase not adjusting databasechangeloglock table when incompatible,https://github.com/liquibase/liquibase/issues/1780
,2021-3/30,"Do not fail changeSet validation for fields using ""default"" values of ""unsupported"" fields.",https://github.com/liquibase/liquibase/issues/1781
2021-5/27,2021-4/3,Liquibase 4.3.1 is using MongoDB driver although the specified driver/classpath is Oracle,https://github.com/liquibase/liquibase/issues/1783
,2021-4/5,SQL Generator bug for renameView change type for SQLite,https://github.com/liquibase/liquibase/issues/1785
2022-1/5,2021-4/6,createView change type doesn't work for SQLite,https://github.com/liquibase/liquibase/issues/1786
,2021-4/6,Liquibase Database Change Log Identity is bad and should be changed.,https://github.com/liquibase/liquibase/issues/1787
2022-1/26,2021-4/7,Liquibase skips Hub auto-registration with Git Bash for Windows,https://github.com/liquibase/liquibase/issues/1789
2021-8/5,2021-4/7,Data loaded from CLOB type columns is not loaded properly into Postgres,https://github.com/liquibase/liquibase/issues/1790
,2021-4/8,Generated diffChangeLog Creates Constraint Before Creating Column Used In the Constraint,https://github.com/liquibase/liquibase/issues/1792
2022-4/13,2021-4/9,Remark attribute in PK column tag is not supported by MariaDB,https://github.com/liquibase/liquibase/issues/1793
2021-5/26,2021-4/9,setColumnRemarks for mariaDB is not supported,https://github.com/liquibase/liquibase/issues/1794
,2021-4/13,"""dbms"" attribute doesn't validate input",https://github.com/liquibase/liquibase/issues/1795
2021-6/21,2021-4/14,Release Plan for 4.4,https://github.com/liquibase/liquibase/issues/1797
2021-4/15,2021-4/14,(ignore) testing issue,https://github.com/liquibase/liquibase/issues/1799
2021-4/20,2021-4/15,DiffChangeLog/GenerateChangeLog produces invalid XML in 4.3.3,https://github.com/liquibase/liquibase/issues/1803
2022-8/22,2021-4/18,Checksum calculation affected by environment locale,https://github.com/liquibase/liquibase/issues/1806
2021-5/12,2021-4/20,Type change with renameColumn inconsistent,https://github.com/liquibase/liquibase/issues/1807
,2021-4/21,"Athena, Presto, Trino Extension",https://github.com/liquibase/liquibase/issues/1809
,2021-4/22,Table and column names are not quoted in REFERENCES statements when `constraints` are defined using `references`,https://github.com/liquibase/liquibase/issues/1810
2021-5/22,2021-4/26,Can't insert an empty blob with loadData in ORACLE ,https://github.com/liquibase/liquibase/issues/1811
,2021-4/26,Label expression using AND/OR does not work with inherited labels,https://github.com/liquibase/liquibase/issues/1813
,2021-4/26,feature request: throw error when Liquibase is run with CockroachDB with runInTransaction=true,https://github.com/liquibase/liquibase/issues/1814
2021-8/31,2021-4/28,Too many open files error on application server: LiquibaseEntityResolver opens too many file descriptors and never closes them,https://github.com/liquibase/liquibase/issues/1815
2021-11/9,2021-4/29,liquibase.lockservice.StandardLockService does not detect that parallel running thread/application has created DATABASECHANGELOGLOCK table,https://github.com/liquibase/liquibase/issues/1816
2022-5/23,2021-4/30,Bad sql generated for dropColumn changeset for MSSQL,https://github.com/liquibase/liquibase/issues/1818
,2021-5/2,Feature request - command line passwords from environment variables,https://github.com/liquibase/liquibase/issues/1819
,2021-5/3,"Warning about Hub while hubMode is ""off"" during execution of dropAll command.",https://github.com/liquibase/liquibase/issues/1820
2021-8/31,2021-5/3,PostgreSQL: cannot use an extension from the public schema without prefix (search_path is overriden by liquibase),https://github.com/liquibase/liquibase/issues/1821
2022-8/10,2021-5/4,PostgreSQL 12.4: diffChangeLog generates error for functions having paranthesis in function definition parameters,https://github.com/liquibase/liquibase/issues/1822
2021-5/25,2021-5/4,Cannot call extension function from migration,https://github.com/liquibase/liquibase/issues/1823
,2021-5/6,Only sequence name is used in generateChangeLog file for PostgreSQL,https://github.com/liquibase/liquibase/issues/1825
2021-7/26,2021-5/6,MS SQL Server statement with '\' gives error with in Liquibase,https://github.com/liquibase/liquibase/issues/1828
2021-6/30,2021-5/7,Outputted MySQL Snapshot/Generated ChangeLog contains an incorrect table key constraint when there are other tables in the database,https://github.com/liquibase/liquibase/issues/1829
,2021-5/7,ANT :: generate and diffChangeLog fail because they cannot find the default log service.,https://github.com/liquibase/liquibase/issues/1830
2021-5/13,2021-5/8,mvn liqui:diff with jpa does not follow hibernate naming strategy,https://github.com/liquibase/liquibase/issues/1832
,2021-5/10,License issue in 4.3.4 and 4.3.5 even when only using community functionality...,https://github.com/liquibase/liquibase/issues/1833
2022-5/25,2021-5/11,Derby driver class name for 10.15.X.X issue,https://github.com/liquibase/liquibase/issues/1835
,2021-5/11,"Error executing SQL SELECT MIN(locked) AS test FROM ""MYSCHEMA"".DATABASECHANGELOGLOCK FETCH FIRST ROW ONLY: DB2 SQL Error: SQLCODE=-245, SQLSTATE=428F5, SQLERRMC=MIN;1, DRIVER=4.26.14",https://github.com/liquibase/liquibase/issues/1836
2022-8/11,2021-5/12,Liquibase needs to double quote table names when generating foreign key references for Postgresql,https://github.com/liquibase/liquibase/issues/1838
2022-8/31,2021-5/13,liquibase.executor.ExecutorService getExecutorValue superfluous code,https://github.com/liquibase/liquibase/issues/1841
2022-1/26,2021-5/17,Improve error message when using the changeLogFile to reference a folder path instead of a file path,https://github.com/liquibase/liquibase/issues/1846
2022-1/26,2021-5/17,Improve error message when using the changeLogFile to reference a changelog with incorrect filename casing,https://github.com/liquibase/liquibase/issues/1847
,2021-5/17,Improve error message when using the includeAll to reference a file instead of a folder path,https://github.com/liquibase/liquibase/issues/1848
,2021-5/19,createView replaceIfExists doens't work if using replace function in view definition,https://github.com/liquibase/liquibase/issues/1849
2021-7/28,2021-5/19,"Postgres - Change functions that use ""SERIAL"" are generated as ""INTEGER GENERATED BY DEFAULT AS IDENTITY""",https://github.com/liquibase/liquibase/issues/1850
2022-5/24,2021-5/20,renameColumn not working,https://github.com/liquibase/liquibase/issues/1851
2022-6/6,2021-5/20,ChangeLog parameter unresolved for ChangeSet id in SQL Formatted ChangeLog,https://github.com/liquibase/liquibase/issues/1852
2022-7/28,2021-5/20,Optimize updates,https://github.com/liquibase/liquibase/issues/1856
2022-5/9,2021-5/21,NullPointerException inside SecureLogFilter.isLoggable,https://github.com/liquibase/liquibase/issues/1858
2022-6/21,2021-5/21,Liquibase Maven Plugin 4.3.5 - log outputs username & password with the <verbose> tag,https://github.com/liquibase/liquibase/issues/1859
2022-3/3,2021-5/24,[CockroachDB] Different behavior with CDB 21.1 than 20.2,https://github.com/liquibase/liquibase/issues/1862
2022-6/20,2021-5/25,DropPrimaryKey doesn't work on Oracle,https://github.com/liquibase/liquibase/issues/1863
2022-5/23,2021-5/25,HubUpdater releases lock even though registration is skipped,https://github.com/liquibase/liquibase/issues/1865
2021-6/23,2021-5/25,Obsolete javax.xml.bind:jaxb-api dependency,https://github.com/liquibase/liquibase/issues/1866
,2021-5/26,Can we have feature to validate syntax of sql files in liquibase?,https://github.com/liquibase/liquibase/issues/1867
,2021-5/26,"Expand ""strict"" mode functionality",https://github.com/liquibase/liquibase/issues/1870
,2021-5/26,"Remove ""By Datical"" terminology",https://github.com/liquibase/liquibase/issues/1871
2021-8/5,2021-5/27,Liquibase fails to apply change sets into firebird3 database,https://github.com/liquibase/liquibase/issues/1872
,2021-5/27,Add close() method to ResourceAccessor,https://github.com/liquibase/liquibase/issues/1873
2022-8/26,2021-5/27,Postgres diff doesn't include partitions?,https://github.com/liquibase/liquibase/issues/1874
2021-6/15,2021-6/1,Maven updateTestingRollback delete tags,https://github.com/liquibase/liquibase/issues/1876
2022-8/31,2021-6/2,Oracle - UpdateToTagSQL - Issue with delimeters,https://github.com/liquibase/liquibase/issues/1879
,2021-6/3,Add uniqueConstraintExists precondition,https://github.com/liquibase/liquibase/issues/1881
2021-6/9,2021-6/3,Noninteger Database Minor Version Numbers Not Allowed,https://github.com/liquibase/liquibase/issues/1884
,2021-6/4,Postgre SQL generator bug for  intervals for PostgreSQL,https://github.com/liquibase/liquibase/issues/1886
,2021-6/7,Precondition Processing Does not Seem to Work as Documented,https://github.com/liquibase/liquibase/issues/1889
2021-8/31,2021-6/7,CLI no longer reading defaultsFile from classpath,https://github.com/liquibase/liquibase/issues/1892
2021-11/9,2021-6/9,addColumn breaks existing foreign keys,https://github.com/liquibase/liquibase/issues/1896
2021-6/30,2021-6/9,YAML changelog includeAll does not respect errorIfMissingorEmpty default false value,https://github.com/liquibase/liquibase/issues/1897
,2021-6/9,Support yaml formatted defaults file,https://github.com/liquibase/liquibase/issues/1898
,2021-6/10,sql server column names: unable to disable quotes / incorrect quoting,https://github.com/liquibase/liquibase/issues/1900
,2021-6/10,"Precondition interface does not support ""priority""",https://github.com/liquibase/liquibase/issues/1902
2021-6/29,2021-6/10,liquibase fails for change-sets that worked earlier after upgrading from version 3.6.3 to 3.8.9,https://github.com/liquibase/liquibase/issues/1903
,2021-6/11,Auto rollback for addColumn with foreign key contraints fails,https://github.com/liquibase/liquibase/issues/1904
2021-7/22,2021-6/15,4.4.0 CLI no longer seems to support -Dproperty=value syntax for substitution,https://github.com/liquibase/liquibase/issues/1907
2021-7/22,2021-6/16,Command updateTestingRollback,https://github.com/liquibase/liquibase/issues/1909
2021-8/31,2021-6/16,Classpath scan time lapse for every included changelog file,https://github.com/liquibase/liquibase/issues/1913
2021-6/17,2021-6/17,sql changeset - endDelimiter not working with yml file,https://github.com/liquibase/liquibase/issues/1914
2022-1/4,2021-6/18,From Version 4.3.2 on change-log file is found twice in classpath,https://github.com/liquibase/liquibase/issues/1916
,2021-6/21,Failed to insert a row into DATABASECHANGELOG in MySQL Group Replication,https://github.com/liquibase/liquibase/issues/1918
2021-10/11,2021-6/21,Liquibase formatted SQL changeset is skipped,https://github.com/liquibase/liquibase/issues/1919
2021-7/22,2021-6/21,Changelog validation fails on addDefaultValue with defaultValue='',https://github.com/liquibase/liquibase/issues/1920
,2021-6/23,addLookupTable changetype generates wrong query against Apache Derby DB,https://github.com/liquibase/liquibase/issues/1922
2021-10/7,2021-6/23,`snapshot` command produces empty snapshot,https://github.com/liquibase/liquibase/issues/1930
2021-10/29,2021-6/24,dropPrimaryKey fails on PostgreSQL,https://github.com/liquibase/liquibase/issues/1933
,2021-6/24,Transaction starts too early to end up in idle-in-transaction timeout since Liquibase 3.10,https://github.com/liquibase/liquibase/issues/1937
2022-5/23,2021-6/25,Illegal char warnings on Windows when using wildcard classpath,https://github.com/liquibase/liquibase/issues/1940
,2021-6/25,Support for BigQuery,https://github.com/liquibase/liquibase/issues/1942
2021-7/28,2021-6/28,Performance regression between 4.4.0 and 4.3.5,https://github.com/liquibase/liquibase/issues/1945
,2021-6/28,Postgresql `smallserial` is not handled like serial and bigserial,https://github.com/liquibase/liquibase/issues/1946
,2021-6/29,The diff on MSSQL views may result in false discrepancies,https://github.com/liquibase/liquibase/issues/1949
2022-7/6,2021-6/29,Liquibase updateSQL command doesn't generate query for DropAllForeignKeyConstraints change type,https://github.com/liquibase/liquibase/issues/1951
,2021-6/30,issues with liquibase diff when testing with azure sql server 12 - Adventure Works  example database ,https://github.com/liquibase/liquibase/issues/1958
2021-10/22,2021-6/30,"Change includeAll errorIfMissingOrEmpty default in XML to ""true""",https://github.com/liquibase/liquibase/issues/1960
2021-7/9,2021-7/1,UpdateTestingRollback not working with Liquibase 4.4.0,https://github.com/liquibase/liquibase/issues/1961
2021-10/29,2021-7/1, extends NumberType not working on version 4.4,https://github.com/liquibase/liquibase/issues/1962
2021-12/7,2021-7/2,Liquibase-core includes a shaded jackson-databind,https://github.com/liquibase/liquibase/issues/1965
,2021-7/4,Diff Command Works But Diff-Changelog And Generate-Changelog Fails,https://github.com/liquibase/liquibase/issues/1966
2021-8/19,2021-7/5,includeAll path with xml Changelog,https://github.com/liquibase/liquibase/issues/1967
,2021-7/10,"""dropAllForeignKeyConstraints"" doesn't drop all duplicated foreign keys in a table if duplicated foreign keys use the same column",https://github.com/liquibase/liquibase/issues/1976
2021-7/14,2021-7/12,unable to run liquibase genreateLog with difftype=storedprocedure java.lang.Long cannot be cast to java.math.BigInteger,https://github.com/liquibase/liquibase/issues/1977
,2021-7/12,Liquibase failed when apostrophe char in table container name,https://github.com/liquibase/liquibase/issues/1978
2021-10/7,2021-7/12,Full classpath scanned even if provided ResourceAccessor finds schema files,https://github.com/liquibase/liquibase/issues/1979
2022-3/2,2021-7/13,objectQuotingStrategy QUOTE_ALL_OBJECTS not working as intended,https://github.com/liquibase/liquibase/issues/1982
2021-11/24,2021-7/14,loadData performance degredation between v4.0.0 and 4.4.0,https://github.com/liquibase/liquibase/issues/1984
2021-11/15,2021-7/14,Getting error by using unexpectedChangeSets command.,https://github.com/liquibase/liquibase/issues/1987
2021-11/16,2021-7/15,Invalid Yaml throws ClassCastExceptions,https://github.com/liquibase/liquibase/issues/1988
2021-11/23,2021-7/17,"""No Cycle"" SQL syntax is not cross-DB compatible",https://github.com/liquibase/liquibase/issues/1990
2021-11/12,2021-7/20,PostgreSQL NUMERIC[] datatype is not generated properly with the generateChangeLog command,https://github.com/liquibase/liquibase/issues/1995
2021-10/11,2021-7/21,UniqueConstraintSnapshotGenerator (bulk query) broken for Postgres (all non-MySQL?) in 4.4.1,https://github.com/liquibase/liquibase/issues/1996
2021-10/28,2021-7/22,"Postgres: deleteCascade=""true"" works when inlined in <createTable>, but not in <addForeignKeyConstraint>",https://github.com/liquibase/liquibase/issues/1997
,2021-7/22,Snapshots should include duplicate constraints that are named differently.,https://github.com/liquibase/liquibase/issues/1998
2021-10/20,2021-7/23,4.4.2 CLI considers the applied changes as not applied when using liquibaseSchemaName.,https://github.com/liquibase/liquibase/issues/2000
,2021-7/23,Allow property file loading from changelog path,https://github.com/liquibase/liquibase/issues/2002
2021-8/3,2021-7/26,setColumnRemarks change type is not working for MySQL and MariaDB,https://github.com/liquibase/liquibase/issues/2003
,2021-7/26,Add support for directly logging via log4j,https://github.com/liquibase/liquibase/issues/2004
2021-10/20,2021-7/27,Bundle standard JDBC drivers with Liquibase CLI,https://github.com/liquibase/liquibase/issues/2007
,2021-7/28,"Provide a way to specify ""connection setup"" SQL",https://github.com/liquibase/liquibase/issues/2008
2022-5/23,2021-7/29,foreignKeyConstraintExists fails with CS collation MSSQL Server DB,https://github.com/liquibase/liquibase/issues/2009
2021-10/7,2021-7/29,parsing XML changelog spends 1 minute looking for dbchangelog-3.1.xsd in every jar,https://github.com/liquibase/liquibase/issues/2010
,2021-7/30,data about insert the file isn't shows up correctly when execute updateSQL.,https://github.com/liquibase/liquibase/issues/2011
,2021-8/1,Liquibase rolls back a change whose exectype is “MARK_RAN”,https://github.com/liquibase/liquibase/issues/2013
,2021-8/2,Liquibase generates dropdefault change set when nothing has changed,https://github.com/liquibase/liquibase/issues/2014
,2021-8/3,Liquibase unexpected-changesets verbose flag requires value.,https://github.com/liquibase/liquibase/issues/2016
,2021-8/3,Create ThreadLocal ScopeManager,https://github.com/liquibase/liquibase/issues/2018
2021-11/5,2021-8/5,`onDelete` property ignored for MySQL,https://github.com/liquibase/liquibase/issues/2022
,2021-8/5,Bad query generated for loadUpdateData change type for Apache Derby and Cockroach DB,https://github.com/liquibase/liquibase/issues/2023
,2021-8/9,`DATABASECHANGELOGLOCK` column `LOCKGRANTED` does not use timezone,https://github.com/liquibase/liquibase/issues/2029
2022-8/18,2021-8/11,setDefaultSchema does not work . All changesets getting executed against public schema.,https://github.com/liquibase/liquibase/issues/2030
,2021-8/12,JSON operator '?' is incorrectly handled by liquibase in recent version,https://github.com/liquibase/liquibase/issues/2032
2022-8/10,2021-8/13,generateChangeLog does not output schema name on Postgres.,https://github.com/liquibase/liquibase/issues/2035
2021-12/22,2021-8/16,MySQL Datatype incorrectly applied TINYINT(1) -> BIT(1),https://github.com/liquibase/liquibase/issues/2037
2021-8/16,2021-8/16,"Vertica update fails with ""DATABASECHANGELOG"" already exists",https://github.com/liquibase/liquibase/issues/2038
,2021-8/17,"BUG Not preserving endline after -- style comments, fails to compile",https://github.com/liquibase/liquibase/issues/2039
2021-8/27,2021-8/20,liquibaseCatalogName not include in generated SQL,https://github.com/liquibase/liquibase/issues/2042
2021-12/1,2021-8/23,Generating changelog fails for MSSQL 2019 when sys.synonyms exist,https://github.com/liquibase/liquibase/issues/2044
,2021-8/24,MySQL/MariaDB: NCLOB-column: character set is utf8 instead of utf8mb4,https://github.com/liquibase/liquibase/issues/2045
2022-3/16,2021-8/25,"Liquibase generateChangeLog with --includeSchema=schema1,schema2 and --schemas doesn't prefix schema names for Postgres ",https://github.com/liquibase/liquibase/issues/2046
2022-3/20,2021-8/25,Liquibase scans the whole filesystem looking for .xml files when running a spring boot decomposed app with JarLauncher,https://github.com/liquibase/liquibase/issues/2048
,2021-8/26,NullPointerException in DataTypeFactory.java:266,https://github.com/liquibase/liquibase/issues/2049
,2021-8/27,"Liquibase doesn't recognize Database ""SAP IQ"" on update",https://github.com/liquibase/liquibase/issues/2051
