['closedAt'],['createdAt'],['title'],['url']
,2022-2/24,New index not detected by diff and diffchangelog on DBpostgres,https://github.com/liquibase/liquibase/issues/2578
,2022-2/24,Running update with scriptWriter marks changesets as run,https://github.com/liquibase/liquibase/issues/2579
2022-3/12,2022-2/25,Issue updating older md5 checksums,https://github.com/liquibase/liquibase/issues/2580
,2022-2/27,Support Bundle Capability,https://github.com/liquibase/liquibase/issues/2581
,2022-3/1,Add support for runOrder on formatted sql files,https://github.com/liquibase/liquibase/issues/2584
2022-6/27,2022-3/1,"The <property /> definition for column type does not work in version 4.8.0, which works well in 3.x.x",https://github.com/liquibase/liquibase/issues/2586
2022-5/25,2022-3/3,ENUMs are combined when pulling a snapshot if two databases have tables with the same name. ,https://github.com/liquibase/liquibase/issues/2594
,2022-3/4,loadData file case change on Windows causes checksum to fail,https://github.com/liquibase/liquibase/issues/2601
2022-7/6,2022-3/6,diffChangeLog on fields with a comment cause 'default' and 'null' to flip flop,https://github.com/liquibase/liquibase/issues/2607
2022-3/8,2022-3/8,Can not use liquibase jar on command line anymore,https://github.com/liquibase/liquibase/issues/2612
,2022-3/8,LONG columns in Oracle dictionary tables causing “Stream has already been closed” Exception,https://github.com/liquibase/liquibase/issues/2613
2022-8/10,2022-3/9,Liquibase generatechangelog command is not generating sequences for postgre db,https://github.com/liquibase/liquibase/issues/2619
2022-7/25,2022-3/9,handling of changeset filenames with special characters (e.g. german umlauts) fails in (at least) command line since v4,https://github.com/liquibase/liquibase/issues/2620
2022-7/25,2022-3/9,Stackoverflow occurred (difficult to diagnose) when accidentally leaving .sql suffix off file.,https://github.com/liquibase/liquibase/issues/2621
,2022-3/9,Add option to executeCommand not to show command in case of an exception,https://github.com/liquibase/liquibase/issues/2622
2022-7/13,2022-3/9,Different checksums are being calculated in different environments when changeSet has `valueDate` attribute,https://github.com/liquibase/liquibase/issues/2624
,2022-3/10,ReNameView does not produce correct rollback if using a non-default schema.,https://github.com/liquibase/liquibase/issues/2626
2022-3/30,2022-3/10,Unexpected datatype NULL with mariadb-java-client 3.0.3,https://github.com/liquibase/liquibase/issues/2627
2022-7/25,2022-3/10,Error reading changelog file: Found 2 files that match,https://github.com/liquibase/liquibase/issues/2628
2022-7/20,2022-3/10,Provide Liquibase jar without packaged dependencies and pro packages,https://github.com/liquibase/liquibase/issues/2629
2022-4/19,2022-3/10,Liquibase fails to start with a Nullpointer exception when Environment contains an empty string Key,https://github.com/liquibase/liquibase/issues/2631
2022-4/18,2022-3/11,Default logger does not handle null package names,https://github.com/liquibase/liquibase/issues/2633
2022-4/13,2022-3/11,MySQL/MariaDB column remark in `createTable` drops column `NOT NULL` and default value,https://github.com/liquibase/liquibase/issues/2634
,2022-3/11,Incorrect query when adding serial / int column with autoIncrement=true while convertDataTypes=false,https://github.com/liquibase/liquibase/issues/2635
,2022-3/14,Clarify 'validate' or introduce 'dryrun' option?,https://github.com/liquibase/liquibase/issues/2639
2022-5/13,2022-3/14,Changesets containing plain sql-scripts are executed in postgres public schema but not in the configured liquibase default schema since 4.5.0,https://github.com/liquibase/liquibase/issues/2640
,2022-3/16,"SQLite regression bug after Liquibase 4.8.0 release. Generated sql syntax errors for addAutoIncrement, addDefaultValue, dropColumn, mergeColumns",https://github.com/liquibase/liquibase/issues/2644
2022-3/21,2022-3/16,Multi Line incompatibility between versions 3 and 4,https://github.com/liquibase/liquibase/issues/2647
2022-3/23,2022-3/16,Liquibase.jar does not have MANIFEST.MF as the 2nd entry in the archive,https://github.com/liquibase/liquibase/issues/2648
,2022-3/16,Column constraints block should accept clustered attribute,https://github.com/liquibase/liquibase/issues/2649
2022-7/16,2022-3/18,The **nullable** and **defaultValue** and **value** attributes do not work together as one,https://github.com/liquibase/liquibase/issues/2652
2022-3/18,2022-3/18,"Failed to read schema document 'dbchangelog-3.8.xsd', because 'file' access is not allowed due to restriction set by the accessExternalSchema property",https://github.com/liquibase/liquibase/issues/2654
2022-8/8,2022-3/20,defaultValue is not set on non-nullable columns when value is also specified,https://github.com/liquibase/liquibase/issues/2657
2022-6/27,2022-3/21,abosulte path of change log file given from tomcat context is not working and giving an issue that absolute path not supported from liquibase 4.0,https://github.com/liquibase/liquibase/issues/2658
,2022-3/21,"Precondition tableExists crashes on H2 with objectQuotingStrategy=LEGACY, if a camelCaseView already exists.",https://github.com/liquibase/liquibase/issues/2659
2022-3/22,2022-3/21,Cassandra Liquibase DB Migration,https://github.com/liquibase/liquibase/issues/2661
,2022-3/22, Unexpected error running Liquibase: jakarta/persistence/EntityManager,https://github.com/liquibase/liquibase/issues/2662
2022-4/19,2022-3/22,NullPointerException on startup /w whitespace system environment variable,https://github.com/liquibase/liquibase/issues/2664
,2022-3/22,Default schema is not recognized on latest version,https://github.com/liquibase/liquibase/issues/2665
,2022-3/23,SpringResourceAccessor.getCompletePath resolves sql resources incorrectly when changelog is in root,https://github.com/liquibase/liquibase/issues/2668
2022-3/23,2022-3/23,A long issue title goes here. It goes on and on and on and on and on and on and on and on and on and on and on and on and on and on and on and on and on and on and on and on and on and on and on and on and on and on and on and on and on and on and on and on to 250+,https://github.com/liquibase/liquibase/issues/2670
,2022-3/24,"When I was using sqlfile, there was ""\\"" in the execution statement, which was incorrectly recognized as an escape character.",https://github.com/liquibase/liquibase/issues/2671
2022-3/25,2022-3/24,4.9.0 MANIFEST.MF has invalid Import-Package instructions,https://github.com/liquibase/liquibase/issues/2672
2022-5/24,2022-3/24,Migration from 3.3.2 on 3.6.3. Changed sqlFile from old changeSet was re-run without errors.,https://github.com/liquibase/liquibase/issues/2673
2022-6/21,2022-3/24,In StandardChangeLogHistoryService  SnapshotGeneratorFactory.getInstance().getDatabaseChangeLogTable should return null id table not exist,https://github.com/liquibase/liquibase/issues/2674
,2022-3/24,"Loading CSV file with loadData into Derby DB results in error ""The data type '0' is not supported""",https://github.com/liquibase/liquibase/issues/2676
2022-4/15,2022-3/24,Incompatibility with Spring 4,https://github.com/liquibase/liquibase/issues/2677
2022-6/20,2022-3/24,customChange with any attribute fails due to SAXParseException,https://github.com/liquibase/liquibase/issues/2678
,2022-3/24,Create test for OSGI issues,https://github.com/liquibase/liquibase/issues/2680
2022-5/31,2022-3/24,Community Request: nobanner cli flag for CLI,https://github.com/liquibase/liquibase/issues/2681
,2022-3/26,Full path support for spring.liquibase.change-log,https://github.com/liquibase/liquibase/issues/2687
2022-8/1,2022-3/27,"Liquibase 4.9.0 and ""endDelimiter:/"" recognizes ""/"" used in PL/SQL code for calculation as changeset end delimiter",https://github.com/liquibase/liquibase/issues/2688
2022-4/4,2022-3/28,Liquibase stripping trailing 0 characters from changset identitiers,https://github.com/liquibase/liquibase/issues/2689
,2022-3/28,"SQL changeSet doesn't  honor ""--precondition-change-log-property-defined""",https://github.com/liquibase/liquibase/issues/2692
,2022-3/29,"diff option with condense of ""Change Stored Procedure(s)""",https://github.com/liquibase/liquibase/issues/2693
,2022-3/29,Liquibase does not wait for CockroachDB schema changes to complete,https://github.com/liquibase/liquibase/issues/2694
,2022-3/30,Support runWith executors committing after the change set completes,https://github.com/liquibase/liquibase/issues/2696
2022-5/10,2022-3/30,Liquibase for Db2z fails to read the view definitions using the diff command,https://github.com/liquibase/liquibase/issues/2700
2022-8/2,2022-3/30,"Liquibase creates table ""user"" in lower case for H2 database",https://github.com/liquibase/liquibase/issues/2701
2022-8/23,2022-3/30,ClassCastException: class java.util.BitSet cannot be cast to class java.lang.Boolean (java.util.BitSet and java.lang.Boolean,https://github.com/liquibase/liquibase/issues/2702
2022-4/13,2022-3/30,"autoIncrement=""true""  lose efficacy (DUPLICATE #2301)",https://github.com/liquibase/liquibase/issues/2703
2022-5/12,2022-4/1,Samples of changelog.xml in documenation have wrong path to xsd files,https://github.com/liquibase/liquibase/issues/2707
2022-7/28,2022-4/3,The diff command does not work with diffTypes=views for DB2Z,https://github.com/liquibase/liquibase/issues/2710
2022-7/28,2022-4/3,Error when calling a procedure with parameters on DB2Z,https://github.com/liquibase/liquibase/issues/2711
,2022-4/4,Need to suppress extra space generated in resulting scripts of changelog after we ran the changelog against MS SQL Server,https://github.com/liquibase/liquibase/issues/2713
,2022-4/4,"After upgrade from 4.3.5 to 4.9.1, change sets have different checksums.",https://github.com/liquibase/liquibase/issues/2714
2022-4/8,2022-4/4,Migration from 3.10.3 to 4.* failed,https://github.com/liquibase/liquibase/issues/2716
2022-6/27,2022-4/4,Liquibase Version 4.9+ not respecting the --schemas flag when generating diffChangeLog,https://github.com/liquibase/liquibase/issues/2717
2022-9/1,2022-4/4,Consider introducing a parameter-aware variant of `liquibase.sql.Sql`,https://github.com/liquibase/liquibase/issues/2721
2022-5/17,2022-4/5,"The type of attributes ""ordered"" and ""cycle"" should be boolean",https://github.com/liquibase/liquibase/issues/2724
2022-8/22,2022-4/6, liquibase-db2i startup error by creating database-change-log-table,https://github.com/liquibase/liquibase/issues/2727
,2022-4/6,CustomTaskChange fails for void return,https://github.com/liquibase/liquibase/issues/2729
,2022-4/7,createView with replaceIfExists no-longer (always) works against PostgreSQL (version 12.x),https://github.com/liquibase/liquibase/issues/2732
,2022-4/7,EDB PostgresSQL driver errors,https://github.com/liquibase/liquibase/issues/2734
2022-7/5,2022-4/7,Liquibase-core 4.9.1 includes a shaded jackson-databind 2.9.10.8,https://github.com/liquibase/liquibase/issues/2735
,2022-4/8,Change max value of @Size generates an empty changelog,https://github.com/liquibase/liquibase/issues/2736
2022-5/10,2022-4/8,CVE-2022-0839 downport fix to 3.x versions of liquibase,https://github.com/liquibase/liquibase/issues/2737
,2022-4/12,liquibase core tar.gz missing from maven central?,https://github.com/liquibase/liquibase/issues/2743
2022-4/13,2022-4/12,"no main manifest attribute, in liquibase-4.9.1.jar",https://github.com/liquibase/liquibase/issues/2744
,2022-4/13,Make XML schema definition `PreConditionChildren` extensible for extensions,https://github.com/liquibase/liquibase/issues/2750
,2022-4/13,Distribute CLI JAR with all dependencies,https://github.com/liquibase/liquibase/issues/2751
2022-5/18,2022-4/14,Performance regression in liquibase versions greater than 4.3.5,https://github.com/liquibase/liquibase/issues/2756
,2022-4/14,"Add support for command argument ""aliases""",https://github.com/liquibase/liquibase/issues/2762
,2022-4/20,logical-file-path not working with Liquibase Community 4.8.0,https://github.com/liquibase/liquibase/issues/2775
,2022-4/20,Postgres generateChangeLog includeSchema,https://github.com/liquibase/liquibase/issues/2776
2022-5/31,2022-4/21,AddColumnChange with schema and NOT NULL constraint fails,https://github.com/liquibase/liquibase/issues/2780
,2022-4/21,Diff changelog generates wrong script when renaming PK,https://github.com/liquibase/liquibase/issues/2782
2022-8/5,2022-4/22,Schema name not resolved when using sequence in defaultValueComputed,https://github.com/liquibase/liquibase/issues/2786
2022-4/27,2022-4/22,Update JDBC drivers to latest releases,https://github.com/liquibase/liquibase/issues/2788
,2022-4/25,"""includeAll"" Adds changeSet Two Times in updateSQL Mode",https://github.com/liquibase/liquibase/issues/2792
,2022-4/25,[PostgreSQL] generateChangeLog command generates prefixed schema name with includeSchema flag set to false for Formatted SQL,https://github.com/liquibase/liquibase/issues/2794
,2022-4/26,Change set always failed with `preConditions` contained `- foreignKeyConstraintExists` check,https://github.com/liquibase/liquibase/issues/2796
2022-8/30,2022-4/28,LoadData with Dates Failed while Column Type is From Property,https://github.com/liquibase/liquibase/issues/2803
,2022-4/29,addColumn for a table with underscore is broken in SQLite,https://github.com/liquibase/liquibase/issues/2806
,2022-4/29,Condition or not null columns for unique index ,https://github.com/liquibase/liquibase/issues/2808
2022-6/9,2022-4/29,Getting Errror in Liquibase 4.7.1,https://github.com/liquibase/liquibase/issues/2811
,2022-5/3,Upgrade lock not working correctly due to cache of `ranChangeSetList`,https://github.com/liquibase/liquibase/issues/2816
2022-6/21,2022-5/3,Load XSD files under OSGI,https://github.com/liquibase/liquibase/issues/2817
2022-6/30,2022-5/3,changelog is found twice in classpath,https://github.com/liquibase/liquibase/issues/2818
2022-6/9,2022-5/4,include labels attribute is not propagating labels,https://github.com/liquibase/liquibase/issues/2824
,2022-5/5,Invalid SQL for HSQLDB,https://github.com/liquibase/liquibase/issues/2826
2022-5/13,2022-5/9,"DAT-9663 Liquibase Snapshot/Diff fails on Postgres with datatype ""real"" with default value ""DEFAULT (0)::real""",https://github.com/liquibase/liquibase/issues/2833
2022-5/19,2022-5/12,Remove version from filenames in LIQUIBASE_HOME/lib,https://github.com/liquibase/liquibase/issues/2845
,2022-5/13,"Make the ""status"" command set to verbose by default",https://github.com/liquibase/liquibase/issues/2847
,2022-5/17,dropAll sometimes does not delete all tables,https://github.com/liquibase/liquibase/issues/2851
,2022-5/17,Move shaded libraries to be external dependencies,https://github.com/liquibase/liquibase/issues/2852
,2022-5/19,addCheckConstraint fails for CockroachDB with java.lang.IllegalStateException,https://github.com/liquibase/liquibase/issues/2857
2022-6/16,2022-5/19,beforeColumn is not working when column is the first one,https://github.com/liquibase/liquibase/issues/2861
2022-7/20,2022-5/20,"addAutoIncrement isn't working properly for HyperSQL, Mysql, MariaDB and H2",https://github.com/liquibase/liquibase/issues/2863
,2022-5/20,Postgresql diffChangeLog not quoting jsonb default,https://github.com/liquibase/liquibase/issues/2864
,2022-5/23,autoIncrementInformation in snapshot is not correct,https://github.com/liquibase/liquibase/issues/2867
2022-8/31,2022-5/24,Including a Dockerfile in your change log directory causes StackOverflowException,https://github.com/liquibase/liquibase/issues/2869
,2022-5/24,firebird needs schema specification to run liquibase drop-all,https://github.com/liquibase/liquibase/issues/2874
,2022-5/24,Upgrade Spock/JUnit/Groovy,https://github.com/liquibase/liquibase/issues/2876
2022-8/18,2022-5/25,java.lang.ClassCastException: java.time.LocalDateTime cannot be cast to java.lang.String,https://github.com/liquibase/liquibase/issues/2878
2022-7/28,2022-5/26,DB2Database has incorrect fractional precision for TimestampType,https://github.com/liquibase/liquibase/issues/2880
2022-6/9,2022-5/26,Context from databaseChangeLog is not added to DATABASECHANGELOG,https://github.com/liquibase/liquibase/issues/2883
2022-7/27,2022-5/30,foreignKeyConstraintExists precondition does not work in Oracle,https://github.com/liquibase/liquibase/issues/2893
,2022-5/31,Liquibase-core not able to create snapshot of small  case username/schema name for case-sensitive databases like Oracle,https://github.com/liquibase/liquibase/issues/2896
2022-6/21,2022-6/1,Performance regression in liquibase  version > 4.4.x ,https://github.com/liquibase/liquibase/issues/2899
,2022-6/3,Liquibase not able to create snapshot of a table if one more table with same name but with different case exists in that schema/catalog.,https://github.com/liquibase/liquibase/issues/2911
2022-7/4,2022-6/3,"Introduce ""searchPath"" setting separate from ""classpath""",https://github.com/liquibase/liquibase/issues/2916
2022-8/3,2022-6/6,precondition-sql-check raises liquibase.exception.ChangeLogParseException,https://github.com/liquibase/liquibase/issues/2918
2022-6/9,2022-6/6,OSGi headers missing from liquibase-core 4.11.0,https://github.com/liquibase/liquibase/issues/2922
2022-6/10,2022-6/7,Liquibase fails to populate mariadb database,https://github.com/liquibase/liquibase/issues/2923
,2022-6/7,Liquibase could support `renameColumn` for Sqlite 3.25.0+,https://github.com/liquibase/liquibase/issues/2925
2022-6/13,2022-6/7,Add Snowflake driver to CLI,https://github.com/liquibase/liquibase/issues/2927
2022-7/12,2022-6/8,redshift does not work with 4.11 release,https://github.com/liquibase/liquibase/issues/2928
2022-6/10,2022-6/10,MANIFEST.MF is missing OSGi information since release 4.10,https://github.com/liquibase/liquibase/issues/2937
,2022-6/15,Not able to customize ShouldRunChangeSetFilter.normalizePath in 4.x ,https://github.com/liquibase/liquibase/issues/2948
,2022-6/16,Liquibase not finding schemas when running on Docker - case sensitivity issues?,https://github.com/liquibase/liquibase/issues/2950
2022-6/22,2022-6/16,Offline UpdateSQL for mariadb with csv doesn't handle boolean values correctly ?,https://github.com/liquibase/liquibase/issues/2951
2022-6/16,2022-6/16,Cannot specify `dbms` type `cockroach` in preconditions or sql,https://github.com/liquibase/liquibase/issues/2952
,2022-6/16,Conditional index wrongly generated with CLI generate-changelog command,https://github.com/liquibase/liquibase/issues/2953
2022-7/5,2022-6/16,Version 4.4.2 Creates Error When Running 'generateChangeLog' Command,https://github.com/liquibase/liquibase/issues/2954
,2022-6/17,Liquibase 4.7.0 does not quote (some ?) reserved H2 keywords in SQL changeset or where section of update changeset,https://github.com/liquibase/liquibase/issues/2965
,2022-6/17,Multi-threaded locking issue and scope errors,https://github.com/liquibase/liquibase/issues/2966
,2022-6/17,Integrate and configure OWASP Dependency Check,https://github.com/liquibase/liquibase/issues/2967
,2022-6/18,Publish Maven BOM,https://github.com/liquibase/liquibase/issues/2973
2022-7/20,2022-6/20,Add `Closeable`/`AutoCloseable` to the interface `liquibase.database.Database`,https://github.com/liquibase/liquibase/issues/2974
,2022-6/21,mvn liquibase:dropAll does not drop anything (much),https://github.com/liquibase/liquibase/issues/2977
2022-8/22,2022-6/21,Original exception is swallowed when liquibase fails to create connection to db,https://github.com/liquibase/liquibase/issues/2978
2022-6/28,2022-6/21,Liquibase started to throw exception after upgrading to version 4.12.0,https://github.com/liquibase/liquibase/issues/2980
2022-9/6,2022-6/21,loaddata command fails when importing data from a CSV into a h2 database with columns of type date,https://github.com/liquibase/liquibase/issues/2982
,2022-6/21,Property database.defaultSchemaNamePrefix has wrong format,https://github.com/liquibase/liquibase/issues/2983
2022-6/28,2022-6/22,"Infinite Loop in ExpressionExpander, if property name same as environment variable",https://github.com/liquibase/liquibase/issues/2988
,2022-6/22,liquibase:diff results not written to diffChangeLogFile,https://github.com/liquibase/liquibase/issues/2989
,2022-6/22,move dependency java.xml.bind to jakarta.xml.bind,https://github.com/liquibase/liquibase/issues/2991
,2022-6/22,loadData doesn't work under OSGI (Karaf 4.3.6),https://github.com/liquibase/liquibase/issues/2992
,2022-6/22,FormattedSqlChangeLogParser does not handle multiline comments,https://github.com/liquibase/liquibase/issues/2993
2022-7/1,2022-6/23,"Snowflake on JDK17 fails with ""Object 'DATABASECHANGELOGLOCK' already exists.""",https://github.com/liquibase/liquibase/issues/3000
,2022-6/24,Liquibase escaping the string in the apostrophes and messing up the entire code,https://github.com/liquibase/liquibase/issues/3002
2022-6/27,2022-6/24,Liquibase Distribution distinction between OSS vs commerical,https://github.com/liquibase/liquibase/issues/3005
2022-7/1,2022-6/27,Could not initialize class net.snowflake.client.jdbc.internal.apache.arrow.memory.RootAllocator,https://github.com/liquibase/liquibase/issues/3011
,2022-6/28,Liquibase Throws Lexical While Processing Thai Charaters,https://github.com/liquibase/liquibase/issues/3013
2022-8/5,2022-6/28,"Liquibase ignores the string after first closing brace for sql that contains ""${string}}""",https://github.com/liquibase/liquibase/issues/3014
2022-7/27,2022-6/29,Liquibase sql comment validation bug,https://github.com/liquibase/liquibase/issues/3017
,2022-6/30,property in databaseChangeLog unparseable when in json,https://github.com/liquibase/liquibase/issues/3023
2022-6/30,2022-6/30,Liquibase not parsing the SQL correctly,https://github.com/liquibase/liquibase/issues/3024
2022-9/1,2022-6/30,Liquibase errors with a formatting error on sql changelog files when it contains a word property,https://github.com/liquibase/liquibase/issues/3025
,2022-7/1,Liquibase 4.x changed behaviour with include tag in changeset,https://github.com/liquibase/liquibase/issues/3028
,2022-7/1,Trigger Change Types return incorrect error message for CockroachDB ,https://github.com/liquibase/liquibase/issues/3030
,2022-7/1,New Feature: Implement Change Type pro:markUnused for CockroachDB,https://github.com/liquibase/liquibase/issues/3031
,2022-7/1,Liquibase cannot determine constraint exists with given name,https://github.com/liquibase/liquibase/issues/3032
,2021-12/22,For snowflake tables having float datatype diff-changelog is generating the datatype as DOUBLE(0),https://github.com/liquibase/liquibase/issues/3035
,2021-8/27,liquibaseCatalogName not include in generated SQL,https://github.com/liquibase/liquibase/issues/3036
2022-7/12,2022-7/5,Liquibase throwing error on script that works in SQLcl and on the previous liquibase version against Oracle Database,https://github.com/liquibase/liquibase/issues/3040
2022-7/12,2022-7/5,Changeset Consistency Naming conventions,https://github.com/liquibase/liquibase/issues/3041
,2022-7/6,Create docs PR for searchPath #2917,https://github.com/liquibase/liquibase/issues/3043
,2022-7/6,Docs for  Added new liquibase.duplicateFileMode setting #3006,https://github.com/liquibase/liquibase/issues/3044
,2022-7/8,The FormattedSqlChangeLogSerializer does not include runOnChange and runAlways-attributes,https://github.com/liquibase/liquibase/issues/3049
,2022-7/11,reserved key words are not quoted in yaml format for where clause ,https://github.com/liquibase/liquibase/issues/3051
2022-8/18,2022-7/11,Wrong documentation: contextFilter is not a valid attribute,https://github.com/liquibase/liquibase/issues/3052
,2022-7/11,Snapshot & Diff between file and db from url | Postgresql : btree index created on multiple columns with basic WHERE condition is treated as a difference (incorrectly snapshotted),https://github.com/liquibase/liquibase/issues/3053
,2022-7/12,Meaningless error message when changelog file is missing a file ending,https://github.com/liquibase/liquibase/issues/3055
,2022-7/13,java.lang.ArrayIndexOutOfBoundsException: Index -1 for SQL rollback,https://github.com/liquibase/liquibase/issues/3060
2022-7/16,2022-7/15,why docker liquibase，after run  liquibase，Cannot find Changelog.xml,https://github.com/liquibase/liquibase/issues/3066
,2022-7/15,Add Support for Snowflake HYBRID tables / SAP HANA Row & Column tables,https://github.com/liquibase/liquibase/issues/3067
,2022-7/15,How to specify an Empty Rollback using SQL Dialect,https://github.com/liquibase/liquibase/issues/3069
,2022-7/16,`liquibase.executor.jvm.ColumnMapRowMapper` does not consider `liquibase.database.AbstractJdbcDatabase#isCaseSensitive` ,https://github.com/liquibase/liquibase/issues/3071
,2022-7/18,Setting secureParsing=false for >= 4.8 version in a Spring Boot application ,https://github.com/liquibase/liquibase/issues/3072
,2022-7/18,liquibaseSchemaName parameter not working with Redshift,https://github.com/liquibase/liquibase/issues/3075
,2022-7/19,"the database name is hardcoded into the StartH2CommandStep, why  not reading simply the liquibase.properties file after setting the values ?",https://github.com/liquibase/liquibase/issues/3077
,2022-7/19,MySQL - liquibase update does not wrap generated default value expressions in parantheses in field definitions,https://github.com/liquibase/liquibase/issues/3082
,2022-7/19,MySQL - mvn liquibase:generateChangeLog attempts to give JSON field definition a size,https://github.com/liquibase/liquibase/issues/3083
2022-8/23,2022-7/20,Not able to connect MSSQL database server from the command line,https://github.com/liquibase/liquibase/issues/3090
,2022-7/20,restore best-effort behavior of afterColumn,https://github.com/liquibase/liquibase/issues/3091
,2022-7/21,Liquibase 4.13.0 breaks migration using 'addAtPosition' on h2,https://github.com/liquibase/liquibase/issues/3094
