"['title']","['createdAt']","['closedAt']","['publishedAt']","['merged']","['mergedAt']"
"Remove .pp from Ruby extension list. Issue #5366","2016-7","2016-7","2016-7",True,"2016-7"
"Update to Electron 1.x","2016-7","2016-7","2016-7",True,"2016-7"
"Add Selection To Previous Find Match","2016-7","2016-7","2016-7",True,"2016-7"
"Enable file actions in search results viewlet","2016-7","2016-9","2016-7",False,"null"
"docs(LanguageConfiguration): fix typo (interfaces --> interface)","2016-7","2016-7","2016-7",True,"2016-7"
"shut up asar","2016-7","2016-7","2016-7",True,"2016-7"
"Fix did not removed css class dropfeedback","2016-7","2016-7","2016-7",True,"2016-7"
"Fixes #6938: Integrated terminal non-falsey shell exit codes should be reported to the UI, not just the console","2016-7","2016-7","2016-7",True,"2016-7"
"replace settings variables in debugger config #8042","2016-7","2016-7","2016-7",True,"2016-7"
"Fix extension install when drop into code","2016-7","2016-7","2016-7",True,"2016-7"
"Fixes #8794","2016-7","2016-7","2016-7",False,"null"
"Fixes #7500: Only update CSS if needed","2016-7","2016-7","2016-7",True,"2016-7"
"Replaced README image of product to reflect new UI","2016-7","2016-7","2016-7",True,"2016-7"
"Tyriar/cli help format","2016-7","2016-7","2016-7",True,"2016-7"
"Fixes mousewheel zoom in case of inline diff view","2016-7","2016-7","2016-7",True,"2016-7"
"Fixes invisible cursor in long editor lines","2016-7","2016-7","2016-7",True,"2016-7"
"Fixes #8617: Use native EOL sequence","2016-7","2016-7","2016-7",True,"2016-7"
"Exploration","2016-7","2016-7","2016-7",False,"null"
"Fixes #7346: Paste native EOL","2016-7","2016-7","2016-7",True,"2016-7"
"Fix context menu redundant separator","2016-7","2016-7","2016-7",False,"null"
"Fix window title prefixDecoration","2016-7","2016-7","2016-7",False,"null"
"Add a little top-padding on the editor container","2016-7","2016-7","2016-7",False,"null"
"Git Commit.Template, Restore Previous Commit Msg On Undo","2016-7","2016-7","2016-7",True,"2016-7"
"Fixes #7301: Set LANG for terminal process","2016-7","2016-7","2016-7",True,"2016-7"
"Variable Substitution Relative Path","2016-7","2016-7","2016-7",True,"2016-7"
"Emmet: Encode\Decode action & preferences","2016-7","2016-10","2016-7",False,"null"
"Fix sensitivity not always being applied.","2016-7","2016-7","2016-7",True,"2016-7"
"Inline SVG images during build","2016-7","2016-7","2016-7",True,"2016-7"
"Addition of GO INTO T-SQL syntax","2016-7","2016-7","2016-7",False,"null"
"Add mouse-keyboard event crossover to prevent menu bar from showing up after multi-selecting.","2016-7","2016-8","2016-7",True,"2016-8"
"Migrate EditorActions wrt context menu","2016-7","2016-7","2016-7",True,"2016-7"
"Add editor description to tab titles","2016-7","2016-8","2016-7",False,"null"
"Fix debounceEvent","2016-7","2016-7","2016-7",True,"2016-7"
"Clean up side by side container","2016-7","2016-7","2016-7",True,"2016-7"
"Added new commands to allow finer-grain line navigation","2016-7","2017-9","2016-7",False,"null"
"Master","2016-7","2016-7","2016-7",False,"null"
"Collect telemetry for #55","2016-7","2016-7","2016-7",True,"2016-7"
"Fixes #7749 - Focus on CodeLens click","2016-7","2016-8","2016-7",True,"2016-8"
"reparent editor container for #8579","2016-7","2016-7","2016-7",True,"2016-7"
"Fix task schema suppressTaskName and echoCommand defaultValue.","2016-7","2019-10","2016-7",False,"null"
"Folding icon collides with git decorations: Create a div per linedecoration","2016-7","2016-7","2016-7",True,"2016-7"
"C syntax - Match for pointer access added to c.json","2016-7","2016-7","2016-7",False,"null"
"Introduce a move command for the editor","2016-7","2016-7","2016-7",True,"2016-7"
"Auto indenting python code","2016-7","2016-7","2016-7",True,"2016-7"
"Fix typo","2016-7","2016-7","2016-7",True,"2016-7"
"Remove terminal focus command","2016-7","2016-8","2016-7",False,"null"
"#55: Batch results for IPC","2016-7","2016-7","2016-7",True,"2016-7"
"Follow and watch settings.json single-level symlinks","2016-7","2016-8","2016-7",True,"2016-8"
"Allow workspaceContains to specify directories (fixes #8295).","2016-7","2016-8","2016-7",True,"2016-8"
"Support IMEs in integrated terminal","2016-7","2016-7","2016-7",True,"2016-7"
"Add a context menu to the terminal","2016-7","2016-7","2016-7",True,"2016-7"
"Added more T-SQL keywords","2016-7","2016-7","2016-7",True,"2016-7"
"[Terminal] Run entire text if selection is empty","2016-7","2016-8","2016-7",True,"2016-8"
"fixes glibc dep issue on rhel 6","2016-7","2016-7","2016-7",False,"null"
"Added missing ""rem"" unit","2016-7","2016-7","2016-7",True,"2016-7"
"Fixes #9482: AutoClosePair between tags","2016-7","2016-9","2016-7",False,"null"
"Implement lineViewTop, lineViewBottom, lineViewCenter","2016-7","2016-7","2016-7",True,"2016-7"
"Fix minor spelling mistake in comment: Iff > If","2016-7","2016-7","2016-7",True,"2016-7"
"#55: Add performance test for QuickOpen","2016-7","2016-7","2016-7",True,"2016-7"
"registerDocumentLinkProvider","2016-7","2016-7","2016-7",True,"2016-7"
"Replace deprecated __ language APIs with language-configuration alternative","2016-7","2016-7","2016-7",True,"2016-7"
"#55: Improve result sorting performance","2016-7","2016-7","2016-7",True,"2016-7"
"Folding end pattern for C based languages","2016-7","2016-10","2016-7",False,"null"
"Bold markdown headings for accessibility","2016-7","2016-7","2016-7",True,"2016-7"
"Add file walk telemetry","2016-7","2016-7","2016-7",True,"2016-7"
"Fixes for PowershellSyntax.tmLanguage","2016-7","2016-7","2016-7",True,"2016-7"
"Detect shebang for Groovy files","2016-7","2016-8","2016-7",True,"2016-8"
"Incrementally post-process unsorted results","2016-7","2017-1","2016-7",False,"null"
"Addresses #3690 high-contrast less hacky in editor","2016-7","2016-8","2016-7",True,"2016-8"
"Travis builds post coverage info to coveralls.io and add README badge.","2016-7","2016-8","2016-7",True,"2016-8"
"Restore Previous Commit Message on Undo Last Commit","2016-7","2016-8","2016-7",True,"2016-8"
"Add emmet support for .pug files","2016-7","2016-7","2016-7",True,"2016-7"
"Improve evaluate on hover feature.","2016-7","2016-8","2016-7",True,"2016-8"
"Fix #9922: Roll back PowerShell syntax definition","2016-7","2016-7","2016-7",True,"2016-7"
"Debug: Allow click to show getter property value","2016-7","2016-8","2016-7",False,"null"
"Update default project.json TFMs","2016-7","2016-8","2016-7",False,"null"
"Check if adapter is null and let it print errors","2016-7","2016-8","2016-7",True,"2016-8"
"A file open with auto-detected encoding.","2016-8","2016-8","2016-8",False,"null"
"add `resolveWorkspaceSymbol`","2016-8","2016-8","2016-8",True,"2016-8"
"add custom link provider for vscode.d.ts","2016-8","2016-8","2016-8",True,"2016-8"
"refine DocumentLinkProvider","2016-8","2016-8","2016-8",True,"2016-8"
"Remove comma from not allowed characters in capture group","2016-8","2016-8","2016-8",False,"null"
"Modification to the VS code startup batch file for #7619","2016-8","2016-8","2016-8",False,"null"
"Sort and limit file results in search process","2016-8","2016-8","2016-8",False,"null"
"Modification to the VS code startup batch file for #7619","2016-8","2016-8","2016-8",False,"null"
"Support CompletionItemKind.Method","2016-8","2016-8","2016-8",True,"2016-8"
"Updated package extensions to associate files","2016-8","2016-8","2016-8",False,"null"
"don't auto close on single quote","2016-8","2016-8","2016-8",True,"2016-8"
"removed ocaml extensions","2016-8","2016-8","2016-8",True,"2016-8"
"Update to Electron 1.x","2016-8","2016-8","2016-8",False,"null"
"Fix show in IE11","2016-8","2016-8","2016-8",True,"2016-8"
"Make text edits more minimal","2016-8","2016-8","2016-8",True,"2016-8"
"Implement terminal scroll bar","2016-8","2016-8","2016-8",False,"null"
"Fix flipping axes behavior.","2016-8","2016-8","2016-8",True,"2016-8"
"Add .bash_aliases to ShellScript extensions","2016-8","2016-8","2016-8",False,"null"
"Added bash_aliases to fileTypes","2016-8","2016-8","2016-8",False,"null"
"Dispose editors that get hidden to tackle context issues","2016-8","2016-8","2016-8",False,"null"
"Spelling problem fixed...","2016-8","2016-8","2016-8",True,"2016-8"
"fix clearTimeout","2016-8","2016-8","2016-8",True,"2016-8"
"Git commit using '--signoff'","2016-8","2016-8","2016-8",True,"2016-8"
